Title,Year,Genres,Rating,Runtime,Director,Writer,Actors,Plot,Language,Country
Mary Magdalene,2018,"Drama, History",6.292,120,Garth Davis,Helen Edmundson,"Rooney Mara, Joaquin Phoenix, Chiwetel Ejiofor","In the first century, free-spirited Mary Magdalene flees the marriage her family has arranged for her, finding refuge and a sense of purpose in a radical new movement led by the charismatic, rabble-rousing preacher named Jesus.",en,"US, GB, AU"
A-X-L,2018,"Science Fiction, Action, Adventure, Family",6.282,98,Oliver Daly,Oliver Daly,"Alex Neustaedter, Becky G, Alex MacNicoll",The life of a teenage boy is forever altered by a chance encounter with cutting edge military technology.,en,US
Johnny English Strikes Again,2018,"Action, Adventure, Comedy",6.265,89,David Kerr,William Davies,"Rowan Atkinson, Olga Kurylenko, Ben Miller","Disaster strikes when a criminal mastermind reveals the identities of all active undercover agents in Britain. The secret service can now rely on only one man - Johnny English. Currently teaching at a minor prep school, Johnny springs back into action to find the mysterious hacker. For this mission to succeed, he’ll need all of his skills - what few he has - as the man with yesterday’s analogue methods faces off against tomorrow’s digital technology.",en,GB
Time Trap,2018,"Science Fiction, Adventure",6.26,87,Ben Foster,Mark Dennis,"Andrew Wilson, Cassidy Gifford, Brianne Howey",A group of students become trapped inside a mysterious cave where they discover time passes differently underground than on the surface.,en,US
Insidious: The Last Key,2018,"Horror, Thriller",6.252,103,Adam Robitel,Leigh Whannell,"Lin Shaye, Leigh Whannell, Angus Sampson","Parapsychologist Elise Rainier and her team travel to Five Keys, NM, to investigate a man’s claim of a haunting. Terror soon strikes when Rainier realizes that the house he lives in was her family’s old home.",en,US
Unsane,2018,"Horror, Thriller",6.251,98,Steven Soderbergh,,"Claire Foy, Joshua Leonard, Jay Pharoah",A woman is involuntarily committed to a mental institution where she is confronted by her greatest fear.,en,US
Mortal Engines,2018,"Adventure, Science Fiction",6.215,128,Christian Rivers,,"Hera Hilmar, Robert Sheehan, Hugo Weaving","Many thousands of years in the future, Earth’s cities roam the globe on huge wheels, devouring each other in a struggle for ever diminishing resources. On one of these massive traction cities, the old London, Tom Natsworthy has an unexpected encounter with a mysterious young woman from the wastelands who will change the course of his life forever.",en,"NZ, US"
Accident Man,2018,"Action, Crime, Thriller",6.2,101,Jesse V. Johnson,Scott Adkins,"Scott Adkins, Ray Stevenson, Ashley Greene","Mike Fallon, the Accident Man, is a stone cold killer.  When a loved one is murdered by his own crew, Fallon is forced to avenge the one person who actually meant something to him.",en,"US, GB"
Death Race: Beyond Anarchy,2018,"Action, Thriller, Science Fiction",6.2,111,Don Michael Paul,,"Danny Trejo, Zach McGowan, Danny Glover",Black Ops specialist Connor Gibson infiltrates a maximum security prison to take down legendary driver Frankenstein in a violent and brutal car race.,en,US
Prospect,2018,Science Fiction,6.2,98,Zeek Earl,,"Sophie Thatcher, Pedro Pascal, Jay Duplass","A teenage girl and her father travel to a remote alien moon, aiming to strike it rich. They've secured a contract to harvest a large deposit of the elusive gems hidden in the depths of the moon's toxic forest. But there are others roving the wilderness and the job quickly devolves into a fight to survive.",en,"CA, US"
Mile 22,2018,"Action, Thriller",6.2,94,Peter Berg,,"Mark Wahlberg, Lauren Cohan, Iko Uwais","An elite group of American operatives, aided by a top-secret tactical command team, must transport an asset who holds life-threatening information to an extraction point 22 miles away through the hostile streets of an Asian city.",en,US
Daphne & Velma,2018,"Comedy, Horror, Action, Crime",6.2,75,Suzi Yoonessi,Kyle Mack,"Sarah Jeffery, Sarah Gilman, Vanessa Marano","Before their eventual team-up with Scooby and the gang, bright and optimistic Daphne and whip-smart and analytical Velma are both mystery-solving teens who are best friends but have only met online - until now. Daphne has just transferred to Velma's school, Ridge Valley High, an incredible tech-savvy institute with all the latest gadgets provided by the school's benefactor, tech billionaire Tobias Bloom. And while competition is fierce among the students for a coveted internship at Bloom Innovative, Daphne and Velma dig beyond all the gadgets and tech to investigate what is causing some of the brightest students in school to disappear - only to emerge again in a zombie-fied state.",en,US
Death Wish,2018,"Action, Crime, Thriller, Drama",6.2,107,Eli Roth,,"Bruce Willis, Vincent D'Onofrio, Dean Norris",A mild-mannered father is transformed into a killing machine after his family is torn apart by a violent act.,en,US
The House with a Clock in Its Walls,2018,"Fantasy, Family, Comedy",6.2,105,Eli Roth,,"Jack Black, Cate Blanchett, Owen Vaccaro","When ten-year-old Lewis is suddenly orphaned, he is sent to live with his Uncle Jonathan in a creaky (and creepy) old mansion with a mysterious ticking noise that emanates from the walls. Upon discovering that his uncle is a warlock, Lewis begins learning magic, but when he rebelliously resurrects an evil warlock he must find the secret of the house and save the world from destruction.",en,US
Mandy,2018,"Fantasy, Action, Horror",6.191,122,Panos Cosmatos,Casper Kelly,"Nicolas Cage, Andrea Riseborough, Linus Roache","The Shadow Mountains, 1983. Red and Mandy lead a loving and peaceful existence; but when their pine-scented haven is savagely destroyed, Red is catapulted into a phantasmagoric journey filled with bloody vengeance and laced with fire.",en,US
Braven,2018,"Drama, Action, Thriller",6.185,94,Lin Oeding,Thomas Pa'a Sibbett,"Jason Momoa, Stephen Lang, Garret Dillahunt",A logger defends his family from a group of dangerous drug runners.,en,"CA, US"
Traffik,2018,"Horror, Thriller",6.146,96,Deon Taylor,Deon Taylor,"Paula Patton, Omar Epps, Missi Pyle","A couple off for a romantic weekend in the mountains are accosted by a biker gang. Alone in the mountains, Brea and John must defend themselves against the gang, who will stop at nothing to protect their secrets.",en,US
Pacific Rim: Uprising,2018,"Action, Fantasy, Science Fiction, Adventure",6.135,111,Steven S. DeKnight,Steven S. DeKnight,"John Boyega, Scott Eastwood, Cailee Spaeny","It has been ten years since The Battle of the Breach and the oceans are still, but restless. Vindicated by the victory at the Breach, the Jaeger program has evolved into the most powerful global defense force in human history. The PPDC now calls upon the best and brightest to rise up and become the next generation of heroes when the Kaiju threat returns.",en,US
The Nutcracker and the Four Realms,2018,"Fantasy, Adventure, Family",6.1,99,Lasse Hallström,,"Mackenzie Foy, Jayden Fowora-Knight, Tom Sweet","When Clara’s mother leaves her a mysterious gift, she embarks on a journey to four secret realms—where she discovers her greatest strength could change the world.",en,US
Life of the Party,2018,Comedy,6.1,105,Ben Falcone,Melissa McCarthy,"Melissa McCarthy, Matt Walsh, Molly Gordon","When her husband suddenly dumps her, longtime dedicated housewife Deanna turns regret into re-set by going back to college... landing in the same class and school as her daughter, who's not entirely sold on the idea. Plunging headlong into the campus experience, the increasingly outspoken Deanna – now Dee Rock – embraces freedom, fun, and frat boys on her own terms, finding her true self in a senior year no one ever expected.",en,US
Goosebumps 2: Haunted Halloween,2018,"Comedy, Fantasy, Horror",6.1,90,Ari Sandel,,"Jeremy Ray Taylor, Madison Iseman, Caleel Harris","Be careful what you wish for. With their after school junk business, best friends Sonny and Sam hope to find treasure in other people’s trash. But when cleaning out the old Stine house, they open a locked book that frees a supernatural nightmare – Slappy! Now, with the help of Sonny’s sister Sarah, they’re in a race against time to get the sinister dummy and all the creatures he’s brought to life back into the pages before he unleashes total pandemonium!",en,"US, GB"
The Domestics,2018,"Thriller, Horror",6.1,95,Mike P. Nelson,Mike P. Nelson,"Kate Bosworth, Tyler Hoechlin, Sonoya Mizuno",A young husband and wife must fight to return home in a post-apocalyptic mid-western landscape ravaged by gangs.,en,US
Early Man,2018,"Family, Comedy, Animation, Adventure",6.1,89,Nick Park,,"Eddie Redmayne, Tom Hiddleston, Maisie Williams","Dug, along with his sidekick Hognob, unite a cavemen tribe to save their hidden valley from being spoiled and, all together as a team, to face the menace of a mysterious and mighty enemy, on the turf of an ancient and sacred sport.",en,"GB, US"
The Girl in the Spider's Web,2018,"Action, Crime, Thriller",6.1,115,Fede Álvarez,,"Claire Foy, Sverrir Gudnason, LaKeith Stanfield","After being enlisted to recover a dangerous computer program, hacker Lisbeth Salander and journalist Mikael Blomkvist find themselves caught in a web of spies, cybercriminals and corrupt government officials.",en,US
Kin,2018,"Science Fiction, Action, Adventure, Thriller",6.1,102,Jonathan Baker,Jonathan Baker,"Myles Truitt, Jack Reynor, Dennis Quaid","A young boy finds a powerful otherworldly weapon, which he uses to save his older adoptive brother from a crew of thugs. Before long, the two of them are also pursued by federal agents and mysterious mercenaries aiming to reclaim their asset.",en,US
Hotel Artemis,2018,"Thriller, Science Fiction, Action, Crime, Drama",6.051,94,Drew Pearce,,"Jodie Foster, Sterling K. Brown, Sofia Boutella","Los Angeles, June 21st, 2028. While the streets are being torn apart by riots, the Nurse, who runs a clandestine hospital for criminals in the penthouse of the Artemis, a closed old hotel, has a rough night dealing with troublemaker clients: thieves, assassins, someone from the past and the one who owns the place and the whole city.",en,"US, GB"
Extinction,2018,"Action, Drama, Science Fiction, Thriller",6.0,96,Ben Young,,"Michael Peña, Lizzy Caplan, Israel Broussard","A chief mechanic at a factory, haunted by apocalyptic nightmares, becomes a hero when Earth is invaded by a mysterious army bent on destruction.",en,US
The First Purge,2018,"Action, Horror, Thriller",6.0,97,Gerard McMurray,James DeMonaco,"Y'lan Noel, Lex Scott Davis, Joivan Wade","To push the crime rate below one percent for the rest of the year, the New Founding Fathers of America test a sociological theory that vents aggression for one night in one isolated community. But when the violence of oppressors meets the rage of the others, the contagion will explode from the trial-city borders and spread across the nation.",en,US
Replicas,2018,"Science Fiction, Thriller, Drama",6.0,107,Jeffrey Nachmanoff,,"Keanu Reeves, Alice Eve, Thomas Middleditch",A scientist becomes obsessed with returning his family to normalcy after a terrible accident.,en,"US, GB"
Anon,2018,"Science Fiction, Crime, Mystery, Thriller",5.971,100,Andrew Niccol,Andrew Niccol,"Clive Owen, Amanda Seyfried, Colm Feore","Set in a near-future world where there is no privacy, ignorance or anonymity, our private memories are recorded and crime almost ceases to exist. In trying to solve a series of unsolved murders, Sal Frieland stumbles onto a young woman who appears to have subverted the system and disappeared. She has no identity, no history and no record. Sal realizes it may not be the end of crime but the beginning. Known only as 'The Girl', Sal must find her before he becomes the next victim.",en,"GB, US"
12 Feet Deep,2018,Thriller,5.964,85,Matt Eskandari,Matt Eskandari,"Nora-Jane Noone, Alexandra Park, Diane Farr",Two sisters are trapped under the fiberglass cover of an Olympic sized public pool and must brave the cold and each other to survive the harrowing night.,en,US
Robin Hood,2018,"Adventure, Action, Thriller, Fantasy",5.905,116,Otto Bathurst,,"Taron Egerton, Jamie Foxx, Ben Mendelsohn",A war-hardened Crusader and his Moorish commander mount an audacious revolt against the corrupt English crown.,en,"HR, US, FR, HU, HK"
Winchester,2018,"Horror, Thriller",5.9,100,Peter Spierig,,"Jason Clarke, Helen Mirren, Sarah Snook","San Jose, California, 1906. Isolated in her labyrinthine mansion, eccentric firearm heiress Sarah Winchester believes that she is being haunted by the souls of those killed by the guns manufactured by her company.",en,"AU, US"
Truth or Dare,2018,"Thriller, Horror",5.9,101,Jeff Wadlow,,"Lucy Hale, Violett Beane, Tyler Posey","A harmless game of ""Truth or Dare"" among friends turns deadly when someone—or something—begins to punish those who tell a lie—or refuse the dare.",en,US
Scorpion King: Book of Souls,2018,"Action, Adventure, Fantasy",5.9,102,Don Michael Paul,David Alton Hedges,"Zach McGowan, Peter Mensah, Pearl Thusi","The Scorpion King teams up with a female warrior named Tala, who is the sister of The Nubian King. Together they search for a legendary relic known as The Book of Souls, which will allow them to put an end to an evil warlord.",en,US
Tremors: A Cold Day in Hell,2018,"Action, Adventure, Science Fiction",5.9,98,Don Michael Paul,John Whelpley,"Michael Gross, Jamie Kennedy, Tanya van Graan",Burt Gummer and Travis Welker find themselves in a fight for survival after investigating deadly giant worm attacks in the Canadian arctic.,en,US
The Nun,2018,Horror,5.891,96,Corin Hardy,,"Taissa Farmiga, Demián Bichir, Bonnie Aarons",A priest with a haunted past and a novice on the threshold of her final vows are sent by the Vatican to investigate the death of a young nun in Romania and confront a malevolent force in the form of a demonic nun.,en,US
The Debt Collector,2018,"Action, Comedy",5.811,96,Jesse V. Johnson,Jesse V. Johnson,"Scott Adkins, Louis Mandylor, Michael Paré","A classically-trained martial artist goes to work as a debt collector for the mob. The job seems easy enough, until one “client” pulls him into a situation deeper than could ever be expected.",en,"US, GB"
All the Devil's Men,2018,Action,5.8,99,Matthew Hope,Matthew Hope,"Sylvia Hoeks, William Fichtner, Gbenga Akinnagbe","A battle-scarred War on Terror bounty hunter is forced to go to London on a manhunt for a disavowed CIA operative, which leads him into a deadly running battle with a former military comrade and his private army.",en,"US, GB"
The Happytime Murders,2018,"Action, Comedy, Crime",5.759,91,Brian Henson,,"Melissa McCarthy, Bill Barretta, Leslie David Baker","In a world where human beings and puppets live together, when the members of the cast of a children's television show aired during the 1990s begin to get murdered one by one, puppet Phil Philips, a former LAPD detective who fell in disgrace and turned into a private eye, takes on the case at the request of his old boss in order to assist detective Edwards, who was his partner in the past.",en,US
High Life,2018,"Science Fiction, Drama, Mystery",5.741,113,Claire Denis,,"Robert Pattinson, Juliette Binoche, André 3000",A father and his daughter struggle to survive in deep space where they live in isolation.,en,FR
Sherlock Gnomes,2018,"Animation, Family, Fantasy, Comedy, Adventure, Mystery",5.7,86,John Stevenson,,"Johnny Depp, Emily Blunt, James McAvoy",Garden gnomes Gnomeo & Juliet recruit renown detective Sherlock Gnomes to investigate the mysterious disappearance of other garden ornaments.,en,US
Redcon-1,2018,"Action, Horror, Science Fiction",5.697,117,Chee Keong Cheung,Chee Keong Cheung,"Oris Erhuero, Carlos Gallardo, Mark Strange","After a zombie apocalypse spreads from a London prison, the UK is brought to its knees. The spread of the virus is temporarily contained but, without a cure, it’s only a matter of time before it breaks its boundaries and the biggest problem of all… any zombies with combat skills are now enhanced. With the South East of England quarantined from the rest of the world using fortified borders, intelligence finds that the scientist responsible for the outbreak is alive and well in London. With his recovery being the only hope of a cure, a squad of eight Special Forces soldiers is sent on a suicide mission to the city, now ruled by the undead, with a single task: get him out alive within 72 hours by any means necessary. What emerges is an unlikely pairing on a course to save humanity against ever-rising odds.",en,"GB, US"
The Predator,2018,"Science Fiction, Action, Adventure",5.631,107,Shane Black,Fred Dekker,"Boyd Holbrook, Trevante Rhodes, Sterling K. Brown","When a young boy accidentally triggers the universe's most lethal hunters' return to Earth, only a ragtag crew of ex-soldiers and a disgruntled scientist can prevent the end of the human race.",en,"CA, US"
The Cloverfield Paradox,2018,"Horror, Science Fiction, Thriller",5.614,102,Julius Onah,,"Gugu Mbatha-Raw, Daniel Brühl, Chris O'Dowd","Orbiting above a planet on the brink of war, scientists test a device to solve an energy crisis and end up face-to-face with a dark alternate reality.",en,US
Black Water,2018,"Action, Thriller",5.6,105,Pasha Patriki,,"Jean-Claude Van Damme, Dolph Lundgren, Patrick Kilpatrick","A deep cover operative awakens to find himself imprisoned on a submarine. With the help of a fellow prisoner and an amateur agent, he must race against the clock to escape the vessel and expose who set him up.",en,"CA, US"
Hell House LLC II: The Abaddon Hotel,2018,"Horror, Mystery",5.6,89,Stephen Cognetti,Stephen Cognetti,"Vas Eli, Jillian Geurts, Joy Shatz","Eight years after the opening night tragedy of HELL HOUSE LLC, many unanswered questions remain. Thanks to an anonymous tip, an investigative journalist is convinced that key evidence is hidden inside the abandoned Abaddon Hotel. She assembles a team to break into the hotel in hopes of discovering the truth. But the source of the tip and the secrets of the Abaddon Hotel are more horrifying than any of them could have imagined.",en,US
The Dark Kingdom,2018,"Fantasy, Adventure, Science Fiction, Action",5.6,85,Simon Wells,Ben Loyd-Holmes,"Ross O'Hennessy, Ben Loyd-Holmes, Rebecca Dyson-Smith","To save their Kingdom from an army of undead, a group of warriors must travel through the forbidden lands fighting the fearsome beasts that call The Dark Kingdom their home.",en,GB
The Possession of Hannah Grace,2018,"Horror, Drama",5.6,86,Diederik Van Rooijen,Brian Sieve,"Shay Mitchell, Kirby Johnson, Grey Damon","When a cop who is just out of rehab takes the graveyard shift in a city hospital morgue, she faces a series of bizarre, violent events caused by an evil entity in one of the corpses.",en,US
Terminal,2018,"Crime, Drama, Thriller",5.501,95,Vaughn Stein,Vaughn Stein,"Margot Robbie, Simon Pegg, Dexter Fletcher","In the dark heart of a sprawling, anonymous city, two assassins carry out a sinister mission, a teacher battles a fatal illness, and an enigmatic janitor and a curious waitress lead dangerous double lives.  Murderous consequences unravel in the dead of night, as their lives intertwine at the hands of a mysterious criminal mastermind who is hell-bent on revenge.",en,"US, GB, HU"
Megalodon,2018,"Action, Science Fiction, Horror, TV Movie",5.5,90,James Thomas,Canyon Prince,"Michael Madsen, Scott C. Roe, Ego Mikitas","A military vessel on the search for an unidentified submersible finds themselves face to face with a giant shark, forced to use only what they have on board to defend themselves from the monstrous beast.",en,US
After Porn Ends 3,2018,Documentary,5.431,86,Brittany Andrews,,"Christy Canyon, Jenteal, Tera Patrick",After Porn Ends 3 continues to explore whether a career as an adult performer is inherently damaging to the balance of a perfomer's life once retired.,en,US
7 Guardians of the Tomb,2018,"Action, Adventure, Horror",5.423,90,Kimble Rendall,,"Li Bingbing, Kellan Lutz, Kelsey Grammer",An innocent discovery of a well-preserved mummified Emperor from 200 BC China unearths a 2000 year old nightmare - a secret that should have remained buried.,en,"AU, RU, TH, CN"
The Devil's Doorway,2018,"Horror, Drama",5.405,76,Aislinn Clarke,,"Lalor Roddy, Ciaran Flynn, Helena Bereen","In the autumn of 1960, Father Thomas Riley and Father John Thornton were sent by the Vatican to investigate a miraculous event in an Irish home for 'fallen women', only to uncover something much more horrific.",en,GB
Kickboxer: Retaliation,2018,"Action, Drama",5.4,110,Dimitri Logothetis,Dimitri Logothetis,"Alain Moussi, Christopher Lambert, Jean-Claude Van Damme","One year after the events of ""Kickboxer: Vengeance"", Kurt Sloan has vowed never to return to Thailand. However, while gearing up for a MMA title shot, he finds himself sedated and forced back into Thailand, this time in prison. He is there because the ones responsible want him to face a 6'8"" 400 lbs. beast named Mongkut and in return for the fight, Kurt will get two million dollars and his freedom back. Kurt at first refuses, in which a bounty is placed on his head as a way to force him to face Mongkut. Kurt soon learns he will have no other choice and will undergo his most rigorous training yet under some unexpected mentors in order to face Mongkut in hopes to regain his freedom.",en,US
The 15:17 to Paris,2018,"Drama, Thriller",5.4,94,Clint Eastwood,,"Ray Corasani, Spencer Stone, Anthony Sadler","On Aug. 21, 2015, the world watches in stunned silence as the media reports a thwarted terrorist attack on a train that's bound for Paris -- an attempt prevented by three young Americans traveling together through Europe. The heroic and courageous actions of Anthony Sadler, Alek Skarlatos and Spencer Stone help to save the lives of more than 500 passengers on board.",en,US
Patient Zero,2018,"Horror, Thriller, Action, Drama",5.3,87,Stefan Ruzowitzky,,"Matt Smith, Natalie Dormer, Clive Standen","After an unprecedented global pandemic has turned the majority of humankind into violent infected beings, Morgan, a man gifted with the ability to speak the infected's new language, leads the last survivors on a hunt for patient zero and a cure.",en,"US, GB"
How It Ends,2018,"Science Fiction, Thriller, Mystery, Action, Adventure",5.284,113,David M. Rosenthal,Brooks McLaren,"Theo James, Forest Whitaker, Kat Graham",A desperate father tries to return home to his pregnant wife after a mysterious apocalyptic event turns everything to chaos.,en,"CA, US"
Bent,2018,"Thriller, Crime",5.2,96,Bobby Moresco,,"Karl Urban, Sofía Vergara, Grace Byers","On his latest private investigation, a shamed former cop connects a murder case to a government conspiracy involving rogue agents from a top spy agency.",en,US
Escape Plan 2: Hades,2018,"Action, Thriller",5.2,93,Steven C. Miller,,"Sylvester Stallone, Dave Bautista, Jesse Metcalfe","Ray Breslin manages an elite team of security specialists trained in the art of breaking people out of the world's most impenetrable prisons. When his most trusted operative, Shu Ren, is kidnapped and disappears inside the most elaborate prison ever built, Ray must track him down with the help of some of his former friends.",en,US
Between Worlds,2018,"Mystery, Thriller, Fantasy",5.1,90,Maria Pulera,Maria Pulera,"Nicolas Cage, Franka Potente, Penelope Mitchell","Joe, a down-on-his-luck truck driver haunted by the memory of his deceased wife and child, meets Julie, a spiritually gifted woman who enlists his help in a desperate effort to find the lost soul of her comatose daughter. But the spirit of Joe's dead wife proves stronger, possessing the young woman's body and determined to settle her unfinished business with the living.",en,US
London Fields,2018,"Crime, Thriller",5.1,118,Mathew Cullen,,"Amber Heard, Theo James, Jim Sturgess","Clairvoyant femme fatale, Nicola Six has been living with a dark premonition of her impending death by murder. She begins a tangled love affair with three uniquely different men — one of whom she knows will be her murderer.",en,"US, GB"
"My Teacher, My Obsession",2018,"Drama, Thriller, TV Movie",5.036,86,Damián Romay,Patrick Robert Young,"Rusty Joiner, Lucy Loken, Laura Bilgeri","Riley is struggling to make friends after transferring to a new high school where her father, Chris, is an English teacher. When she meets Kyla, they quickly becomes close friends. However, the friendship takes a strange turn when Riley learns that Kyla is obsessed with her dad. Will Kyla successfully seduce Chris and start a twisted new life with him by removing everyone in her path, or will Riley be able to save her father from Kyla’s treacherous plot before it’s too late?",en,US
The Little Mermaid,2018,"Family, Adventure, Fantasy, Romance, Drama",5.0,98,Chris Bouchard,Blake Harris,"Poppy Drayton, Shirley MacLaine, Loreto Peralta",A young reporter and his niece discover a beautiful and enchanting creature they believe to be the real little mermaid.,en,US
Siberia,2018,"Crime, Romance, Thriller",4.717,105,Matthew Ross,,"Keanu Reeves, Ana Ularu, Pasha D. Lychnikoff","Lucas, a diamond trader who travels to Saint Petersburg to arrange a sale, discovers that his Russian business partner has left his hotel and gone to a small Siberian village, so Lucas also heads there to try find him.",en,"CA, US"
Occupation,2018,"Action, Science Fiction, Drama",4.6,119,Luke Sparke,,"Dan Ewing, Temuera Morrison, Stephanie Jacobsen","Town residents must band together after a devastating alien invasion. As they struggle to survive, they realize they must stay one step ahead of their attackers and work together for a chance to strike back.",en,"AU, US"
