Title,Year,Genres,Rating,Popularity,Runtime,Director,Writer,Actors,Keywords,Plot,Ratings Amount,Language,Country
Rumble,2021,"Animation, Family",6.8,7.636,95,Hamish Grieve,,"Will Arnett, Geraldine Viswanathan, Stephen A. Smith","monster, wrestling, based on comic, kaiju","In a world where monster wrestling is a global sport and monsters are superstar athletes, teenage Winnie seeks to follow in her father’s footsteps by coaching a loveable underdog monster into a champion.",512,en,US
The Marksman,2021,"Action, Drama, Thriller",6.8,11.843,108,Robert Lorenz,Robert Lorenz,"Liam Neeson, Jacob Perez, Katheryn Winnick","assassin, mexico, war veteran, usa–mexico border, murder, drug cartel, farmer, dead dog, road movie","Jim Hanson’s quiet life is suddenly disturbed by two people crossing the US/Mexico border – a woman and her young son – desperate to flee a Mexican cartel. After a shootout leaves the mother dead, Jim becomes the boy’s reluctant defender. He embraces his role as Miguel’s protector and will stop at nothing to get him to safety, as they go on the run from the relentless assassins.",1614,en,US
Venom: Let There Be Carnage,2021,"Science Fiction, Action, Adventure",6.78,35.192,97,Andy Serkis,,"Tom Hardy, Woody Harrelson, Michelle Williams","hero, psychopath, superhero, anti hero, villain, alien life-form, based on comic, sequel, fear, aftercreditsstinger, symbiote, carnage","After finding a host body in investigative reporter Eddie Brock, the alien symbiote must face a new enemy, Carnage, the alter ego of serial killer Cletus Kasady.",10510,en,US
Malignant,2021,"Horror, Mystery",6.767,9.458,111,James Wan,,"Annabelle Wallis, Maddie Hasson, George Young","dreams, monster, brain tumor, detective, seattle, washington, gore, murder, vision, serial killer, hospital, miscarriage, videotape, murder mystery, sister sister relationship, psychic connection, intense, american giallo","Madison is paralyzed by shocking visions of grisly murders, and her torment worsens as she discovers that these waking dreams are in fact terrifying realities with a mysterious tie to her past.",2367,en,"US, HK"
Red Notice,2021,"Action, Comedy, Crime",6.765,16.815,118,Rawson Marshall Thurber,Rawson Marshall Thurber,"Dwayne Johnson, Ryan Reynolds, Gal Gadot","fbi, interpol, cleopatra, heist, art thief","An Interpol-issued Red Notice is a global alert to hunt and capture the world's most wanted. But when a daring heist brings together the FBI's top profiler and two rival criminals, there's no telling what will happen.",5908,en,US
The King's Man,2021,"Action, Adventure, Thriller",6.751,18.69,131,Matthew Vaughn,,"Ralph Fiennes, Gemma Arterton, Rhys Ifans","london, england, world war i, spy, based on comic, prequel, world domination, duringcreditsstinger, speculative, vexed, zealous, 1910s, unassuming, sympathetic","As a collection of history's worst tyrants and criminal masterminds gather to plot a war to wipe out millions, one man must race against time to stop them.",4628,en,US
Till Death,2021,"Horror, Thriller",6.714,8.403,89,SK Dale,Jason Carvey,"Megan Fox, Eoin Macken, Aml Ameen","infidelity, suicide, husband wife relationship, winter, cheat on husband, survival, murder, lawyer, trapped, handcuffed, wedding anniversary, hired killer, isolated, lake house","After a romantic evening at their secluded lake house, a woman wakes up handcuffed to her dead husband. Trapped and isolated in the dead of winter, she must fight off hired killers to escape her late spouse's twisted plan.",831,en,US
Space Jam: A New Legacy,2021,"Family, Animation, Comedy, Science Fiction",6.702,12.699,115,Malcolm D. Lee,,"LeBron James, Don Cheadle, Cedric Joe","sports, cartoon, basketball, game, live action and animation, space jam","When LeBron and his young son Dom are trapped in a digital space by a rogue A.I., LeBron must get them home safe by leading Bugs, Lola Bunny and the whole gang of notoriously undisciplined Looney Tunes to victory over the A.I.'s digitized champions on the court. It's Tunes versus Goons in the highest-stakes challenge of his life.",4046,en,US
One Shot,2021,"Action, Thriller",6.7,7.525,97,James Nunn,Jamie Russell,"Scott Adkins, Ashley Greene, Ryan Phillippe","war on terror, u.s. navy seal, seige","An elite squad of Navy SEALs, on a covert mission to transport a prisoner off a CIA black site island prison, are trapped when insurgents attack while trying to rescue the same prisoner.",869,en,"US, GB"
Descendants: The Royal Wedding,2021,"Animation, Family, Comedy, Drama",6.7,7.615,22,Salvador Simó,Sara Parriott,"Dove Cameron, Sofia Carson, Booboo Stewart","wedding, animated wedding","Happily-ever-after continues for Auradon's power couple as they prepare to say ""I do"" at an epic celebration with their friends and family, but Hades threatens to ruin it all.",159,en,US
Run Hide Fight,2021,"Action, Crime, Thriller",6.7,7.493,109,Kyle Rankin,,"Isabel May, Thomas Jane, Radha Mitchell","high school, hero, war veteran, killing, murder, shootout, explosion, school shooting, disturbed teenager","A 17-year-old girl uses her wits, survival skills, and compassion to fight for her life, and those of her fellow classmates, against a group of live-streaming school shooters.",302,en,US
YES DAY,2021,"Family, Comedy",6.7,9.782,86,Miguel Arteta,,"Jennifer Garner, Edgar Ramírez, Jenna Ortega",,A mom and dad who usually say no decide to say yes to their kids' wildest requests — with a few ground rules — on a whirlwind day of fun and adventure.,1209,en,US
Fear Street: 1994,2021,"Horror, Mystery",6.699,10.193,108,Leigh Janiak,,"Kiana Madeira, Olivia Scott Welch, Benjamin Flores Jr.","witch, based on novel or book, shopping mall, murder, curse, teenage girl, slasher, drugs, witchcraft, lgbt, 1990s, teen scream","After a series of brutal slayings, a teen and her friends take on an evil force that's plagued their notorious town for centuries.",2341,en,US
Hitman's Wife's Bodyguard,2021,"Action, Comedy, Crime, Thriller",6.668,11.521,99,Patrick Hughes,,"Ryan Reynolds, Samuel L. Jackson, Salma Hayek Pinault","hitman, bodyguard, sequel, aftercreditsstinger, duringcreditsstinger","The world’s most lethal odd couple – bodyguard Michael Bryce and hitman Darius Kincaid – are back on another life-threatening mission. Still unlicensed and under scrutiny, Bryce is forced into action by Darius's even more volatile wife, the infamous international con artist Sonia Kincaid. As Bryce is driven over the edge by his two most dangerous protectees, the trio get in over their heads in a global plot and soon find that they are all that stand between Europe and a vengeful and powerful madman.",2322,en,US
The Harder They Fall,2021,Western,6.646,7.701,139,Jeymes Samuel,,"Jonathan Majors, Idris Elba, Regina King","prison, release from prison, revenge, bank robbery, cowboy, wild west, quick draw, outlaw gang, 19th century","Gunning for revenge, outlaw Nat Love saddles up with his gang to take down enemy Rufus Buck, a ruthless crime boss who just got sprung from prison.",1073,en,US
Those Who Wish Me Dead,2021,"Thriller, Action",6.643,7.741,100,Taylor Sheridan,,"Angelina Jolie, Finn Little, Jon Bernthal","assassin, based on novel or book, older woman younger man relationship, neo-western, wildfire, distressing, tragic","A young boy finds himself pursued by two assassins in the Montana wilderness, with a survival expert determined to protect him, and a forest fire threatening to consume them all.",1667,en,"CA, US"
Sweet Girl,2021,"Action, Thriller, Drama",6.62,7.75,110,Brian Andrew Mendoza,Will Staples,"Jason Momoa, Isabela Merced, Manuel Garcia-Rulfo","daughter, escape, fight, truth, father, safe, justice, family, death, parents, kid, drug","A man vows to bring justice to those responsible for his wife's death while protecting the only family he has left, his daughter.",1207,en,US
Infinite,2021,"Science Fiction, Action, Adventure, Thriller",6.605,16.425,106,Antoine Fuqua,,"Mark Wahlberg, Chiwetel Ejiofor, Sophie Cookson","based on novel or book, secret organization, reincarnation, memories, matter of fact","Evan McCauley has skills he never learned and memories of places he has never visited. Self-medicated and on the brink of a mental breakdown, a secret group that call themselves “Infinites” come to his rescue, revealing that his memories are real.",1889,en,US
The Green Knight,2021,"Adventure, Drama, Fantasy",6.6,9.869,130,David Lowery,David Lowery,"Dev Patel, Alicia Vikander, Joel Edgerton","winter, fox, camelot, king arthur, middle ages (476-1453), excalibur, knights of the round table, aftercreditsstinger, decapitated head, based on myths, legends or folklore, christmas, quest, myth, gawain, medieval knight","An epic fantasy adventure based on the timeless Arthurian legend, The Green Knight tells the story of Sir Gawain, King Arthur's reckless and headstrong nephew, who embarks on a daring quest to confront the eponymous Green Knight, a gigantic emerald-skinned stranger and tester of men.",1945,en,US
House of Gucci,2021,"History, Drama, Crime",6.6,9.388,158,Ridley Scott,,"Lady Gaga, Adam Driver, Al Pacino","marriage crisis, italy, biography, fashion designer, murder, fashion, failing marriage, 1980s, 1990s, rich family, gucci","When Patrizia Reggiani, an outsider from humble beginnings, marries into the Gucci family, her unbridled ambition begins to unravel the family legacy and triggers a reckless spiral of betrayal, decadence, revenge, and ultimately… murder.",3159,en,US
The Voyeurs,2021,Thriller,6.6,15.632,117,Michael Mohan,Michael Mohan,"Sydney Sweeney, Justice Smith, Ben Hardy","infidelity, sexual obsession, espionage, photographer, eroticism, manipulation, seduction, montreal, canada, fashion photographer, sexual fantasy, role playing, neighbor, listening device, moving in, voyeurism, new apartment, art project, ophthalmologist, nude photography, anxious, peeping, depressing","When Pippa and Thomas move into their dream apartment, they notice that their windows look directly into the apartment opposite – inviting them to witness the volatile relationship of the attractive couple across the street. But what starts as a simple curiosity turns into full-blown obsession with increasingly dangerous consequences.",976,en,US
Kate,2021,"Action, Thriller",6.6,7.479,106,Cedric Nicolas-Troyan,Umair Aleem,"Mary Elizabeth Winstead, Miku Martineau, Woody Harrelson","japan, assassin, radiation, poison, revenge, female assassin, tokyo, japan, vengeance",A ruthless criminal operative has less than 24 hours to exact revenge on her enemies and in the process forms an unexpected bond with the daughter of one of her past victims.,1544,en,US
The Night House,2021,"Drama, Horror, Mystery, Thriller",6.6,11.438,107,David Bruckner,,"Rebecca Hall, Sarah Goldberg, Vondie Curtis-Hall","depression, nightmare, widow, forest, grieving widower, grief, new york state, book store, occult, doppelgänger, schoolteacher, lake house, suicide of husband","Reeling from the unexpected death of her husband, Beth is left alone in the lakeside home he built for her. Soon she begins to uncover her recently deceased husband's disturbing secrets.",1153,en,"US, GB"
The Unholy,2021,"Horror, Mystery",6.6,8.712,99,Evan Spiliotopoulos,,"Jeffrey Dean Morgan, Cricket Brown, William Sadler","witch, melancholy, demon, mysterious, shocking, zealous, somber, religious horror, wonder, suspicious, inspirational, adoring, ambiguous, antagonistic, approving, audacious, melodramatic","Alice is young hearing-impaired girl who, after a supposed visitation from the Virgin Mary, is inexplicably able to hear, speak and heal the sick. As word spreads and people from near and far flock to witness her miracles, a disgraced journalist hoping to revive his career visits the small New England town to investigate. When terrifying events begin to happen all around, he starts to question if these phenomena are the works of the Virgin Mary or something much more sinister.",2176,en,US
Reminiscence,2021,"Mystery, Science Fiction",6.6,7.914,116,Lisa Joy,Lisa Joy,"Hugh Jackman, Rebecca Ferguson, Thandiwe Newton","miami, florida, drug addiction, new orleans, louisiana, flashback, murder, memory, woman director, hopeless, neo-noir, depressing, complicated, pretentious","Nicolas Bannister, a rugged and solitary veteran living in a near-future Miami flooded by rising seas, is an expert in a dangerous occupation: he offers clients the chance to relive any memory they desire. His life changes when he meets a mysterious young woman named Mae. What begins as a simple matter of lost and found becomes a passionate love affair. But when a different client's memories implicate Mae in a series of violent crimes, Bannister must delve through the dark world of the past to uncover the truth about the woman he fell for.",1796,en,US
The Cursed,2021,"Horror, Drama, Thriller",6.6,7.826,111,Sean Ellis,Sean Ellis,"Boyd Holbrook, Kelly Reilly, Alistair Petrie","gypsy, world war i, gore, flashback, werewolf, creature, church, pathologist, silver bullet, 1800s","In the late 19th century, a brutal land baron slaughters a Roma clan, unleashing a curse on his family and village. In the days that follow, the townspeople are plagued by nightmares, the baron's son goes missing, and a boy is found murdered. The locals suspect a wild animal, but a visiting pathologist warns of a more sinister presence lurking in the woods.",350,en,US
Chaos Walking,2021,"Fantasy, Science Fiction, Adventure",6.592,15.75,109,Doug Liman,,"Tom Holland, Daisy Ridley, Mads Mikkelsen","based on novel or book, dystopia, post-apocalyptic future, unassuming, based on young adult novel, derisive","Two unlikely companions embark on a perilous adventure through the badlands of an unexplored planet as they try to escape a dangerous and disorienting reality, where all inner thoughts are seen and heard by everyone.",2321,en,US
I Care a Lot,2021,"Crime, Thriller, Drama",6.587,9.481,119,J Blakeson,J Blakeson,"Rosamund Pike, Peter Dinklage, Eiza González","psychopath, dark comedy, sociopath, guardian, ceo, social services, scam artist, female psychopath, social criticism, late stage capitalism, scammer, socialized psychopath",A court-appointed legal guardian defrauds her older clients and traps them under her care. But her latest mark comes with some unexpected baggage.,2722,en,US
The Protégé,2021,"Action, Adventure, Thriller",6.55,9.918,109,Martin Campbell,Richard Wenk,"Maggie Q, Samuel L. Jackson, Michael Keaton","assassination, female assassin, mentor protégé relationship, master disciple relationship","Rescued as a child by the legendary assassin Moody and trained in the family business, Anna is the world’s most skilled contract killer. When Moody, the man who was like a father to her and taught her everything she needs to know about trust and survival, is brutally killed, Anna vows revenge. As she becomes entangled with an enigmatic killer whose attraction to her goes way beyond cat and mouse, their confrontation turns deadly and the loose ends of a life spent killing will weave themselves ever tighter.",1018,en,"GB, US"
Queenpins,2021,"Comedy, Crime",6.518,7.643,110,Aron Gaudet,Gita Pullapilly,"Kristen Bell, Kirby Howell-Baptiste, Vince Vaughn","based on true story, scam, counterfeit, buddy comedy, swindle","Bored and frustrated suburban homemaker Connie and her best pal JoJo, a vlogger with dreams, turn a hobby into a multi-million-dollar counterfeit coupon caper. After firing off a letter to the conglomerate behind a box of cereal gone stale, and receiving an apology along with dozens of freebies, the duo hatch an illegal coupon club scheme that scams millions from mega-corporations and delivers deals to legions of fellow coupon clippers. On the trail to total coupon dominance, a hapless Loss Prevention Officer from the local supermarket chain joins forces with a determined U.S. Postal Inspector in hot pursuit of these newly minted “Queenpins” of pink collar crime.",445,en,US
Jolt,2021,"Action, Thriller",6.5,9.353,91,Tanya Wexler,Scott Wascha,"Kate Beckinsale, Stanley Tucci, Bobby Cannavale",woman director,A bouncer with an anger management problem goes on a furious and resentful rampage after the murder of a friend.,1274,en,US
He's All That,2021,"Comedy, Romance",6.5,11.634,91,Mark Waters,R. Lee Fleming Jr.,"Addison Rae, Tanner Buchanan, Madison Pettis","high school, remake, prom, makeover, social media influencer, prom king, disapproving, disrespectful, doubtful","To get revenge on her ex-boyfriend, an influencer attempts to transform an unpopular classmate into prom king.",1387,en,US
Snake Eyes: G.I. Joe Origins,2021,"Action, Adventure",6.5,17.583,121,Robert Schwentke,,"Henry Golding, Andrew Koji, Haruka Abe","prequel, ninja, based on cartoon, based on toy, spin off, origin of hero, gi joe, female fighter, action hero, female warrior, based on tv series","After saving the life of their heir apparent, tenacious loner Snake Eyes is welcomed into an ancient Japanese clan called the Arashikage where he is taught the ways of the ninja warrior. But, when secrets from his past are revealed, Snake Eyes' honor and allegiance will be tested – even if that means losing the trust of those closest to him.",1578,en,"CA, US"
Escape Room: Tournament of Champions,2021,"Horror, Thriller, Mystery",6.5,11.397,88,Adam Robitel,Maria Melnik,"Taylor Russell, Logan Miller, Indya Moore","sequel, no escape, escape room, death game","Six people unwittingly find themselves locked in another series of escape rooms, slowly uncovering what they have in common to survive... and discovering they've all played the games before.",2064,en,US
The Simpsons in Plusaversary,2021,"Animation, Comedy, Fantasy",6.493,7.878,4,David Silverman,Dan Vebber,"Dan Castellaneta, Nancy Cartwright, Yeardley Smith","beer, adult animation, macabre, short film, absurd, distressing, embarrassed","The Simpsons host a Disney+ Day party and everyone is on the list… except Homer. With friends from across the service and music fit for a Disney Princess, Plusaversary is Springfield's event of the year.",415,en,US
Halloween Kills,2021,"Horror, Thriller",6.442,9.619,105,David Gordon Green,Scott Teems,"Jamie Lee Curtis, Judy Greer, Andi Matichak","halloween, sequel, murder, vigilante, serial killer, hospital, slasher, murderer, killer, house fire, crime spree, vigilantism, escaped killer, murder spree, vigilante justice, holiday horror","Michael manages to free himself from Laurie Strode's trap to resume his ritual bloodbath. As she fights for her life from injuries from their last encounter, she inspires her daughter Karen, her granddaughter Allyson, and all of Haddonfield to rise up against the unstoppable monster.",2714,en,US
The Guilty,2021,"Drama, Thriller",6.426,8.158,91,Antoine Fuqua,,"Jake Gyllenhaal, Ethan Hawke, Riley Keough","remake, psychological thriller, police officer, police station, cellular phone trace, phone call, emergency, nervous, abduction, wildfire, desk work, alarm dispatch, intense",A demoted police officer assigned to a call dispatch desk is conflicted when he receives an emergency phone call from a kidnapped woman.,2739,en,US
Night Teeth,2021,"Horror, Thriller, Action",6.414,7.815,107,Adam Randall,,"Jorge Lendeborg Jr., Debby Ryan, Lucy Fry","vampire, college student, dracula, bloody, moonlighting, secret, sentimental, romantic, amused, awestruck, dignified, exuberant, gentle, vibrant","A college student moonlighting as a chauffeur picks up two mysterious women for a night of party-hopping across LA. But when he uncovers their bloodthirsty intentions—and their dangerous, shadowy underworld—he must fight to stay alive.",781,en,"GB, US"
Never Back Down: Revolt,2021,Action,6.4,7.473,89,Kellie Madison,Audrey Arkins,"Olivia Popica, Michael Bisping, Brooke Johnston",,An amateur fighter is lured by a trafficking syndicate specializing in elite underground fighting where her brutal captor forces her to fight or face certain death.,126,en,US
Bull,2021,"Crime, Horror, Thriller",6.4,7.629,87,Paul Andrew Williams,Paul Andrew Williams,"Neil Maskell, David Hayman, Tamzin Outhwaite","drug dealer, shotgun, revenge, murder, rage, funfair, criminals","Ten years after he was last seen, a vicious mob enforcer returns home to find his son and methodically track down the gang that double-crossed him. His quest for revenge soon leads to a savage showdown between his wife and her mob boss father.",152,en,GB
Apache Junction,2021,"Western, Action, Crime",6.4,7.526,94,Justin Lee,Justin Lee,"Stuart Townsend, Scout Taylor-Compton, Trace Adkins",,"Apache Junction is an outpost of lawlessness, a haven for thieves and cold-blooded killers. After big-city reporter Annabelle Angel arrives to write an article on the town, she becomes a target when notorious gunslinger Jericho Ford comes to her aid. Now Annabelle must entrust her future to a man with a deadly past, as Jericho heads toward a tense showdown.",171,en,US
Cinderella,2021,"Fantasy, Romance, Comedy",6.4,10.878,113,Kay Cannon,Kay Cannon,"Camila Cabello, Nicholas Galitzine, Idina Menzel","musical, evil stepmother, woman director, fairy godmother, human becoming an animal, happy ending, cinderella, jukebox musical, cinderella story, romantic fantasy","Cinderella, an orphaned girl with an evil stepmother, has big dreams and with the help of her Fabulous Godmother, she perseveres to make them come true.",1408,en,US
Mainstream,2021,"Comedy, Drama",6.4,8.61,95,Gia Coppola,,"Andrew Garfield, Maya Hawke, Nat Wolff","suicide, love triangle, satire, woman director, social media influencer, ana akım",A young woman thinks she’s found a path to internet stardom when she starts making YouTube videos with a charismatic stranger  – until the dark side of viral celebrity threatens to ruin them both.,309,en,US
The Matrix Resurrections,2021,"Science Fiction, Action, Adventure",6.389,21.575,147,Lana Wachowski,David Mitchell,"Keanu Reeves, Carrie-Anne Moss, Yahya Abdul-Mateen II","future, man vs machine, underground world, artificial intelligence (a.i.), computer, virtual reality, prophecy, dystopia, cyberpunk, aftercreditsstinger, dream world, woman director, philosophical, gnosticism, grand, romantic, sincere","Plagued by strange memories, Neo's life takes an unexpected turn when he finds himself back inside the Matrix.",5873,en,US
Coming 2 America,2021,Comedy,6.385,10.0,110,Craig Brewer,,"Eddie Murphy, Arsenio Hall, Jermaine Fowler","africa, prince, heir to the throne, sequel, queens, new york city, mischievous, dramatic","Prince Akeem Joffer is set to become King of Zamunda when he discovers he has a son he never knew about in America – a street savvy Queens native named Lavelle. Honoring his royal father's dying wish to groom this son as the crown prince, Akeem and Semmi set off to America once again.",2250,en,US
Hell Hath No Fury,2021,"Action, War",6.384,7.526,94,Jesse V. Johnson,Romain Serir,"Nina Bergman, Daniel Bernhardt, Louis Mandylor",,"Branded a traitor by her countrymen, French national Marie DuJardin is rescued by American soldiers on one condition: to survive, she must lead them to a cache of gold - before the Nazis return to claim it for themselves.",99,en,"BY, US"
Outside the Wire,2021,"Thriller, Action, Science Fiction",6.36,7.77,116,Mikael Håfström,Rowan Athale,"Anthony Mackie, Damson Idris, Enzo Cilenti","android, cyborg, killer robot, pilot, nuclear missile, near future, 2030s, war","In the near future, a drone pilot is sent into a deadly militarized zone and must work with an android officer to locate a doomsday device.",1804,en,US
The Little Things,2021,"Drama, Crime, Thriller",6.336,8.942,128,John Lee Hancock,,"Denzel Washington, Rami Malek, Jared Leto","detective, deputy sheriff, cop, serial killer, crime scene, los angeles, california, series of murders, cat and mouse, surveillance, lapd, homicide detective, prime suspect, mysterious, 1990s, unsolved murders, frightened","Deputy Sheriff Joe ""Deke"" Deacon joins forces with Sgt. Jim Baxter to search for a serial killer who's terrorizing Los Angeles. As they track the culprit, Baxter is unaware that the investigation is dredging up echoes of Deke's past, uncovering disturbing secrets that could threaten more than his case.",2546,en,US
Old,2021,"Thriller, Mystery, Horror",6.332,12.114,108,M. Night Shyamalan,,"Vicky Krieps, Gael García Bernal, Rufus Sewell","beach, husband wife relationship, schizophrenia, escape, time warp, rapper, coral reef, deception, time, aging, loss of virginity, trap, murder, corpse, family vacation, family, based on graphic novel, family holiday, death, existentialism, sickness, mortality, time-manipulation, radical transformation, secluded beach, human experiment, brother sister relationship, medical experiment, experimental drug, secret experiment, body horror, vacation gone wrong, baffled, frightened",A group of families on a tropical holiday discover that the secluded beach where they are staying is somehow causing them to age rapidly – reducing their entire lives into a single day.,4519,en,US
The Many Saints of Newark,2021,"Crime, Drama",6.325,7.718,120,Alan Taylor,David Chase,"Alessandro Nivola, Leslie Odom Jr., Michael Gandolfini","new jersey, italian american, prequel, mobster, mafia, gang, criminal, 1960s, gangsters, newark, new jersey","Young Anthony Soprano is growing up in one of the most tumultuous eras in Newark, N.J., history, becoming a man just as rival gangsters start to rise up and challenge the all-powerful DiMeo crime family. Caught up in the changing times is the uncle he idolizes, Dickie Moltisanti, whose influence over his nephew will help shape the impressionable teenager into the all-powerful mob boss, Tony Soprano.",676,en,US
