Title,Year,Genres,Rating,Runtime,Director,Writer,Actors,Plot,Language,Country
The Darkest Minds,2018,"Action, Adventure, Drama",7.0,105,Jennifer Yuh Nelson,Chad Hodge,"Amandla Stenberg, Harris Dickinson, Patrick Gibson","After a disease kills 98% of America's children, the surviving 2% develop superpowers and are placed in internment camps. A 16-year-old girl escapes her camp and joins a group of other teens on the run from the government.",en,US
Ocean's Eight,2018,"Crime, Comedy, Action",7.0,111,Gary Ross,,"Sandra Bullock, Cate Blanchett, Sarah Paulson","Debbie Ocean, a criminal mastermind, gathers a crew of female thieves to pull off the heist of the century at New York's annual Met Gala.",en,US
The Princess Switch,2018,"Romance, Comedy",7.0,101,Mike Rohl,Robin Bernheim Burger,"Vanessa Hudgens, Sam Palladio, Nick Sagar","When a down-to-earth Chicago baker and a soon-to-be princess discover they look like twins, they hatch a Christmastime plan to trade places.",en,US
Creed II,2018,"Drama, Action",7.0,130,Steven Caple Jr.,,"Michael B. Jordan, Sylvester Stallone, Tessa Thompson","Between personal obligations and training for his next big fight against an opponent with ties to his family's past, Adonis Creed is up against the challenge of his life.",en,US
The Bad Seed,2018,"Drama, Horror, Thriller, TV Movie",7.0,84,Rob Lowe,Barbara Marshall,"Rob Lowe, Mckenna Grace, Sarah Dugdale",A widower suspects that his seemingly perfect adolescent daughter is a heartless killer.,en,"US, CA"
Sicario: Day of the Soldado,2018,"Action, Crime, Thriller",6.933,122,Stefano Sollima,Taylor Sheridan,"Benicio del Toro, Josh Brolin, Isabela Merced",Agent Matt Graver teams up with operative Alejandro Gillick to prevent Mexican drug cartels from smuggling terrorists across the United States border.,en,"MX, US"
Ant-Man and the Wasp,2018,"Action, Adventure, Science Fiction",6.923,119,Peyton Reed,,"Paul Rudd, Evangeline Lilly, Michael Douglas","Just when his time under house arrest is about to end, Scott Lang once again puts his freedom at risk to help Hope van Dyne and Dr. Hank Pym dive into the quantum realm and try to accomplish, against time and any chance of success, a very dangerous rescue mission.",en,US
Suspiria,2018,"Horror, Mystery, Drama",6.905,152,Luca Guadagnino,,"Dakota Johnson, Tilda Swinton, Mia Goth","Young American dancer Susie Bannion arrives in 1970s Berlin to audition for the world-renowned Helena Markos Dance Company. When she vaults to the role of lead dancer, the woman she replaces breaks down and accuses the company's female directors of witchcraft. Meanwhile, an inquisitive psychotherapist and a member of the troupe uncover dark and sinister secrets as they probe the depths of the studio's hidden underground chambers.",en,US
The Grinch,2018,"Animation, Family, Comedy, Fantasy",6.9,85,Yarrow Cheney,,"Benedict Cumberbatch, Rashida Jones, Kenan Thompson",The Grinch hatches a scheme to ruin Christmas when the residents of Whoville plan their annual holiday celebration.,en,US
Hunter Killer,2018,"Action, Adventure, Thriller",6.9,121,Donovan Marsh,,"Gerard Butler, Gary Oldman, Toby Stephens","Captain Glass of the USS Arkansas discovers that a coup d'état is taking place in Russia, so he and his crew join an elite group working on the ground to prevent a war.",en,"FR, US"
Benji,2018,"Drama, Comedy, Family, Crime",6.897,87,Brandon Camp,Brandon Camp,"Gabriel Bateman, Darby Camp, Kiele Sanchez","Two school kids strike up a friendship with an orphaned puppy named Benji. When danger befalls them and they end up kidnapped by robbers who are in over their heads, Benji and his scruffy sidekick come to the rescue.",en,"AE, US"
Disobedience,2018,"Drama, Romance",6.886,114,Sebastián Lelio,Rebecca Lenkiewicz,"Rachel Weisz, Rachel McAdams, Alessandro Nivola","A woman learns about the death of her Orthodox Jewish father, a rabbi. She returns home and has romantic feelings rekindled for her best childhood friend, who is now married to her cousin.",en,US
Aquaman,2018,"Action, Adventure, Fantasy",6.88,143,James Wan,,"Jason Momoa, Amber Heard, Willem Dafoe","Half-human, half-Atlantean Arthur Curry is taken on the journey of his lifetime to discover if he is worth of being a king.",en,US
Hotel Transylvania 3: Summer Vacation,2018,"Animation, Comedy, Family, Fantasy",6.855,97,Genndy Tartakovsky,Genndy Tartakovsky,"Adam Sandler, Andy Samberg, Selena Gomez","Dracula, Mavis, Johnny and the rest of the Drac Pack take a vacation on a luxury Monster Cruise Ship, where Dracula falls in love with the ship’s captain, Ericka, who’s secretly a descendant of Abraham Van Helsing, the notorious monster slayer.",en,US
The Mule,2018,"Crime, Drama",6.854,116,Clint Eastwood,,"Clint Eastwood, Bradley Cooper, Laurence Fishburne","Earl Stone, a man in his eighties, is broke, alone, and facing foreclosure of his business when he is offered a job that simply requires him to drive. Easy enough, but, unbeknownst to Earl, he's just signed on as a drug courier for a Mexican cartel. He does so well that his cargo increases exponentially, and Earl hit the radar of hard-charging DEA agent Colin Bates.",en,US
Game Night,2018,"Mystery, Comedy, Crime",6.85,100,John Francis Daley,Jonathan Goldstein,"Jason Bateman, Rachel McAdams, Kyle Chandler","Max and Annie's weekly game night gets kicked up a notch when Max's brother Brooks arranges a murder mystery party -- complete with fake thugs and federal agents. So when Brooks gets kidnapped, it's all supposed to be part of the game. As the competitors set out to solve the case, they start to learn that neither the game nor Brooks are what they seem to be. The friends soon find themselves in over their heads as each twist leads to another unexpected turn over the course of one chaotic night.",en,US
Fantastic Beasts: The Crimes of Grindelwald,2018,"Fantasy, Adventure",6.849,134,David Yates,,"Eddie Redmayne, Katherine Waterston, Dan Fogler","Gellert Grindelwald has escaped imprisonment and has begun gathering followers to his cause—elevating wizards above all non-magical beings. The only one capable of putting a stop to him is the wizard he once called his closest friend, Albus Dumbledore. However, Dumbledore will need to seek help from the wizard who had thwarted Grindelwald once before, his former student Newt Scamander, who agrees to help, unaware of the dangers that lie ahead. Lines are drawn as love and loyalty are tested, even among the truest friends and family, in an increasingly divided wizarding world.",en,"US, GB"
Bad Times at the El Royale,2018,"Thriller, Mystery, Crime, Drama",6.842,141,Drew Goddard,,"Jeff Bridges, Cynthia Erivo, Lewis Pullman","Lake Tahoe, 1969. Seven strangers, each one with a secret to bury, meet at El Royale, a decadent motel with a dark past. In the course of a fateful night, everyone will have one last shot at redemption.",en,US
Adrift,2018,"Thriller, Romance, Adventure",6.84,96,Baltasar Kormákur,Jordan Kandell,"Shailene Woodley, Sam Claflin, Jeffrey Thomas","Tami Oldham and Richard Sharp couldn't anticipate that they would be sailing directly into one of the most catastrophic hurricanes in recorded history. In the aftermath of the storm, Tami awakens to find Richard badly injured and their boat in ruins. With no hope of rescue, Tami must now find the strength and determination to save herself and the only man she has ever loved.",en,"CN, IS, US"
Den of Thieves,2018,"Action, Crime, Thriller, Drama",6.836,140,Christian Gudegast,,"Gerard Butler, Pablo Schreiber, O'Shea Jackson Jr.",A gritty crime saga which follows the lives of an elite unit of the LA County Sheriff's Dept. and the state's most successful bank robbery crew as the outlaws plan a seemingly impossible heist on the Federal Reserve Bank.,en,US
Bird Box,2018,"Horror, Thriller, Drama",6.833,124,Susanne Bier,,"Sandra Bullock, Trevante Rhodes, John Malkovich","Five years after an ominous unseen presence drives most of society to suicide, a survivor and her two children make a desperate bid to reach safety.",en,US
Venom,2018,"Science Fiction, Action",6.828,112,Ruben Fleischer,,"Tom Hardy, Michelle Williams, Riz Ahmed","Investigative journalist Eddie Brock attempts a comeback following a scandal, but accidentally becomes the host of Venom, a violent, super powerful alien symbiote. Soon, he must rely on his newfound powers to protect the world from a shadowy organization looking for a symbiote of their own.",en,US
Outlaw King,2018,"Action, History, War",6.818,122,David Mackenzie,,"Chris Pine, Aaron Taylor-Johnson, Florence Pugh","Forced into exile by the English after being crowned King of Scotland, legendary warrior Robert the Bruce fights to reclaim the throne.",en,"US, GB"
Smallfoot,2018,"Family, Animation, Adventure, Fantasy, Comedy",6.8,96,Karey Kirkpatrick,Eyal Podell,"Channing Tatum, James Corden, Zendaya",A bright young yeti finds something he thought didn't exist—a human. News of this “smallfoot” throws the simple yeti community into an uproar over what else might be out there in the big world beyond their snowy village.,en,US
Black Mirror: Bandersnatch,2018,"Science Fiction, Mystery, Drama, Thriller, TV Movie",6.8,90,David Slade,Charlie Brooker,"Fionn Whitehead, Craig Parkinson, Alice Lowe","In 1984, a young programmer begins to question reality as he adapts a dark fantasy novel into a video game. A mind-bending tale with multiple endings.",en,"GB, US"
The Equalizer 2,2018,"Action, Thriller, Crime",6.8,121,Antoine Fuqua,,"Denzel Washington, Pedro Pascal, Ashton Sanders","Robert McCall, who serves an unflinching justice for the exploited and oppressed, embarks on a relentless, globe-trotting quest for vengeance when his former partner is murdered.",en,US
Sorry to Bother You,2018,"Fantasy, Science Fiction, Comedy",6.797,112,Boots Riley,,"LaKeith Stanfield, Tessa Thompson, Jermaine Fowler","In an alternate present-day version of Oakland, black telemarketer Cassius Green discovers a magical key to professional success – which propels him into a macabre universe.",en,US
Level 16,2018,"Science Fiction, Thriller",6.764,102,Danishka Esterhazy,Danishka Esterhazy,"Katie Douglas, Celina Martin, Peter Outerbridge","The teenage girls of Vestalis Academy are meticulously trained in the art of being “clean girls,” practicing the virtues of perfect femininity. But what exactly are they being trained for? Vivien intends to find out.",en,"CA, US"
Overlord,2018,"Horror, War, Science Fiction",6.724,110,Julius Avery,,"Jovan Adepo, Wyatt Russell, Pilou Asbæk","France, June 1944. On the eve of D-Day, some American paratroopers fall behind enemy lines after their aircraft crashes while on a mission to destroy a radio tower in a small village near the beaches of Normandy. After reaching their target, the surviving paratroopers realise that, in addition to fighting the Nazi troops that patrol the village, they also must fight against something else.",en,US
Peppermint,2018,"Action, Thriller",6.719,102,Pierre Morel,,"Jennifer Garner, John Gallagher Jr., John Ortiz","A grieving mother transforms herself into a vigilante following the murders of her husband and daughter, eluding the authorities to deliver her own personal brand of justice.",en,US
Bumblebee,2018,"Action, Adventure, Science Fiction",6.719,113,Travis Knight,Christina Hodson,"Hailee Steinfeld, John Cena, Jorge Lendeborg Jr.","On the run in the year 1987, Bumblebee finds refuge in a junkyard in a small Californian beach town. Charlie, on the cusp of turning 18 and trying to find her place in the world, discovers Bumblebee, battle-scarred and broken.  When Charlie revives him, she quickly learns this is no ordinary yellow VW bug.",en,US
Operation Finale,2018,"Drama, History, Thriller",6.701,124,Chris Weitz,Matthew Orton,"Oscar Isaac, Ben Kingsley, Mélanie Laurent","In 1960, a team of Israeli secret agents is deployed to find Adolf Eichmann, the infamous Nazi architect of the Holocaust, supposedly hidden in Argentina, and get him to Israel to be judged.",en,US
Hot Summer Nights,2018,"Drama, Crime",6.7,107,Elijah Bynum,Elijah Bynum,"Timothée Chalamet, Maika Monroe, Alex Roe","In 1991, a sheltered teenager comes of age during a wild summer on Cape Cod, getting rich from selling pot to gangsters, falling in love for the first time, partying, and eventually realizing that he's in way over his head.",en,US
Peter Rabbit,2018,"Animation, Adventure, Family",6.7,93,Will Gluck,Will Gluck,"James Corden, Rose Byrne, Domhnall Gleeson",Peter Rabbit's feud with Mr. McGregor escalates to greater heights than ever before as they rival for the affections of the warm-hearted animal lover who lives next door.,en,"AU, US"
A Prayer Before Dawn,2018,"Drama, Action, Crime",6.7,116,Jean-Stéphane Sauvaire,,"Joe Cole, Vithaya Pansringarm, Pornchanok Mabklang","The amazing true story of Billy Moore, an English boxer incarcerated in Thailand’s most notorious prison. Thrown into a world of drugs and violence, he finds his best chance to escape is to fight his way out in prison Muay Thai tournaments.",en,GB
Uncle Drew,2018,Comedy,6.7,103,Charles Stone III,Jay Longino,"Kyrie Irving, Lil Rel Howery, Shaquille O'Neal",Uncle Drew recruits a squad of older basketball players to return to the court to compete in a tournament.,en,US
Tag,2018,"Comedy, Action",6.7,100,Jeff Tomsic,,"Ed Helms, Jon Hamm, Jeremy Renner","For one month every year, five highly competitive friends hit the ground running in a no-holds-barred game of tag they’ve been playing since the first grade. This year, the game coincides with the wedding of their only undefeated player, which should finally make him an easy target. But he knows they’re coming...and he’s ready.",en,US
Fifty Shades Freed,2018,"Drama, Romance",6.698,105,James Foley,,"Dakota Johnson, Jamie Dornan, Eric Johnson","Believing they have left behind shadowy figures from their past, newlyweds Christian and Ana fully embrace an inextricable connection and shared life of luxury. But just as she steps into her role as Mrs. Grey and he relaxes into an unfamiliar stability, new threats could jeopardize their happy ending before it even begins.",en,US
The Current War,2018,"Drama, History",6.697,108,Alfonso Gomez-Rejon,,"Benedict Cumberbatch, Michael Shannon, Nicholas Hoult",Electricity titans Thomas Edison and George Westinghouse compete to create a sustainable system and market it to the American people.,en,US
A Simple Favor,2018,"Crime, Thriller, Comedy",6.634,117,Paul Feig,Paul Feig,"Anna Kendrick, Blake Lively, Henry Golding","Stephanie, a dedicated mother and popular vlogger, befriends Emily, a mysterious upper-class woman whose son Nicky attends the same school as Miles, Stephanie's son. When Emily asks her to pick Nicky up from school and then disappears, Stephanie undertakes an investigation that will dive deep into Emily's cloudy past.",en,"US, CA, LU"
Halloween,2018,"Horror, Thriller",6.6,106,David Gordon Green,Jeff Fradley,"Jamie Lee Curtis, Judy Greer, Andi Matichak","Laurie Strode comes to her final confrontation with Michael Myers, the masked figure who has haunted her since she narrowly escaped his killing spree on Halloween night four decades ago.",en,US
Unbroken: Path to Redemption,2018,Drama,6.6,98,Harold Cronk,,"Samuel Hunt, Merritt Patterson, Bob Gunton","Zamperini returns to California where he wound up marrying Cynthia Applewhite while wrestling with untreated PTSD, suffering constant nightmares, angry, bitter and deeply depressed, his wife convinces Zamperini to attend the 1949 Billy Graham Crusade.",en,US
Overboard,2018,"Romance, Comedy",6.6,112,Rob Greenberg,,"Anna Faris, Eugenio Derbez, Eva Longoria","A spoiled, wealthy yacht owner is thrown overboard and becomes the target of revenge from his mistreated employee.",en,US
When We First Met,2018,"Comedy, Romance, Fantasy",6.567,97,Ari Sandel,John Whittington,"Adam Devine, Alexandra Daddario, Shelley Hennig","Noah spends the perfect first night with the girl of his dreams Avery but gets relegated to the friend zone. He spends the next three years wondering what went wrong - until he gets the unexpected chance to travel back in time and alter that night, and his fate, over and over again.",en,US
Mary Queen of Scots,2018,"Drama, History",6.563,124,Josie Rourke,,"Saoirse Ronan, Margot Robbie, Jack Lowden","In 1561, Mary Stuart, widow of the King of France, returns to Scotland, reclaims her rightful throne and menaces the future of Queen Elizabeth I as ruler of England, because she has a legitimate claim to the English throne. Betrayals, rebellions, conspiracies and their own life choices imperil both Queens. They experience the bitter cost of power, until their tragic fate is finally fulfilled.",en,"GB, US"
Solo: A Star Wars Story,2018,"Science Fiction, Adventure, Action",6.554,135,Ron Howard,Lawrence Kasdan,"Alden Ehrenreich, Joonas Suotamo, Woody Harrelson","Through a series of daring escapades deep within a dark and dangerous criminal underworld, Han Solo meets his mighty future copilot Chewbacca and encounters the notorious gambler Lando Calrissian.",en,US
Red Sparrow,2018,"Thriller, Mystery",6.534,140,Francis Lawrence,,"Jennifer Lawrence, Joel Edgerton, Matthias Schoenaerts","Prima ballerina Dominika Egorova faces a bleak and uncertain future after she suffers an injury that ends her career. She soon turns to Sparrow School, a secret intelligence service that trains exceptional young people to use their minds and bodies as weapons. Dominika emerges as the most dangerous Sparrow after completing the sadistic training process. As she comes to terms with her new abilities, she meets a CIA agent who tries to convince her that he is the only person she can trust.",en,US
Alpha,2018,"Adventure, Drama",6.522,97,Albert Hughes,,"Kodi Smit-McPhee, Jóhannes Haukur Jóhannesson, Marcin Kowalczyk","In the prehistoric past, Keda, a young and inexperienced hunter, struggles to return home after being separated from his tribe when bison hunting goes awry. On his way back he will find an unexpected ally.",en,US
Look Away,2018,"Horror, Thriller, Fantasy",6.52,103,Assaf Bernstein,Assaf Bernstein,"India Eisley, Jason Isaacs, Mira Sorvino",A timid and socially alienated 17-year-old high school student's life is turned upside down when she switches places with her sinister mirror image.,en,"CA, US"
Arctic,2018,"Drama, Adventure",6.505,98,Joe Penna,,"Mads Mikkelsen, Maria Thelma Smáradóttir, Tintrinai Thikhasuk","A man stranded in the Arctic is finally about to receive his long awaited rescue. However, after a tragic accident, his opportunity is lost and he must then decide whether to remain in the relative safety of his camp or embark on a deadly trek through the unknown for potential salvation.",en,US
Mary Poppins Returns,2018,"Fantasy, Family, Comedy",6.5,131,Rob Marshall,,"Emily Blunt, Lin-Manuel Miranda, Ben Whishaw","Mary Poppins returns to the Banks family and helps them evade grave dangers by taking them on magical, musical adventures.",en,US
Jurassic World: Fallen Kingdom,2018,"Action, Adventure, Science Fiction, Thriller",6.5,129,J.A. Bayona,Derek Connolly,"Chris Pratt, Bryce Dallas Howard, Rafe Spall","Three years after Jurassic World was destroyed, Isla Nublar now sits abandoned. When the island's dormant volcano begins roaring to life, Owen and Claire mount a campaign to rescue the remaining dinosaurs from this extinction-level event.",en,US
Widows,2018,"Crime, Thriller",6.491,129,Steve McQueen,,"Viola Davis, Michelle Rodriguez, Elizabeth Debicki","A police shootout leaves four thieves dead during an explosive armed robbery attempt in Chicago. Their widows have nothing in common except a debt left behind by their spouses' criminal activities. Hoping to forge a future on their own terms, they join forces to pull off a heist.",en,"US, GB"
Mowgli: Legend of the Jungle,2018,"Adventure, Drama",6.475,105,Andy Serkis,,"Rohan Chand, Christian Bale, Cate Blanchett","A human child raised by wolves, must face off against a menacing tiger named Shere Khan, as well as his own origins.",en,"US, GB"
Rampage,2018,"Action, Adventure, Science Fiction",6.456,107,Brad Peyton,,"Dwayne Johnson, Naomie Harris, Malin Åkerman","Primatologist Davis Okoye shares an unshakable bond with George, the extraordinarily intelligent, silverback gorilla who has been in his care since birth.  But a rogue genetic experiment gone awry mutates this gentle ape into a raging creature of enormous size.  To make matters worse, it’s soon discovered there are other similarly altered animals.  As these newly created alpha predators tear across North America, destroying everything in their path, Okoye teams with a discredited genetic engineer to secure an antidote, fighting his way through an ever-changing battlefield, not only to halt a global catastrophe but to save the fearsome creature that was once his friend.",en,US
Annihilation,2018,"Science Fiction, Horror",6.424,115,Alex Garland,,"Natalie Portman, Jennifer Jason Leigh, Gina Rodriguez","A biologist signs up for a dangerous, secret expedition into a mysterious zone where the laws of nature don't apply.",en,US
Under the Silver Lake,2018,"Crime, Drama, Mystery",6.4,139,David Robert Mitchell,David Robert Mitchell,"Andrew Garfield, Riley Keough, Topher Grace","Young and disenchanted Sam meets a mysterious and beautiful woman who's swimming in his building's pool one night. When she suddenly vanishes the next morning, Sam embarks on a surreal quest across Los Angeles to decode the secret behind her disappearance, leading him into the murkiest depths of mystery, scandal and conspiracy.",en,US
The Spy Who Dumped Me,2018,"Comedy, Action, Adventure",6.4,116,Susanna Fogel,Susanna Fogel,"Mila Kunis, Kate McKinnon, Justin Theroux",A couple of thirtysomething best friends unwittingly become entangled in an international conspiracy when one’s ex-boyfriend shows up at their apartment with a team of deadly assassins on his trail.,en,US
Terrifier,2018,"Horror, Thriller",6.4,85,Damien Leone,Damien Leone,"David Howard Thornton, Jenna Kanell, Samantha Scaffidi",A maniacal clown named Art terrorizes three young women on Halloween night and everyone else who stands in his way.,en,US
The Commuter,2018,"Action, Thriller, Mystery",6.4,104,Jaume Collet-Serra,Byron Willinger,"Liam Neeson, Patrick Wilson, Sam Neill","A businessman, on his daily commute home, gets unwittingly caught up in a criminal conspiracy that threatens not only his life but the lives of those around him.",en,US
I Feel Pretty,2018,"Comedy, Romance",6.389,110,Abby Kohn,Abby Kohn,"Amy Schumer, Michelle Williams, Tom Hopper",A head injury causes a woman to develop an extraordinary amount of confidence and believe she's drop dead gorgeous.,en,US
Tomb Raider,2018,"Action, Adventure, Fantasy",6.367,118,Roar Uthaug,,"Alicia Vikander, Dominic West, Walton Goggins","Lara Croft, the fiercely independent daughter of a missing adventurer, must push herself beyond her limits when she finds herself on the island where her father disappeared.",en,"GB, US"
The Beach House,2018,"TV Movie, Romance, Drama",6.349,90,Roger Spottiswoode,,"Minka Kelly, Chad Michael Murray, Andie MacDowell","Cara Rudland thought she’d left her Southern roots and troubled family far behind, but returns to the scenic Lowcountry of her childhood summers after losing her job in Chicago. There, she reconnects with her mother Lovie, who has been caring for her young, pregnant friend Toy in her charming beach house.",en,US
12 Strong,2018,"War, Drama, Action, History",6.332,130,Nicolai Fuglsig,Ted Tally,"Chris Hemsworth, Michael Shannon, Michael Peña",A team of special forces head into Afghanistan in the aftermath of the September 11th attacks in an attempt to dismantle the Taliban.,en,US
The Meg,2018,"Action, Science Fiction, Horror",6.3,113,Jon Turteltaub,,"Jason Statham, Li Bingbing, Rainn Wilson","A deep sea submersible pilot revisits his past fears in the Mariana Trench, and accidentally unleashes the seventy foot ancestor of the Great White Shark believed to be extinct.",en,US
White Boy Rick,2018,"Crime, Drama",6.3,111,Yann Demange,Noah Miller,"Richie Merritt, Matthew McConaughey, Jennifer Jason Leigh","The story of Richard Wershe Jr., a teenager who became an undercover informant for the police during the 1980s, and was ultimately arrested for drug trafficking and sentenced to life in prison.",en,US
Blockers,2018,Comedy,6.3,102,Kay Cannon,Jim Kehoe,"Leslie Mann, John Cena, Ike Barinholtz","When three parents discover that each of their daughters have a pact to lose their virginity at prom, they launch a covert one-night operation to stop the teens from sealing the deal.",en,US
Second Act,2018,"Romance, Comedy",6.3,103,Peter Segal,Justin Zackham,"Jennifer Lopez, Vanessa Hudgens, Leah Remini","Value Shop assistant manager Maya Vargas wants only one thing for her 43rd birthday -- a promotion. While her résumé may not scream upper management, her track record certainly does; she is an innovator who listens to her customers and delivers results. When she loses the job to a college-educated candidate, Maya sets out to prove to Madison Avenue that street smarts are as valuable as book smarts -- and it's never too late for a second act.",en,US
Unfriended: Dark Web,2018,"Horror, Thriller, Mystery",6.3,92,Stephen Susco,Stephen Susco,"Colin Woodell, Betty Gabriel, Rebecca Rittenhouse","​When a 20-something finds a cache of hidden files on his new laptop, he and his friends are unwittingly thrust into the depths of the dark web. They soon discover someone has been watching their every move and will go to unimaginable lengths to protect the dark web.",en,US
Skyscraper,2018,"Action, Thriller, Adventure",6.3,102,Rawson Marshall Thurber,,"Dwayne Johnson, Neve Campbell, Chin Han","Framed and on the run, a former FBI agent must save his family from a blazing fire in the world's tallest building.",en,US
