Title,Year,Genres,Rating,Popularity,Runtime,Director,Writer,Actors,Keywords,Plot,Ratings Amount,Language,Country
Zack Snyder's Justice League,2021,"Action, Adventure, Fantasy",8.129,27.954,242,Zack Snyder,,"Ben Affleck, Henry Cavill, Gal Gadot","saving the world, superhero, resurrection, based on comic, superhero team, planet invasion, action hero, dc extended universe (dceu), superhero teamup","Determined to ensure Superman's ultimate sacrifice was not in vain, Bruce Wayne aligns forces with Diana Prince with plans to recruit a team of metahumans to protect the world from an approaching threat of catastrophic proportions.",10131,en,US
Palmer,2021,Drama,8.1,11.05,110,Fisher Stevens,Cheryl Guerriero,"Justin Timberlake, Ryder Allen, Juno Temple","small town, homophobia, young boy, ex-con, house trailer, bullied, irresponsible parent, adult child friendship, guardianship, drug addict","After 12 years in prison, former high school football star Eddie Palmer returns home to put his life back together—and forms an unlikely bond with Sam, an outcast boy from a troubled home. But Eddie's past threatens to ruin his new life and family.",1658,en,US
Bo Burnham: Inside,2021,"Comedy, Drama",8.0,7.557,87,Bo Burnham,Bo Burnham,Bo Burnham,"quarantine, stand-up comedy, breaking the fourth wall, youtube, mental illness, sketch comedy, pandemic, internet culture, musical comedy, covid-19, one man crew, facetime","Stuck in COVID-19 lockdown, US comedian and musician Bo Burnham attempts to stay sane and happy by writing, shooting and performing a one-man comedy special.",514,en,US
Cruella,2021,"Comedy, Crime, Family, Adventure",7.999,26.191,134,Craig Gillespie,,"Emma Stone, Emma Thompson, Joel Fry","1970s, anti hero, villain, punk rock, fashion designer, fashion, origin story, live action remake","In 1970s London amidst the punk rock revolution, a young grifter named Estella is determined to make a name for herself with her designs. She befriends a pair of young thieves who appreciate her appetite for mischief, and together they are able to build a life for themselves on the London streets. One day, Estella’s flair for fashion catches the eye of the Baroness von Hellman, a fashion legend who is devastatingly chic and terrifyingly haute. But their relationship sets in motion a course of events and revelations that will cause Estella to embrace her wicked side and become the raucous, fashionable and revenge-bent Cruella.",9472,en,US
CODA,2021,"Drama, Music, Romance",7.935,9.78,112,Siân Heder,,"Emilia Jones, Marlee Matlin, Troy Kotsur","parent child relationship, music teacher, fishing, deaf, massachusetts, coming of age, remake, singing, family, first love, disability, based on movie, woman director, sign languages, school choir, music school, calm, asl, loving, teenager, appreciative","As a CODA (Child of Deaf Adults), Ruby is the only hearing person in her deaf family. When the family's fishing business is threatened, Ruby finds herself torn between pursuing her love of music and her fear of abandoning her parents.",2294,en,US
Spider-Man: No Way Home,2021,"Action, Adventure, Science Fiction",7.9,76.863,148,Jon Watts,Chris McKenna,"Tom Holland, Zendaya, Benedict Cumberbatch","new york city, hero, showdown, magic, loss of loved one, secret identity, superhero, villain, portal, sequel, vigilante, superhero team, masked vigilante, spider web, alternative reality, aftercreditsstinger, duringcreditsstinger, marvel cinematic universe (mcu), fight for justice, teen superhero, superhero teamup, returning hero, crossover, teamwork, admiring","Peter Parker is unmasked and no longer able to separate his normal life from the high-stakes of being a super-hero. When he asks for help from Doctor Strange the stakes become even more dangerous, forcing him to discover what it truly means to be Spider-Man.",20547,en,US
Wish Dragon,2021,"Animation, Family, Comedy, Fantasy",7.9,11.781,99,Chris Appelhans,Amy Bloom,"Jimmy Wong, John Cho, Constance Wu","wish, dragon",Determined teen Din is longing to reconnect with his childhood best friend when he meets a wish-granting dragon who shows him the magic of possibilities.,1362,en,US
Ron's Gone Wrong,2021,"Animation, Science Fiction, Family, Comedy",7.9,11.617,107,Sarah Smith,Sarah Smith,"Zach Galifianakis, Jack Dylan Grazer, Ed Helms","family, best friend forever","In a world where walking, talking, digitally connected bots have become children's best friends, an 11-year-old finds that his robot buddy doesn't quite work the same as the others do.",1880,en,"US, GB"
Nobody,2021,"Action, Thriller",7.9,18.067,92,Ilya Naishuller,,"Bob Odenkirk, Aleksey Serebryakov, Connie Nielsen","assassin, double life, fight, midlife crisis, bratva (russian mafia), secret organization, thief, home invasion, family, brawl, duringcreditsstinger, aggressive, tense","Hutch Mansell, a suburban dad, overlooked husband, nothing neighbor — a ""nobody."" When two thieves break into his home one night, Hutch's unknown long-simmering rage is ignited and propels him on a brutal path that will uncover dark secrets he fought to leave behind.",7236,en,US
Friends: The Reunion,2021,Documentary,7.9,7.476,104,Ben Winston,,"Jennifer Aniston, Courteney Cox, Lisa Kudrow","reunion, friends, sitcom, tv series reunion","The cast of Friends reunites for a once-in-a-lifetime celebration of the hit series, an unforgettable evening filled with iconic memories, uncontrollable laughter, happy tears, and special guests.",1225,en,US
The Immortal Wars: Rebirth,2021,Science Fiction,7.9,8.925,84,Joe Lujan,Joe Lujan,"Corey Taylor, Destiny Salas, Lindsey Cruz",,Rebirth takes place during the early brutal stages of Dominion Industries. In this story watch Olive and other deviants undergo a series of deadly experiments lead by Laurie Harvey and her team.,30,en,US
Sing 2,2021,"Animation, Family, Music, Comedy",7.9,26.863,110,Garth Jennings,Garth Jennings,"Matthew McConaughey, Reese Witherspoon, Scarlett Johansson","wolf, stage, villain, sequel, anthropomorphism, singing, thug, animals, villain arrested, illumination, suspenseful","Buster and his new cast now have their sights set on debuting a new show at the Crystal Tower Theater in glamorous Redshore City. But with no connections, he and his singers must sneak into the Crystal Entertainment offices, run by the ruthless wolf mogul Jimmy Crystal, where the gang pitches the ridiculous idea of casting the lion rock legend Clay Calloway in their show. Buster must embark on a quest to find the now-isolated Clay and persuade him to return to the stage.",4457,en,US
The Mitchells vs. the Machines,2021,"Animation, Adventure, Comedy",7.893,18.148,110,Mike Rianda,Jeff Rowe,"Abbi Jacobson, Danny McBride, Maya Rudolph","man vs machine, technology, dysfunctional family, family relationships, family drama, father daughter conflict, evil robot, inspirational","A quirky, dysfunctional family's road trip is upended when they find themselves in the middle of the robot apocalypse and suddenly become humanity's unlikeliest last hope.",2999,en,US
Finch,2021,"Science Fiction, Drama, Adventure",7.856,12.971,115,Miguel Sapochnik,Craig Luck,"Tom Hanks, Caleb Landry Jones, Oscar Avila","robot, taunting, questioning, journey, speculative, humanity, unassuming, reflective, wistful, post-apocalyptic, provocative, witty, sinister, whimsical, pretentious, sincere, skeptical, straightforward, sympathetic, tragic, vibrant","On a post-apocalyptic Earth, a robot, built to protect the life of his dying creator's beloved dog, learns about life, love, friendship, and what it means to be human.",3606,en,US
Gone Mom: The Disappearance of Jennifer Dulos,2021,"TV Movie, Thriller, Crime",7.8,8.771,88,Gail Harvey,Richard Blaney,"Annabeth Gish, Warren Christie, Laura Harris",,"Jennifer Dulos, the wealthy, Connecticut mother-of-five who mysteriously vanished.",234,en,US
Luca,2021,"Animation, Comedy, Fantasy, Adventure, Family",7.8,27.429,95,Enrico Casarosa,,"Jacob Tremblay, Jack Dylan Grazer, Emma Berman","friendship, monster, italy, villain, coming of age, friends, bromance, sea monster, vespa, aftercreditsstinger, seaside town, 1950s, pasta, water, italian riviera, pesto",Luca and his best friend Alberto experience an unforgettable summer on the Italian Riviera. But all the fun is threatened by a deeply-held secret: they are sea monsters from another world just below the water’s surface.,8446,en,US
Raya and the Last Dragon,2021,"Animation, Family, Fantasy, Action, Adventure",7.8,29.198,107,Don Hall,,"Kelly Marie Tran, Awkwafina, Gemma Chan","kung fu, sword, warrior woman, female protagonist, dragon, vietnamese, south asian, warrior","Long ago, in the fantasy world of Kumandra, humans and dragons lived together in harmony. But when an evil force threatened the land, the dragons sacrificed themselves to save humanity. Now, 500 years later, that same evil has returned and it’s up to a lone warrior, Raya, to track down the legendary last dragon to restore the fractured land and its divided people.",6863,en,US
Us Again,2021,"Animation, Drama, Family, Romance",7.8,7.61,7,Zach Parrish,Zach Parrish,,"new york city, dancing, rain, musical, lovers, elderly couple, short film","In a vibrant city pulsating with rhythm and movement, an elderly man and his young-at-heart wife rekindle their youthful passion for life and each other on one magical night.",328,en,US
Dune,2021,"Science Fiction, Adventure",7.784,43.357,155,Denis Villeneuve,,"Timothée Chalamet, Rebecca Ferguson, Oscar Isaac","empire, future, epic, army, based on novel or book, prophecy, dystopia, emperor, sand, spice, hallucinogen, treason, baron, revenge, premonition, betrayal, space, water shortage, creature, desert, knife fight, destiny, giant worm, space opera, sand dune, messiah, domineering, mother son relationship, wonder, giant creature, grand, suspenseful, intense, audacious, awestruck, bold, foreboding, powerful","Paul Atreides, a brilliant and gifted young man born into a great destiny beyond his understanding, must travel to the most dangerous planet in the universe to ensure the future of his family and his people. As malevolent forces explode into conflict over the planet's exclusive supply of the most precious resource in existence-a commodity capable of unlocking humanity's greatest potential-only those who can conquer their fear will survive.",13216,en,US
My Little Pony: A New Generation,2021,"Animation, Family, Fantasy, Comedy, Adventure",7.7,7.491,90,Robert Cullen,,"Vanessa Hudgens, Kimiko Glenn, James Marsden","flying horse, pony, unicorn","Equestria's divided. But a bright-eyed hero believes Earth Ponies, Pegasi and Unicorns should be pals — and, hoof to heart, she’s determined to prove it.",310,en,"CA, IE, US"
Straight Outta Nowhere: Scooby-Doo! Meets Courage the Cowardly Dog,2021,"Animation, Comedy, Mystery, Family, Fantasy, Adventure, Horror",7.7,7.603,72,Cecilia Aranovich,Michael Ryan,"Matthew Lillard, Thea White, Grey DeLisle","friendship, monster, friends, crossover","With Mystery, Inc. on the tail of a strange object in Nowhere, Kansas, the strange hometown of Eustice, Muriel, and Courage, the gang soon find themselves contending with a giant cicada monster and her winged warriors.",386,en,US
Back to the Outback,2021,"Family, Animation, Adventure, Comedy",7.7,8.211,92,Claire Knight,Harry Cripps,"Isla Fisher, Tim Minchin, Eric Bana","creature, koala","Tired of being locked in a reptile house where humans gawk at them like they are monsters, a ragtag group of Australia’s deadliest creatures plot an escape from their zoo to the Outback, a place where they’ll fit in without being judged.",731,en,US
TINA,2021,"Documentary, Music, TV Movie",7.681,10.877,118,T.J. Martin,,"Tina Turner, Angela Bassett, Oprah Winfrey","icon, biography, rags to riches, celebrity, rock music, portrait of an artist, music documentary, soul music, artistic legacy, musical performance, live musical performance, african american musician",Tina Turner overcame impossible odds to become one of the first female Black artists to reach a mainstream international audience. Her road to superstardom is an undeniable story of triumph over adversity. It’s the ultimate story of survival – and an inspirational story of our times.,69,en,"GB, US"
"tick, tick... BOOM!",2021,"Drama, Music",7.632,7.463,115,Lin-Manuel Miranda,Jonathan Larson,"Andrew Garfield, Alexandra Shipp, Robin de Jesús","new york city, composer, artist, melancholy, musical, based on true story, based on play or musical, singing, boyfriend girlfriend relationship, struggling artist, 1990s, portrait of an artist, hiv/aids epidemic, inspirational, theater","On the brink of turning 30, a promising theater composer navigates love, friendship and the pressure to create something great before time runs out.",2098,en,US
Wrath of Man,2021,"Crime, Action, Thriller",7.624,45.492,118,Guy Ritchie,,"Jason Statham, Holt McCallany, Josh Hartnett","robbery, crime boss, revenge, shootout, shooter, los angeles, california, theft, security guard, ex soldier, aggressive, cash truck, earnest","A cold and mysterious new security guard for a Los Angeles cash truck company surprises his co-workers when he unleashes precision skills during a heist. The crew is left wondering who he is and where he came from. Soon, the marksman's ultimate motive becomes clear as he takes dramatic and irrevocable steps to settle a score.",5471,en,US
The Fallout,2021,Drama,7.6,14.484,96,Megan Park,,"Jenna Ortega, Maddie Ziegler, Niles Fitch","high school, trauma, coming of age, female protagonist, school shooting, woman director, generation z, sister sister relationship","In the wake of a school tragedy, Vada, Mia and Quinton form a unique and dynamic bond as they navigate the never linear, often confusing journey to heal in a world that feels forever changed.",1157,en,US
Mortal Kombat Legends: Battle of the Realms,2021,"Animation, Action, Fantasy",7.6,9.25,80,Ethan Spaulding,Jeremy Adams,"Jordan Rodrigues, Jennifer Carpenter, Joel McHale","chosen one, based on video game, martial arts tournament, adult animation, extreme blood","The Earthrealm heroes must journey to the Outworld and fight for the survival of their homeland, invaded by the forces of evil warlord Shao Kahn, in the tournament to end all tournaments: the final Mortal Kombat.",442,en,US
Godzilla vs. Kong,2021,"Action, Science Fiction, Adventure",7.6,19.488,114,Adam Wingard,,"Alexander Skarsgård, Rebecca Hall, Kaylee Hottle","giant monster, dinosaur, creature feature, kaiju, sign languages, giant ape, godzilla, robot dinosaur, king kong","In a time when monsters walk the Earth, humanity’s fight for its future sets Godzilla and Kong on a collision course that will see the two most powerful forces of nature on the planet collide in a spectacular battle for the ages.",10093,en,US
Girl in the Basement,2021,"Thriller, Crime, TV Movie",7.6,32.467,88,Elisabeth Röhm,Manu Boyer,"Judd Nelson, Stefanie Scott, Joely Fisher","imprisonment, based on true story, basement, controlling parent","Sara is a teen girl who is looking forward to her 18th birthday to move away from her controlling father Don. But before she could even blow out the candles, Don imprisons her in the basement of their home.",727,en,US
King Richard,2021,"Drama, History",7.6,9.586,144,Reinaldo Marcus Green,Zach Baylin,"Will Smith, Aunjanue Ellis-Taylor, Saniyya Sidney","sports, tennis, tennis player, father, based on true story, wimbledon, family, tennis pro, father daughter relationship, coaching, champions","The story of how Richard Williams served as a coach to his daughters Venus and Serena, who will soon become two of the most legendary tennis players in history.",2543,en,US
Encanto,2021,"Animation, Comedy, Family, Fantasy",7.595,34.649,102,Byron Howard,,"Stephanie Beatriz, María Cecilia Botero, John Leguizamo","strong woman, magic, sadness, immigration, supernatural, beauty, musical, big family, forest, family secrets, family relationships, flamenco, joy of life, teenage girl, female protagonist, family conflict, helping children, matriarch, colombia","The tale of an extraordinary family, the Madrigals, who live hidden in the mountains of Colombia, in a magical house, in a vibrant town, in a wondrous, charmed place called an Encanto. The magic of the Encanto has blessed every child in the family—every child except one, Mirabel. But when she discovers that the magic surrounding the Encanto is in danger, Mirabel decides that she, the only ordinary Madrigal, might just be her exceptional family's last hope.",9612,en,US
Shang-Chi and the Legend of the Ten Rings,2021,"Action, Adventure, Fantasy",7.529,34.294,132,Destin Daniel Cretton,,"Simu Liu, Tony Leung, Awkwafina","martial arts, superhero, based on comic, mixed martial arts (mma), east asian lead, aftercreditsstinger, duringcreditsstinger, marvel cinematic universe (mcu), mysterious, father son relationship",Shang-Chi must confront the past he thought he left behind when he is drawn into the web of the mysterious Ten Rings organization.,9572,en,US
To All the Boys: Always and Forever,2021,"Romance, Comedy, Drama",7.526,11.956,115,Michael Fimognari,Katie Lovejoy,"Lana Condor, Noah Centineo, Janel Parrish","based on novel or book, south korea, asian american, seoul, south korea",Senior year of high school takes center stage as Lara Jean returns from a family trip to Korea and considers her college plans — with and without Peter.,1951,en,US
The Tomorrow War,2021,"Action, Science Fiction, Adventure",7.52,40.376,138,Chris McKay,,"Chris Pratt, Yvonne Strahovski, J.K. Simmons","world cup, time travel, global warming, glacier, alien, alien invasion, military, future war, father son reunion, hope for future, changing the past or future, message from the future, father son relationship, father daughter relationship, world war, depressing","The world is stunned when a group of time travelers arrive from the year 2051 to deliver an urgent message: Thirty years in the future, mankind is losing a global war against a deadly alien species. The only hope for survival is for soldiers and civilians from the present to be transported to the future and join the fight. Among those recruited is high school teacher and family man Dan Forester. Determined to save the world for his young daughter, Dan teams up with a brilliant scientist and his estranged father in a desperate quest to rewrite the fate of the planet.",3590,en,US
Trollhunters: Rise of the Titans,2021,"Animation, Fantasy, Family, Action, Adventure",7.5,7.496,106,Johane Matte,,"Emile Hirsch, Lexi Medrano, Charlie Saxton",tales of arcadia,"The Guardians of Arcadia reunite to battle the nefarious Arcane Order, who've reawakened the primordial Titans.",335,en,US
Fatherhood,2021,"Drama, Comedy",7.5,7.507,109,Paul Weitz,,"Kevin Hart, Melody Hurd, Alfre Woodard","baby, parenthood, fatherhood, social comedy","A widowed new dad copes with doubts, fears, heartache and dirty diapers as he sets out to raise his daughter on his own. Inspired by a true story.",1425,en,US
The Witcher: Nightmare of the Wolf,2021,"Animation, Action, Fantasy",7.5,8.855,83,Han Kwang-il,,"Theo James, Mary McDonnell, Lara Pulver","monster, magic, creature, fantasy world, excited","Escaping from poverty to become a witcher, Vesemir slays monsters for coin and glory, but when a new menace rises, he must face the demons of his past.",976,en,US
The Suicide Squad,2021,"Action, Comedy, Adventure",7.491,35.937,132,James Gunn,James Gunn,"Margot Robbie, Idris Elba, John Cena","monster, secret mission, superhero, anti hero, giant monster, gore, based on comic, alien, betrayal, alien invasion, convict, parasite, super villain, world domination, aftercreditsstinger, aggressive, dc extended universe (dceu), character deaths, amused, antagonistic","Supervillains Harley Quinn, Bloodsport, Peacemaker and a collection of nutty cons at Belle Reve prison join the super-secret, super-shady Task Force X as they are dropped off at the remote, enemy-infused island of Corto Maltese.",8774,en,US
Free Guy,2021,"Comedy, Adventure, Science Fiction",7.486,25.701,115,Shawn Levy,,"Ryan Reynolds, Jodie Comer, Joe Keery","hero, artificial intelligence (a.i.), video game, virtual reality, gun, code, gamer, bank robbery, bank teller, programmer, mmorpg, heroic, vrmmo","A bank teller discovers he is actually a background player in an open-world video game, and decides to become the hero of his own story. Now, in a world where there are no limits, he is determined to be the guy who saves his world his way before it's too late.",8953,en,US
A Quiet Place Part II,2021,"Science Fiction, Thriller, Horror",7.476,23.695,96,John Krasinski,John Krasinski,"Emily Blunt, John Krasinski, Millicent Simmonds","new york city, island, post-apocalyptic future, radio transmission, alien life-form, death of father, child in peril, sequel, alien, flashback, psychological thriller, creature, alien invasion, parenting, family, survival horror, alien monster, human vs alien, sign languages, alien attack, hostile, hearing impaired, newborn baby, anxious, dreary, suspenseful, tense, frightened","Following the events at home, the Abbott family now face the terrors of the outside world. Forced to venture into the unknown, they realize that the creatures that hunt by sound are not the only threats that lurk beyond the sand path.",6685,en,US
The Unforgivable,2021,"Drama, Crime",7.431,7.547,112,Nora Fingscheidt,,"Sandra Bullock, Viola Davis, Vincent D'Onofrio","redemption, incredulous",A woman is released from prison after serving a sentence for a violent crime and re-enters a society that refuses to forgive her past.,1846,en,US
The Last Duel,2021,"History, Drama, Action",7.428,15.239,153,Ridley Scott,,"Jodie Comer, Matt Damon, Adam Driver","based on novel or book, castle, male friendship, normandy, france, based on true story, trial, battlefield, knight, duel, battle, historical, catholic, sword duel, rape and revenge, historical drama, trial by combat, nobleman, squire, 14th century, knighthood, medieval france, medieval times, noble","King Charles VI declares that Knight Jean de Carrouges settle his dispute with his squire, Jacques Le Gris, by challenging him to a duel.",3438,en,US
The Conjuring: The Devil Made Me Do It,2021,"Horror, Mystery, Thriller",7.413,23.751,111,Michael Chaves,,"Patrick Wilson, Vera Farmiga, Ruairí O'Connor","supernatural, exorcism, connecticut, sequel, paranormal investigation, 1980s, somber, religious horror, the conjuring universe, frightened","Paranormal investigators Ed and Lorraine Warren encounter what would become one of the most sensational cases from their files. The fight for the soul of a young boy takes them beyond anything they'd ever seen before, to mark the first time in U.S. history that a murder suspect would claim demonic possession as a defense.",5986,en,US
No Time to Die,2021,"Action, Thriller, Adventure",7.4,21.246,163,Cary Joji Fukunaga,,"Daniel Craig, Léa Seydoux, Rami Malek","based on novel or book, forgiveness, poison, spy, mi6, family, british secret service, parents, global threat, nanobots","Bond has left active service and is enjoying a tranquil life in Jamaica. His peace is short-lived when his old friend Felix Leiter from the CIA turns up asking for help. The mission to rescue a kidnapped scientist turns out to be far more treacherous than expected, leading Bond onto the trail of a mysterious villain armed with dangerous new technology.",6404,en,GB
PAW Patrol: The Movie,2021,"Animation, Family, Adventure, Comedy",7.4,18.577,86,Cal Brunker,,"Tyler Perry, Ron Pardo, Will Brisbin","cartoon, dog, animals, kids",Ryder and the pups are called to Adventure City to stop Mayor Humdinger from turning the bustling metropolis into a state of chaos.,1222,en,US
South Park: Post COVID: The Return of COVID,2021,"Animation, Comedy, TV Movie",7.4,7.669,62,Trey Parker,Trey Parker,"Trey Parker, Matt Stone, April Stewart","time travel, pandemic, covid-19, disgusted","If Stan, Kyle and Cartman could just work together, they could go back in time to make sure Covid never happened. But traveling back to the past seems to be the easy answer until they meet Victor Chaos.",422,en,US
Monster Pets: A Hotel Transylvania Short,2021,"Animation, Comedy, Fantasy",7.4,7.613,6,Jennifer Kluska,,"Brian Hull, Jennifer Kluska, Derek Drymon","monster, pet, dog, animals, pets, dracula, short film",Drac tries out some new monster pets to help occupy Tinkles for playtime.,397,en,US
Ciao Alberto,2021,"Animation, Comedy, Family, Fantasy",7.4,7.442,7,McKenna Jean Harris,McKenna Jean Harris,"Jack Dylan Grazer, Marco Barricelli, Jacob Tremblay","sea, boat, mentor, pasta, short film, silence","With his best friend Luca away at school, Alberto is enjoying his new life in Portorosso working alongside Massimo—the imposing, tattooed, one-armed fisherman of few words—who's quite possibly the coolest human in the entire world as far as Alberto is concerned. He wants more than anything to impress his mentor, but it's easier said than done.",666,en,US
The Last Letter from Your Lover,2021,"Drama, Romance",7.396,10.73,110,Augustine Frizzell,Nick Payne,"Shailene Woodley, Felicity Jones, Callum Turner","london, england, based on novel or book, cheating, manipulation, love letter, french riviera, car accident, love affair, nonlinear timeline, female journalist, woman director, 1960s, lost memory",A young journalist in London becomes obsessed with a series of letters she discovers that recounts an intense star-crossed love affair from the 1960s.,607,en,"CA, FR, ES, GB"
