Title,Year,Genres,Rating,Runtime,Director,Writer,Actors,Plot,Language,Country
No Half Measures: Creating the Final Season of Breaking Bad,2013,Documentary,8.4,135,Stuart Richardson,,"Bryan Cranston, Aaron Paul, Anna Gunn",A documentary about the making of season five of the acclaimed AMC series Breaking Bad.,en,US
One Direction: This Is Us,2013,"Documentary, Music",8.3,107,Morgan Spurlock,,"Harry Styles, Zayn Malik, Liam Payne","""One Direction: This Is Us"" is a captivating and intimate all-access look at life on the road for the global music phenomenon. Weaved with stunning live concert footage, this inspiring feature film tells the remarkable story of Niall, Zayn, Liam, Harry and Louis' meteoric rise to fame, from their humble hometown beginnings and competing on the X-Factor, to conquering the world and performing at London’s famed O2 Arena. Hear it from the boys themselves and see through their own eyes what it's really like to be One Direction.",en,"GB, US"
Prisoners,2013,"Drama, Thriller, Crime",8.099,153,Denis Villeneuve,Aaron Guzikowski,"Hugh Jackman, Jake Gyllenhaal, Viola Davis","Keller Dover is facing every parent’s worst nightmare. His six-year-old daughter, Anna, is missing, together with her young friend, Joy, and as minutes turn to hours, panic sets in. The only lead is a dilapidated RV that had earlier been parked on their street.",en,US
Transformers Prime: Beast Hunters - Predacons Rising,2013,"Action, Animation, Science Fiction, TV Movie",8.0,66,Vinton Heuck,Steven Melching,"Peter Cullen, Frank Welker, Sumalee Montano","Autobots, Decepticons, Predaking and Predacons form an unlikely alliance to battle a resurrected Unicron.",en,US
The Wolf of Wall Street,2013,"Crime, Drama, Comedy",8.0,180,Martin Scorsese,,"Leonardo DiCaprio, Jonah Hill, Margot Robbie","A New York stockbroker refuses to cooperate in a large securities fraud case involving corruption on Wall Street, corporate banking world and mob infiltration. Based on Jordan Belfort's autobiography.",en,US
12 Years a Slave,2013,"Drama, History",7.937,134,Steve McQueen,,"Chiwetel Ejiofor, Michael Fassbender, Lupita Nyong'o","In the pre-Civil War United States, Solomon Northup, a free black man from upstate New York, is abducted and sold into slavery. Facing cruelty as well as unexpected kindnesses Solomon struggles not only to stay alive, but to retain his dignity. In the twelfth year of his unforgettable odyssey, Solomon’s chance meeting with a Canadian abolitionist will forever alter his life.",en,US
"Batman: The Dark Knight Returns, Part 2",2013,"Science Fiction, Action, Animation, Mystery, Crime, Drama, Thriller",7.922,78,Jay Oliva,,"Peter Weller, Ariel Winter, David Selby",Batman has stopped the reign of terror that The Mutants had cast upon his city.  Now an old foe wants a reunion and the government wants The Man of Steel to put a stop to Batman.,en,US
About Time,2013,"Drama, Romance, Fantasy",7.9,123,Richard Curtis,Richard Curtis,"Domhnall Gleeson, Rachel McAdams, Bill Nighy","The night after another unsatisfactory New Year's party, Tim's father tells his son that the men in his family have always had the ability to travel through time. They can't change history, but they can change what happens and has happened in their own lives. Thus begins the start of a lesson in learning to appreciate life itself as it is, as it comes, and most importantly, the people living alongside us.",en,GB
Dallas Buyers Club,2013,"Drama, History",7.9,117,Jean-Marc Vallée,Craig Borten,"Matthew McConaughey, Jennifer Garner, Jared Leto","Loosely based on the true-life tale of Ron Woodroof, a drug-taking, women-loving, homophobic man who in 1986 was diagnosed with HIV/AIDS and given thirty days to live.",en,US
Justice League: The Flashpoint Paradox,2013,"Animation, Science Fiction, Action, Adventure, Fantasy",7.9,75,Jay Oliva,,"Justin Chambers, C. Thomas Howell, Michael B. Jordan",The Flash finds himself in a war-torn alternate timeline and teams up with alternate versions of his fellow heroes to restore the timeline.,en,US
Monster High: Scaris City of Frights,2013,"Animation, Fantasy",7.872,61,Andrew Duncan,,"Salli Saffioti, Kate Higgins, Erin Fitzgerald","The Monstruitas of Monster High are obsessed with going to Scaris, The City of Frights for Fashion international competition where the winner will become the apprentice of the world famous Madame Ghostier designer.",en,US
Her,2013,"Romance, Science Fiction, Drama",7.852,126,Spike Jonze,Spike Jonze,"Joaquin Phoenix, Scarlett Johansson, Lynn Adrianna","In the not so distant future, Theodore, a lonely writer, purchases a newly developed operating system designed to meet the user's every need. To Theodore's surprise, a romantic relationship develops between him and his operating system. This unconventional love story blends science fiction and romance in a sweet tale that explores the nature of love and the ways that technology isolates and connects us all.",en,US
Monster High: 13 Wishes,2013,"Family, Fantasy, Animation",7.7,73,Steve Sacks,Ted Zizik,"America Young, Jonquil Goode, Salli Saffioti","It’s a new school year at Monster High™, and the little sister of Clawdeen Wolf™, Howleen, is determined to be more fangtastic than ever.  Her dream of popularity turns out to be easier than anyone imagined when she stumbles upon a genie named Gigi Grant™ who grants her not 3, but 13 Wishes!  But the ghouls quickly learn to be s-careful what you wish for because each wish comes with a dark side, and soon the student disem-body of Monster High™ is turned upside-down!  Join Frankie Stein™, Clawdeen Wolf™, Draculaura™ and the rest of their creeperiffic ghoulfriends as they journey deep inside the magic lantern to save the very soul of Monster High™… while flashing their killer style every step of the way!",en,US
Rush,2013,"Drama, Action",7.7,123,Ron Howard,Peter Morgan,"Chris Hemsworth, Daniel Brühl, Olivia Wilde","In the 1970s, a rivalry propels race car drivers Niki Lauda and James Hunt to fame and glory — until a horrible accident threatens to end it all.",en,"US, GB"
Scooby-Doo! Stage Fright,2013,"Family, Adventure, Animation, Comedy, Mystery",7.6,75,Victor Cook,Doug Langdale,"Frank Welker, Mindy Cohn, Grey DeLisle","Join Scooby-Doo, Shaggy and the Mystery Inc. crew as they head to Chicago for Talent Star, a hit talent show in which Fred and Daphne are finalists with some high hopes. Unlucky for them, the competition is frightful as the show is being broadcast from an opera house with a history of horrors and a particularly vengeful phantom that has cursed the show's production.",en,US
The Hobbit: The Desolation of Smaug,2013,"Fantasy, Adventure, Action",7.572,161,Peter Jackson,,"Ian McKellen, Martin Freeman, Richard Armitage","The Dwarves, Bilbo and Gandalf have successfully escaped the Misty Mountains, and Bilbo has gained the One Ring. They all continue their journey to get their gold back from the Dragon, Smaug.",en,US
The Conjuring,2013,"Horror, Thriller",7.539,112,James Wan,,"Patrick Wilson, Vera Farmiga, Lili Taylor","Paranormal investigators Ed and Lorraine Warren work to help a family terrorized by a dark presence in their farmhouse. Forced to confront a powerful entity, the Warrens find themselves caught in the most terrifying case of their lives.",en,US
Before Midnight,2013,"Romance, Drama",7.5,109,Richard Linklater,Richard Linklater,"Ethan Hawke, Julie Delpy, Seamus Davey-Fitzpatrick","It has been nine years since we last met Jesse and Celine, the French-American couple who once met on a train in Vienna. They now live in Paris with twin daughters but have spent a summer in Greece at the invitation of an author colleague of Jesse's. When the vacation is over and Jesse must send his teenage son off to the States, he begins to question his life decisions, and his relationship with Celine is at risk.",en,US
Captain Phillips,2013,"Action, Drama, Thriller",7.5,134,Paul Greengrass,,"Tom Hanks, Barkhad Abdi, Barkhad Abdirahman","The true story of Captain Richard Phillips and the 2009 hijacking by Somali pirates of the US-flagged MV Maersk Alabama, the first American cargo ship to be hijacked in two hundred years.",en,US
The Hunger Games: Catching Fire,2013,"Adventure, Action, Science Fiction",7.4,146,Francis Lawrence,,"Jennifer Lawrence, Josh Hutcherson, Liam Hemsworth","Katniss Everdeen has returned home safe after winning the 74th Annual Hunger Games along with fellow tribute Peeta Mellark. Winning means that they must turn around and leave their family and close friends, embarking on a ""Victor's Tour"" of the districts. Along the way Katniss senses that a rebellion is simmering, but the Capitol is still very much in control as President Snow prepares the 75th Annual Hunger Games (The Quarter Quell) - a competition that could change Panem forever.",en,US
Fruitvale Station,2013,Drama,7.4,82,Ryan Coogler,,"Michael B. Jordan, Melonie Diaz, Octavia Spencer","Oakland, California. Young Afro-American Oscar Grant crosses paths with family members, friends, enemies and strangers before facing his fate on the platform at Fruitvale Station, in the early morning hours of New Year's Day 2009.",en,US
Lone Survivor,2013,"War, Action, Drama",7.4,121,Peter Berg,Peter Berg,"Mark Wahlberg, Taylor Kitsch, Emile Hirsch","Four Navy SEALs on a covert mission to neutralize a high-level Taliban operative must make an impossible moral decision in the mountains of Afghanistan that leads them into an enemy ambush. As they confront unthinkable odds, the SEALs must find reserves of strength and resilience to fight to the finish.",en,US
Stuck in Love,2013,"Drama, Comedy",7.384,97,Josh Boone,Josh Boone,"Greg Kinnear, Jennifer Connelly, Lily Collins","An acclaimed writer, his ex-wife, and their teenaged children come to terms with the complexities of love in all its forms over the course of one tumultuous year.",en,US
Frances Ha,2013,"Comedy, Drama",7.369,86,Noah Baumbach,Noah Baumbach,"Greta Gerwig, Mickey Sumner, Michael Zegen","An aspiring dancer moves to New York City and becomes caught up in a whirlwind of flighty fair-weather friends, diminishing fortunes and career setbacks.",en,US
The Great Gatsby,2013,"Drama, Romance",7.364,143,Baz Luhrmann,,"Leonardo DiCaprio, Tobey Maguire, Carey Mulligan","An adaptation of F. Scott Fitzgerald's Long Island-set novel, where Midwesterner Nick Carraway is lured into the lavish world of his neighbor, Jay Gatsby. Soon enough, however, Carraway will see through the cracks of Gatsby's nouveau riche existence, where obsession, madness, and tragedy await.",en,"US, AU"
Philomena,2013,Drama,7.353,98,Stephen Frears,,"Judi Dench, Steve Coogan, Sophie Kennedy Clark","A woman searches for her adult son, who was taken away from her decades ago when she was forced to live in a convent.",en,GB
Saving Mr. Banks,2013,"Comedy, Drama, History",7.347,125,John Lee Hancock,Kelly Marcel,"Emma Thompson, Tom Hanks, Colin Farrell","Author P.L. Travers looks back on her childhood while reluctantly meeting with Walt Disney, who seeks to adapt her Mary Poppins books for the big screen.",en,US
Now You See Me,2013,"Thriller, Crime",7.337,116,Louis Leterrier,,"Mark Ruffalo, Jesse Eisenberg, Woody Harrelson",An FBI agent and an Interpol detective track a team of illusionists who pull off bank heists during their performances and reward their audiences with the money.,en,US
The Butler,2013,Drama,7.33,132,Lee Daniels,Danny Strong,"Forest Whitaker, Oprah Winfrey, David Oyelowo","A look at the life of Cecil Gaines, who served eight presidents as the White House's head butler from 1952 to 1986, and had a unique front-row seat as political and racial history was made.",en,US
The Physician,2013,"Adventure, Drama, History",7.3,155,Philipp Stölzl,,"Tom Payne, Ben Kingsley, Stellan Skarsgård","England, 1021. Rob Cole, a boy born in a miserable mining town, swears to become a physician and vanquish disease and death. His harsh path of many years, a quest for knowledge besieged by countless challenges and sacrifices, leads him to the remote Isfahan, in Persia, where he meets Ibn Sina, the greatest healer of his time.",en,DE
Star Trek Into Darkness,2013,"Action, Adventure, Science Fiction",7.3,132,J.J. Abrams,Alex Kurtzman,"Chris Pine, Zachary Quinto, Zoe Saldaña","When the crew of the Enterprise is called back home, they find an unstoppable force of terror from within their own organization has detonated the fleet and everything it stands for, leaving our world in a state of crisis.  With a personal score to settle, Captain Kirk leads a manhunt to a war-zone world to capture a one man weapon of mass destruction. As our heroes are propelled into an epic chess game of life and death, love will be challenged, friendships will be torn apart, and sacrifices must be made for the only family Kirk has left: his crew.",en,US
Safe Haven,2013,"Romance, Thriller",7.253,115,Lasse Hallström,,"Julianne Hough, Josh Duhamel, Cobie Smulders","A young woman with a mysterious past lands in Southport, North Carolina where her bond with a widower forces her to confront the dark secret that haunts her.",en,US
The Secret Life of Walter Mitty,2013,"Adventure, Comedy, Drama, Fantasy",7.2,114,Ben Stiller,,"Ben Stiller, Kristen Wiig, Sean Penn",A timid magazine photo manager who lives life vicariously through daydreams embarks on a true-life adventure when a negative goes missing.,en,US
42,2013,Drama,7.2,128,Brian Helgeland,,"Chadwick Boseman, Harrison Ford, Nicole Beharie","In 1946, Branch Rickey (Harrison Ford), owner of the Brooklyn Dodgers, took a stand against Major League Baseball's infamous colour line when he signed Jackie Robinson (Chadwick Boseman) to the team. The deal put both men in the crosshairs of the public, the press and even other players. Facing unabashed racism from every side, Robinson was forced to demonstrate tremendous courage and let his talent on the field wins over fans and his teammates – silencing his critics and forever changing the world by changing the game of baseball.",en,US
Life of a King,2013,Drama,7.2,101,Jake Goldberger,Jake Goldberger,"Cuba Gooding Jr., Malcolm M. Mays, Kevin Hendricks","The true story of one man's mission to give inner city kids of Washington DC something he never had - a future. After being incarcerated for eighteen years, Eugene Brown established the Big Chair Chess Club to get kids off the streets and working towards lives they never believed they were capable of. This is his inspirational story.",en,US
Only Lovers Left Alive,2013,"Drama, Romance",7.2,123,Jim Jarmusch,Jim Jarmusch,"Tilda Swinton, Tom Hiddleston, Anton Yelchin","A depressed musician reunites with his lover in the desolate streets of Detroit. Though their romance has endured several centuries, it is tested by the arrival of her capricious and unpredictable younger sister.",en,GB
Frozen,2013,"Animation, Family, Adventure, Fantasy",7.2,102,Chris Buck,,"Kristen Bell, Idina Menzel, Jonathan Groff","Young princess Anna of Arendelle dreams about finding true love at her sister Elsa’s coronation. Fate takes her on a dangerous journey in an attempt to end the eternal winter that has fallen over the kingdom. She's accompanied by ice delivery man Kristoff, his reindeer Sven, and snowman Olaf. On an adventure where she will find out what friendship, courage, family, and true love really means.",en,US
Gravity,2013,"Science Fiction, Thriller, Drama",7.164,91,Alfonso Cuarón,Alfonso Cuarón,"Sandra Bullock, George Clooney, Ed Harris","Dr. Ryan Stone, a brilliant medical engineer on her first Shuttle mission, with veteran astronaut Matt Kowalsky in command of his last flight before retiring. But on a seemingly routine spacewalk, disaster strikes. The Shuttle is destroyed, leaving Stone and Kowalsky completely alone-tethered to nothing but each other and spiraling out into the blackness of space. The deafening silence tells them they have lost any link to Earth and any chance for rescue. As fear turns to panic, every gulp of air eats away at what little oxygen is left. But the only way home may be to go further out into the terrifying expanse of space.",en,"US, GB"
Belle,2013,Drama,7.1,105,Amma Asante,,"Gugu Mbatha-Raw, Tom Wilkinson, Sam Reid","Dido Elizabeth Bell, the illegitimate, mixed-race daughter of a Royal Navy admiral, plays an important role in the campaign to abolish slavery in England.",en,GB
Mud,2013,Drama,7.054,130,Jeff Nichols,Jeff Nichols,"Matthew McConaughey, Reese Witherspoon, Tye Sheridan",Two teenage boys find a fugitive hiding out on an island in the Mississippi River and help him reunite with his lover and escape an avenging family and their armed posse.,en,US
Monsters University,2013,"Animation, Family",7.039,104,Dan Scanlon,,"Billy Crystal, John Goodman, Steve Buscemi",A look at the relationship between Mike and Sulley during their days at Monsters University — when they weren't necessarily the best of friends.,en,US
Labor Day,2013,"Drama, Romance, Thriller",7.0,111,Jason Reitman,,"Kate Winslet, Josh Brolin, Gattlin Griffith",Two two strangers are drawn together under incredible circumstances. What starts as an unforeseen encounter over a long holiday weekend soon becomes a second chance love story.,en,US
Disconnect,2013,"Drama, Thriller",7.0,116,Henry Alex Rubin,,"Jason Bateman, Hope Davis, Frank Grillo","A hard-working lawyer, attached to his cell phone, can't find the time to communicate with his family. An estranged couple uses the internet as a means to escape from their lifeless marriage. A widowed ex-cop struggles to raise a mischievous son who cyber-bullies a classmate. An ambitious journalist sees a career-making story in a teen that performs on an adult-only site. They are strangers, neighbors and colleagues and their stories collide as ordinary people struggling to connect in today's wired world.",en,US
The Place Beyond the Pines,2013,"Drama, Crime",7.0,140,Derek Cianfrance,,"Ryan Gosling, Eva Mendes, Bradley Cooper","A motorcycle stunt rider considers committing a crime in order to provide for his wife and child, an act that puts him on a collision course with a cop-turned-politician.",en,US
The Book of Daniel,2013,"Fantasy, Drama",7.0,88,Anna Zielinski,Chuck Konzelman,"Robert Miano, Andrew Bongiorno, Lance Henriksen","Taken into slavery after the fall of Jerusalem in 605 B.C., Daniel is forced to serve the most powerful king in the world, King Nebuchadnezzar. Faced with imminent death, Daniel proves himself a trusted Advisor and is placed among the king's wise men. Threatened by death at every turn Daniel never ceases to serve the king until he is forced to choose between serving the king or honoring God. With his life at stake, Daniel has nothing but his faith to stand between him and the lions' den.",en,US
Blue Jasmine,2013,Drama,6.988,99,Woody Allen,,"Cate Blanchett, Sally Hawkins, Alec Baldwin","After experiencing a traumatic misfortune, Jasmine French, a wealthy woman from New York, moves to San Francisco to live with her foster sister Ginger and the firm purpose of getting a new life, but she will be haunted by anxiety and memories of the past.",en,US
Homefront,2013,"Action, Thriller",6.94,100,Gary Fleder,,"Jason Statham, James Franco, Izabela Vidovic","Phil Broker is a former DEA agent who has gone through a crisis after his action against a biker gang went horribly wrong and it cost the life of his boss' son. He is recently widowed and is left with a 9-years-old daughter, Maddy. He decides to quit the turbulent and demanding life of thrill for Maddy's sake and retires to a small town. His daughter fights off a boy who was bullying her at school and this sets in motion a round of events that end in his direct confrontation with the local Meth drug lord. His past history with the biker gang also enters the arena, making matters more complex. But he has a mission in his mind to protect his daughter and he is ready to pay any cost that it demands.",en,US
Iron Man 3,2013,"Action, Adventure, Science Fiction",6.928,130,Shane Black,,"Robert Downey Jr., Gwyneth Paltrow, Don Cheadle","When Tony Stark's world is torn apart by a formidable terrorist called the Mandarin, he starts an odyssey of rebuilding and retribution.",en,US
The Croods,2013,"Animation, Adventure, Family, Fantasy, Comedy, Action",6.92,98,Kirk DeMicco,,"Nicolas Cage, Emma Stone, Ryan Reynolds","The prehistoric Croods family live in a particularly dangerous moment in time. Patriarch Grug, his mate Ugga, teenage daughter Eep, son Thunk, and feisty Gran gather food by day and huddle together in a cave at night. When a more evolved caveman named Guy arrives on the scene, Grug is distrustful, but it soon becomes apparent that Guy is correct about the impending destruction of their world.",en,US
Pacific Rim,2013,"Action, Science Fiction, Adventure",6.909,131,Guillermo del Toro,,"Charlie Hunnam, Rinko Kikuchi, Idris Elba","Using massive piloted robots to combat the alien threat, earth's survivors take the fight to the invading alien force lurking in the depths of the Pacific Ocean. Nearly defenseless in the face of the relentless enemy, the forces of mankind have no choice but to turn to two unlikely heroes who now stand as earth's final hope against the mounting apocalypse.",en,US
Despicable Me 2,2013,"Animation, Comedy, Family",6.9,98,Pierre Coffin,Ken Daurio,"Steve Carell, Kristen Wiig, Benjamin Bratt",Gru is recruited by the Anti-Villain League to help deal with a powerful new super criminal.,en,US
Teen Beach Movie,2013,"Family, Music, TV Movie, Comedy",6.9,95,Jeffrey Hornaday,Vince Marcello,"Ross Lynch, Maia Mitchell, Gracie Gillam","Life's a beach for surfers Brady and McKenzie – until a rogue wave magically transports them inside the classic '60s beach party flick, ""Wet Side Story,"" where a full-blown rivalry between bikers and surfers threatens to erupt. There, amidst a sea of surfing, singing and dancing, Brady and Mack accidentally change the storyline, and the film’s dreamy hero and heroine fall for them instead of for each other!",en,US
Barbie in the Pink Shoes,2013,"Animation, Family",6.9,75,Owen Hurley,Alison Taylor,"Kelly Sheridan, Katie Crown, Ali Liebert","Dance your way to a magical adventure with Barbie as Kristyn, a ballerina with big dreams! When she tries on a pair of sparkling pink shoes, she and her best friend, Hailey, are whisked away to a fantastical ballet world. There, Kristyn discovers she must dance in her favorite ballets in order to defeat an evil Snow Queen. With performances to the legendary Giselle and Swan Lake ballets, it's a wonderful journey where if you dance with your heart, dreams come true!",en,US
Odd Thomas,2013,"Mystery, Thriller",6.9,100,Stephen Sommers,,"Anton Yelchin, Addison Timlin, Willem Dafoe","In a California desert town, a short-order cook with clairvoyant abilities encounters a mysterious man with a link to dark, threatening forces.",en,US
Barbie Mariposa & the Fairy Princess,2013,"Animation, Family, Fantasy",6.9,75,William Lau,Elise Allen,"Kelly Sheridan, Maryke Hendrikse, Tabitha St. Germain","Mariposa becomes the Royal Ambassador of Flutterfield, and is sent to bring peace between her fairy land and their rivals, the Crystal Fairies of Shimmervale. While Mariposa doesn't make a great first impression on  the King, she becomes fast friends with his shy daughter, Princess Catania. However, a misunderstanding causes Mariposa to be banished from their fairy land. As Mariposa and Zee returns to Flutterfield, they encounter a dark fairy on her way to destroy Shimmervale. Mariposa rushes back and helps Princess Catania to save their fairy land and together, the two girls prove that the best way to make a friend, is to be a friend.",en,"GB, US"
August: Osage County,2013,"Comedy, Drama",6.853,121,John Wells,,"Julia Roberts, Meryl Streep, Julianne Nicholson","An intense look at the lives of the strong-willed daughters of the Weston family, whose paths have diverged until a family crisis brings them back to the Midwest house they grew up in, and to the dysfunctional mother who raised them.",en,US
The Young and Prodigious T.S. Spivet,2013,"Adventure, Drama, Family",6.841,105,Jean-Pierre Jeunet,Jean-Pierre Jeunet,"Kyle Catlett, Helena Bonham Carter, Judy Davis",A 10-year-old child prodigy cartographer secretly leaves his family's ranch in Montana where he lives with his cowboy father and scientist mother and travels across the country on board a freight train to receive an award at the Smithsonian Institute.,en,"CA, US"
We're the Millers,2013,"Comedy, Crime",6.829,110,Rawson Marshall Thurber,,"Jennifer Aniston, Jason Sudeikis, Emma Roberts",A veteran pot dealer creates a fake family as part of his plan to move a huge shipment of weed into the U.S. from Mexico.,en,US
World War Z,2013,"Action, Horror, Science Fiction, Thriller",6.819,116,Marc Forster,,"Brad Pitt, Mireille Enos, Daniella Kertesz","Life for former United Nations investigator Gerry Lane and his family seems content. Suddenly, the world is plagued by a mysterious infection turning whole human populations into rampaging mindless zombies. After barely escaping the chaos, Lane is persuaded to go on a mission to investigate this disease. What follows is a perilous trek around the world where Lane must brave horrific dangers and long odds to find answers before human civilization falls.",en,US
The World's End,2013,"Comedy, Action, Science Fiction",6.8,109,Edgar Wright,Simon Pegg,"Simon Pegg, Nick Frost, Paddy Considine",Five friends who reunite in an attempt to top their epic pub crawl from 20 years earlier unwittingly become humankind's only hope for survival.,en,GB
Battle of the Year,2013,"Music, Drama",6.8,110,Benson Lee,,"Josh Holloway, Josh Peck, Chris Brown","A down-on-his-luck coach is hired to prepare a team of the best American dancers for an international tournament that attracts all the best crews from around the world, but the Americans haven't won in fifteen years.",en,US
