Title,Year,Genres,Rating,Popularity,Runtime,Director,Writer,Actors,Keywords,Plot,Ratings Amount,Language,Country
Monte Carlo,2011,"Adventure, Comedy, Romance",6.6,7.466,109,Thomas Bezucha,,"Selena Gomez, Katie Cassidy, Leighton Meester","monte carlo, mistaken identity, look-alike, young woman, texan, american abroad",Three young women vacationing in Paris find themselves whisked away to Monte Carlo after one of the girls is mistaken for a British heiress.,2146,en,US
The Art of Getting By,2011,"Drama, Romance",6.6,7.106,83,Gavin Wiesen,Gavin Wiesen,"Freddie Highmore, Emma Roberts, Michael Angarano","friendship, philosophy, mentor, painting, artist, teen movie, sketching, rebellious youth","George, a lonely and fatalistic teen who's made it all the way to his senior year without ever having done a real day of work, is befriended by Sally, a popular but complicated girl who recognizes in him a kindred spirit.",1299,en,US
Footloose,2011,"Drama, Music, Romance",6.594,9.183,113,Craig Brewer,,"Dennis Quaid, Kenny Wormald, Julianne Hough","dancing, dance, dancer, remake, prom, dance music, dance teacher","Ren MacCormack is transplanted from Boston to the small southern town of Bomont where loud music and dancing are prohibited. Not one to bow to the status quo, Ren challenges the ban, revitalizing the town and falling in love with the minister’s troubled daughter Ariel in the process.",1651,en,US
Pirates of the Caribbean: On Stranger Tides,2011,"Adventure, Action, Fantasy",6.556,37.633,137,Rob Marshall,,"Johnny Depp, Penélope Cruz, Geoffrey Rush","sea, ship, mutiny, captain, spain, england, sword, prime minister, sailing, mermaid, duke, silver, pirate, soldier, battle, swashbuckler, 18th century, aftercreditsstinger, blackbeard, 1750s","Captain Jack Sparrow crosses paths with a woman from his past, and he's not sure if it's love — or if she's a ruthless con artist who's using him to find the fabled Fountain of Youth. When she forces him aboard the Queen Anne's Revenge, the ship of the formidable pirate Blackbeard, Jack finds himself on an unexpected adventure in which he doesn't know who to fear more: Blackbeard or the woman from his past.",14156,en,US
Meek's Cutoff,2011,"Western, Drama",6.533,7.129,104,Kelly Reichardt,Jonathan Raymond,"Michelle Williams, Bruce Greenwood, Will Patton","gold, tree, thirst, settler, native american, family relationships, oregon, usa, salt lake city, utah, pioneer, woman director",A group of settlers traveling through the Oregon High Desert in 1845 find themselves stranded in harsh conditions.,275,en,US
Bridesmaids,2011,"Comedy, Romance",6.523,11.309,125,Paul Feig,,"Kristen Wiig, Maya Rudolph, Rose Byrne","jealousy, parent child relationship, fight, competition, materialism, bridesmaid, female friendship, sexual humor, wealth, fear of commitment, wedding party, best friend, maid of honor, drunk, wedding dress, group of friends, missing person, casual sex, vanity, girl fight, duringcreditsstinger, out of control","Annie's life is a mess. But when she finds out her lifetime best friend is engaged, she simply must serve as Lillian's maid of honor. Though lovelorn and broke, Annie bluffs her way through the expensive and bizarre rituals. With one chance to get it perfect, she’ll show Lillian and her bridesmaids just how far you’ll go for someone you love.",4395,en,US
The Mechanic,2011,"Action, Thriller, Crime",6.52,14.41,93,Simon West,,"Jason Statham, Ben Foster, Donald Sutherland","chicago, illinois, research, martial arts, assassin, prostitute, airport, mentor, new orleans, louisiana, training, car crash, elite, remake, security, set up, mentor protégé relationship, contractor, vengeance, avenging son, colombia, suspenseful, foreboding, ominous","Arthur Bishop is a 'mechanic' - an elite assassin with a strict code requiring professional perfection and total detachment. One of an elite group of assassins, Bishop may be the best in the business - with a unique talent for cleanly eliminating targets. When Harry McKenna, his close friend and mentor, is murdered, Harry's son comes to him with vengeance in his heart and a desire to learn Bishop's trade, signaling the birth of a deadly partnership.",3294,en,US
Ice Age: A Mammoth Christmas,2011,"Animation, Family, TV Movie",6.5,7.62,26,Karen Disher,Sam Harper,"Billy Gardell, Ray Romano, John Leguizamo","holiday, prehistory, christmas, short film","When Sid accidentally destroys Manny's heirloom Christmas rock and ends up on Santa's naughty list, he leads a hilarious quest to the North Pole to make things right and ends up making things much worse. Now it's up to Manny and his prehistoric posse to band together and save Christmas for the entire world!",649,en,US
What's Your Number?,2011,"Comedy, Romance",6.5,7.599,106,Mark Mylod,,"Anna Faris, Chris Evans, Ari Graynor","based on novel or book, romcom, basketball, womanizer, magazine, skinny dipping, apartment building, stage performance, dating woes, fired, past relationship, survey, dating history, sister's wedding, finding mr. right, appreciative, comforting","Ally Darling is realizing she's a little lost in life. Her latest romance has just fizzled out, and she's just been fired from her marketing job. Then she reads an eye-opening magazine article that warns that 96 percent of women who've been with 20 or more lovers are unlikely to find a husband. Determined to turn her life around and prove the article wrong, Ally embarks on a mission to find the perfect mate from among her numerous ex-boyfriends.",2341,en,US
The Hangover Part II,2011,Comedy,6.485,27.181,102,Todd Phillips,,"Bradley Cooper, Ed Helms, Zach Galifianakis","stag night, memory loss, undercover cop, drugs, 宿醉2","The Hangover crew heads to Thailand for Stu's wedding. After the disaster of a bachelor party in Las Vegas last year, Stu is playing it safe with a mellow pre-wedding brunch. However, nothing goes as planned and Bangkok is the perfect setting for another adventure with the rowdy group.",10597,en,US
X,2011,"Action, Thriller, Romance",6.466,12.019,90,Jon Hewitt,Belinda McClory,"Viva Bianca, Hanna Mangan Lawrence, Peter Docker","eroticism, prostitution",A veteran call girl and a runaway prostitute witness a murder which sends them on an out-of-control roller coaster ride through the twilight zone of sex-for-sale.,293,en,"AU, US"
Scream 4,2011,"Horror, Mystery",6.458,10.296,111,Wes Craven,,"David Arquette, Neve Campbell, Courteney Cox","rescue, mask, sheriff, jealousy, dark comedy, victim, knife, self-inflicted injury, sequel, sociopath, murder, house party, teen movie, serial killer, author, hospital, slasher, home invasion, self-referential, cousin cousin relationship, phone call, satirical, millennials, publicist, fame-seeking, new generation, return to hometown, masked killer, suspenseful, remakes, teen scream","Ten years have passed, and Sidney Prescott has put herself back together thanks to her writing. However, her return to Woodsboro sparks the return of the Ghostface Killer.",3798,en,US
Attack the Block,2011,"Action, Comedy, Science Fiction",6.457,7.231,88,Joe Cornish,Joe Cornish,"John Boyega, Jodie Whittaker, Nick Frost","london, england, street gang, chase, fireworks, meteor, playground, arrest, car crash, cannabis, alien, moped, social satire, creature, alien invasion, race, car fire, naive children, south london",A teen gang in a South London housing estate must team up with the other residents to protect their neighbourhood from a terrifying alien invasion.,2080,en,GB
Chalet Girl,2011,"Comedy, Romance",6.417,7.487,96,Phil Traill,,"Felicity Jones, Ed Westwick, Brooke Shields","competition, snowboarding, austria, birthday party, chalet, snowboarding competition, snow skiing, alps mountains, ski resort, engagement party","While working a job at an exclusive ski resort to support her Dad, Kim learns to snowboard and is so good at it that she enters a competition with a huge cash prize. She has to dig deep to overcome her fears, but her life gets more complicated through her spoken-for boss, Jonny.",639,en,"AT, GB, DE"
The Beaver,2011,Drama,6.4,7.106,91,Jodie Foster,,"Mel Gibson, Jodie Foster, Jennifer Lawrence","depression, puppet, woman director","Suffering from a severe case of depression, toy company CEO Walter Black begins using a beaver hand puppet to help him open up to his family. With his father seemingly going insane, adolescent son Porter pushes for his parents to get a divorce.",865,en,US
A Dangerous Method,2011,"Drama, Thriller",6.4,7.365,99,David Cronenberg,,"Keira Knightley, Viggo Mortensen, Michael Fassbender","infidelity, based on novel or book, psychoanalysis, sigmund freud, biography, based on true story, cigar smoking, spanking, patient, carl jung","Seduced by the challenge of an impossible case, the driven Dr. Carl Jung takes the unbalanced yet beautiful Sabina Spielrein as his patient. Jung’s weapon is the method of his master, the renowned Sigmund Freud. Both men fall under Sabina’s spell.",2078,en,"CA, DE, CH, GB, US"
Flypaper,2011,"Mystery, Comedy, Crime",6.4,7.273,87,Rob Minkoff,Scott Moore,"Patrick Dempsey, Ashley Judd, Tim Blake Nelson","shootout, dead woman, bank robbery",A man caught in the middle of two simultaneous robberies at a bank desperately tries to protect the teller with whom he's secretly in love.,758,en,US
Kung Fu Panda: Secrets of the Masters,2011,"Animation, Action, Comedy",6.4,7.267,24,Tony Leondis,Paul McEvoy,"Jack Black, Angelina Jolie, Seth Rogen",,"Po and the Furious Five uncover the legend of three of kung fu's greatest heroes: Master Thundering Rhino, Master Storming Ox, and Master Croc.",259,en,US
Never Back Down 2: The Beatdown,2011,"Drama, Action",6.4,10.833,99,Michael Jai White,Chris Hauty,"Michael Jai White, Gralen Bryant Banks, Alex Meraz","sports, kiss, fistfight, cage, cage fighting, kickboxer, martial arts tournament, beefcake, martial arts training",Four fighters from different backgrounds come together to train under an ex MMA rising star and then ultimately have to fight each other and the traitor in their midst.,647,en,US
The Iron Lady,2011,"History, Drama",6.4,7.178,105,Phyllida Lloyd,,"Meryl Streep, Anthony Stewart Head, Harry Lloyd","capitalism, prime minister, based on true story, argentina, british overseas territory, war propaganda, british politics, british prime minister, female politician, falklands war, political leader, female prime minister, right wing, falklands, woman director, 1980s","A look at the life of Margaret Thatcher, the former Prime Minister of the United Kingdom, with a focus on the price she paid for power.",1742,en,GB
The Awakening,2011,"Horror, Thriller, Mystery",6.374,7.829,107,Nick Murphy,,"Rebecca Hall, Dominic West, Imelda Staunton","suicide, england, classroom, investigation, supernatural, haunting, teacher, murder, author, fear, estate, con, discovery, ghost, governess","In post–War England, a writer and sometime-ghost hunter investigates a reported haunting at a boys boarding school.",1402,en,GB
Grave Encounters,2011,"Thriller, Horror",6.304,7.654,93,Stuart Ortiz,Stuart Ortiz,"Sean Rogerson, Ashleigh Gryzko, Merwin Mondesir","haunting, insane asylum, paranormal, psychiatric hospital, ghost hunting, paranormal investigation, labyrinth, mental asylum, found footage, straightforward",A crew from a paranormal reality television show lock themselves in a haunted psychiatric hospital. They search for evidence of paranormal activity as they shoot what ends up becoming their final episode.,1498,en,CA
Honey 2,2011,"Music, Comedy, Drama",6.3,7.13,110,Bille Woodruff,,"Kat Graham, Randy Wayne, Seychelle Gabriel","dance, competition, sequel, bronx, new york city, dance crew","After a brush with the law, Maria has returned to her gritty Bronx roots to rebuild her life with nothing but a talent for street dance and a burning ambition to prove herself.",396,en,US
No Strings Attached,2011,"Comedy, Romance",6.3,11.98,107,Ivan Reitman,,"Natalie Portman, Ashton Kutcher, Kevin Kline","parent child relationship, casual meeting, sexual humor, student of medicine, friends, open relationship, best friend, valentine's day, casual sex, friends in love, duringcreditsstinger, fling, father son conflict","Emma is a busy doctor who sets up a seemingly perfect arrangement when she offers her best friend Adam a relationship with one rule: No strings attached. But when a fling becomes a thing, can sex friends stay best friends?",4727,en,US
Megan Is Missing,2011,"Drama, Horror, Thriller",6.3,11.278,86,Michael Goi,Michael Goi,"Amber Perkins, Rachel Quinn, Dean Waite","rape, predator, based on true story, murder, teenage girl, internet, torture, high school friends, missing person, found footage, abduction","Fourteen-year–old Megan and her best friend Amy spend a lot of time on the internet, posting videos of themselves and chatting with guys online. One night Megan chats with a guy named Josh who convinces her to meet him for a date. The next day, Megan is missing—forever. Based on actual cases of child abduction.",704,en,US
Assassination Games,2011,"Action, Crime, Drama, Thriller",6.3,7.381,101,Ernie Barbarash,Aaron Rahsaan Thomas,"Jean-Claude Van Damme, Scott Adkins, Ivan Kaye","fight, anti hero, karate, drug cartel, sharpshooter, knife throwing, silencer, knife fight, gist fight, kickboxing","Brazil is a contract killer, willing to take any job if the price is right. Flint left the assassin game when a ruthless drug dealer’s brutal attack left his wife in a coma. When a contract is put out on the same coldblooded drug dealer, both Brazil and Flint want him dead – one for the money, the other for revenge. With crooked Interpol agents and vicious members of the criminal underworld hot on their trail, these two assassins reluctantly join forces to quickly take out their target before they themselves are terminated.",400,en,US
Beastly,2011,"Romance, Fantasy, Drama",6.3,7.903,86,Daniel Barnz,,"Alex Pettyfer, Vanessa Hudgens, Mary-Kate Olsen","high school, based on novel or book, bullying, love, beautiful woman, curse, tutor, based on fairy tale, teenage romance, modern fairy tale, based on young adult novel","A modern-day take on the ""Beauty and the Beast"" tale where a New York teen is transformed into a hideous monster in order to find true love.",2775,en,US
Marvel One-Shot: The Consultant,2011,"Adventure, Fantasy, Science Fiction, Action",6.3,7.085,4,Leythum,Eric Pearson,"Maximiliano Hernández, Clark Gregg, Robert Downey Jr.","based on comic, marvel cinematic universe (mcu), short film, agents","Agent Coulson informs Agent Sitwell that the World Security Council wishes Emil Blonsky to be released from prison to join the Avengers Initiative. As Nick Fury doesn't want to release Blonsky, the two agents decide to send a patsy to sabotage the meeting...",556,en,US
Something Borrowed,2011,"Comedy, Drama, Romance",6.3,7.538,112,Luke Greenfield,Jennie Snyder Urman,"Ginnifer Goodwin, Kate Hudson, Colin Egglesfield","new york city, based on novel or book, cheating, pregnancy, birthday party, one-night stand, flashback, crush, lawyer, best friend, wedding, love affair, celebration, childhood friends, awkwardness, lying, duringcreditsstinger, engaged, loyal, liaison, confidant, mismatched couple, secret crush, crazy ex, longtime crush, crush on friend, drunk one-night stand, always the nice one","Though Rachel is a successful attorney and a loyal, generous friend, she is still single. After one drink too many at her 30th-birthday celebration, Rachel unexpectedly falls into bed with her longtime crush, Dex -- who happens to be engaged to her best friend, Darcy. Ramifications of the liaison threaten to destroy the women's lifelong friendship, while Ethan, Rachel's confidant, harbors a potentially explosive secret of his own.",1040,en,US
Tom and Jerry & The Wizard of Oz,2011,"Animation, Comedy, Adventure, Family, Fantasy",6.3,7.414,59,Spike Brandt,Gene Grillo,"Grey DeLisle, Joe Alaskey, Michael Gough",based on young adult novel,"After a deadly storm, Tom and Jerry find themselves stranded on an unknown island ruled by the evil Wizard of Oz. As they try to find their way back home, they worry for their master Dorothy's safety.",124,en,US
Killer Elite,2011,"Action, Adventure, Thriller",6.262,7.993,116,Gary McKendry,,"Jason Statham, Clive Owen, Robert De Niro","rescue, assassin, mexico, based on novel or book, hostage, mentor, secret society, secret agent, beating, revenge, explosion, desert, death, military, 1980s","Based on a shocking true story, Killer Elite pits two of the world’s most elite operatives—Danny, an ex-special ops agent and Hunter, his longtime mentor—against the cunning leader of a secret military society. Covering the globe from Australia to Paris, London and the Middle East, Danny and Hunter are plunged into a highly dangerous game of cat and mouse—where the predators become the prey.",2152,en,"AU, US"
J. Edgar,2011,"Drama, Crime, History",6.232,7.875,137,Clint Eastwood,Dustin Lance Black,"Leonardo DiCaprio, Naomi Watts, Armie Hammer","fbi, biography, historical figure","As the face of law enforcement in the United States for almost 50 years, J. Edgar Hoover was feared and admired, reviled and revered. But behind closed doors, he held secrets that would have destroyed his image, his career, and his life.",2436,en,US
The Eagle,2011,"Adventure, Drama",6.232,8.03,114,Kevin Macdonald,Rosemary Sutcliff,"Channing Tatum, Mark Strong, Jamie Bell","roman empire, scotland, slavery, eagle, ancient rome, honor, disappearance, ancient world, britain, slave, scottish highlands, 2nd century, hadrian’s wall","In 140 AD, twenty years after the unexplained disappearance of the entire Ninth Legion in the mountains of Scotland, young centurion Marcus Aquila arrives from Rome to solve the mystery and restore the reputation of his father, the commander of the Ninth. Accompanied only by his British slave Esca, Marcus sets out across Hadrian's Wall into the uncharted highlands of Caledonia - to confront its savage tribes, make peace with his father's memory, and retrieve the lost legion's golden emblem, the Eagle of the Ninth.",1315,en,US
The Thing,2011,"Horror, Science Fiction, Mystery",6.225,13.558,103,Matthijs van Heijningen Jr.,Eric Heisserer,"Mary Elizabeth Winstead, Joel Edgerton, Ulrich Thomsen","based on novel or book, paranoia, research station, alien life-form, prequel, survival, antarctica, survival horror, blizzard, duringcreditsstinger, suspenseful","When paleontologist Kate Lloyd travels to an isolated outpost in Antarctica for the expedition of a lifetime, she joins an international team that unearths a remarkable discovery. Their elation quickly turns to fear as they realize that their experiment has freed a mysterious being from its frozen prison. Paranoia spreads like an epidemic as a creature that can mimic anything it touches will pit human against human as it tries to survive and flourish in this spine-tingling thriller.",2959,en,US
Kill List,2011,"Horror, Thriller, Crime",6.204,7.566,95,Ben Wheatley,Ben Wheatley,"Neil Maskell, MyAnna Buring, Harry Simpson","hotel, husband wife relationship, post-traumatic stress disorder (ptsd), hitman, cult, infection, forest, priest, murderer, brutality, bonfire, ceremony, ex soldier, ritual sacrifice, contract killer, video tape, folk horror, sheffield, england","Nearly a year after a botched job, a hitman takes a new assignment with the promise of a big payoff for three killings. What starts off as an easy task soon unravels, sending the killer into the heart of darkness.",783,en,GB
I Am Number Four,2011,"Action, Thriller, Science Fiction, Adventure",6.2,14.314,109,D.J. Caruso,,"Alex Pettyfer, Dianna Agron, Teresa Palmer","based on novel or book, secret identity, heroism, alien, teenage boy, super power, teenage hero, interspecies romance, based on young adult novel, teenager, suspenseful, bold","A teenage fugitive with an incredible secret races to stay one step ahead of the mysterious forces seeking destroy him in this sci-fi action thriller. With three dead and one on the run, the race to find the elusive Number Four begins. Outwardly normal teen John Smith never gets too comfortable in the same identity, and along with his guardian, Henri, he is constantly moving from town to town. With each passing day, John gains a stronger grasp on his extraordinary new powers, and his bond to the beings that share his fantastic fate grows stronger.",4700,en,US
Johnny English Reborn,2011,"Crime, Action, Comedy",6.2,12.373,101,Oliver Parker,William Davies,"Rowan Atkinson, Gillian Anderson, Dominic West","mind control, buddhist monk, cooking, prime minister, secret agent, sequel, james bond spoof, incompetence, aftercreditsstinger, assassination attempt","The most prominent heads of state in the world begin gathering for a conference that could have a major impact on global politics. When MI-7 receives word that the Chinese premier has become the target of some high-powered killers, it falls on Johnny English to save the day. Armed with the latest high-tech weaponry and gadgets that would make even James Bond jealous, the once-disgraced agent uncovers evidence of a massive conspiracy involving some of the world's most powerful organisations, and vows to redeem his tarnished reputation by stopping the killers before they can strike.",3331,en,GB
Sucker Punch,2011,"Action, Fantasy, Thriller",6.2,11.241,110,Zack Snyder,,"Emily Browning, Abbie Cornish, Jena Malone","samurai, escape, asylum, brothel, sword fight, dragon, robot, inmate, lobotomy, war zone, abusive stepfather, rape culture, alternate reality","A young woman, institutionalized by her abusive stepfather, retreats into a vivid fantasy world where she envisions a plan to escape. Gathering a group of fellow inmates, she embarks on a quest to collect five mystical items, blurring the lines between reality and imagination.",4758,en,US
Happy Feet Two,2011,"Animation, Comedy, Family",6.2,9.74,100,George Miller,George Miller,"Elijah Wood, Robin Williams, Pink","penguin, musical, aftercreditsstinger, inspirational","Mumble the penguin has a problem: his son Erik, who is reluctant to dance, encounters the Mighty Sven — a penguin who can fly! Things get worse for Mumble when the world is shaken by powerful forces, causing him to bring together the penguin nations and their allies to set things right.",1624,en,AU
The Change-Up,2011,Comedy,6.2,9.691,112,David Dobkin,Jon Lucas,"Jason Bateman, Ryan Reynolds, Leslie Mann","jealousy, bachelor, fountain, sarcasm, wish, slacker, lawyer, co-workers relationship, twins, body-swap, envy, opposites, duringcreditsstinger, aspiring actor, family man, painful truth, body switch, weed, job switch, best friends, lifelong friendship, living the dream","Lifelong friends Dave and Mitch are envious of the other's life. Mitch thinks Dave has it all: a beautiful, loving family and a high-paying job at a prestigious law firm. But Dave thinks Mitch’s stress-free playboy life without obligation or consequence is the real dream come true. One fateful drunken night, they both admit that they wish they had the other’s life while peeing in a fountain when lightning strikes. The next morning, they wake up, hungover, in each other’s bodies! With time not on their side, Mitch and Dave comically struggle to avoid completely destroying each other’s lives before they can find a way to get their old ones back.",2779,en,US
Fright Night,2011,"Horror, Comedy",6.2,7.35,106,Craig Gillespie,,"Anton Yelchin, Colin Farrell, Toni Collette","sunrise, vampire, suspicion, suburbia, remake","A teenager suspects his new neighbour is a vampire. Unable to convince anyone, he tries to enlist the help of a self-proclaimed vampire hunter and magician.",1947,en,US
The Good Doctor,2011,"Drama, Thriller, Mystery",6.2,7.42,93,Lance Daly,John Enbom,"Orlando Bloom, Riley Keough, Taraji P. Henson",,"Dr. Martin Blake, who has spent his life looking for respect, meets an 18-year-old patient named Diane, suffering from a kidney infection, and gets a much-needed boost of self-esteem. However, when her health starts improving, Martin fears losing her, so he begins tampering with her treatment, keeping Diane sick and in the hospital right next to him.",247,en,US
The Twilight Saga: Breaking Dawn - Part 1,2011,"Adventure, Fantasy, Romance",6.2,29.526,117,Bill Condon,,"Kristen Stewart, Robert Pattinson, Taylor Lautner","based on novel or book, vampire, hybrid, teen movie, werewolf, supernatural creature, dead, duringcreditsstinger, based on young adult novel",The new found married bliss of Bella Swan and vampire Edward Cullen is cut short when a series of betrayals and misfortunes threatens to destroy their world.,8834,en,US
A Lonely Place to Die,2011,"Adventure, Action, Thriller, Crime",6.2,7.483,99,Julian Gilbey,Julian Gilbey,"Melissa George, Ed Speleers, Eamonn Walker","scotland, kidnapping, hiking, wilderness, mountaineer, climbing",A group of five mountaineers are hiking and climbing in the Scottish Highlands when they discover a young Serbian girl buried in a small chamber in the wilderness. They become caught up in a terrifying game of cat and mouse with the kidnappers as they try to get the girl to safety.,584,en,GB
Dream House,2011,"Mystery, Drama, Thriller",6.182,7.277,84,Jim Sheridan,,"Daniel Craig, Naomi Watts, Rachel Weisz","family relationships, psychiatric hospital, neighbor, snow, author, house fire, extension ladder, last day on job, murder case, secret room","Publisher Will Atenton quits a lucrative job in New York to relocate his wife, Libby, and their daughters to a quaint town in New England. However, as they settle into their home the Atentons discover that a woman and her children were murdered there, and the surviving husband is the town's prime suspect. With help from a neighbor who was close to the murdered family, Will pieces together a horrifying chain of events.",1358,en,"CA, US"
