Title,Year,Genres,Rating,Runtime,Director,Writer,Actors,Plot,Language,Country
The Call,2013,"Crime, Thriller",6.8,94,Brad Anderson,,"Halle Berry, Abigail Breslin, Morris Chestnut","Jordan Turner is an experienced 911 operator but when she makes an error in judgment and a call ends badly, Jordan is rattled and unsure if she can continue. But when teenager Casey Welson is abducted in the back of a man's car and calls 911, Jordan is the one called upon to use all of her experience, insights and quick thinking to help Casey escape, and not just to save her, but to make sure the man is brought to justice.",en,US
What If,2013,"Drama, Comedy, Romance",6.736,98,Michael Dowse,,"Daniel Radcliffe, Zoe Kazan, Megan Park","Medical-school dropout Wallace has been repeatedly burned by bad relationships. So while everyone around him, including his roommate Allan, seems to be finding the perfect partner, Wallace decides to put his love life on hold. It is then that he meets Chantry, an animator who lives with her longtime boyfriend Ben. Wallace and Chantry form an instant connection, striking up a close friendship. Still, there is no denying the chemistry between them, leading the pair to wonder, what if the love of your life is actually your best friend?",en,"CA, US"
The Spectacular Now,2013,"Comedy, Drama, Romance",6.7,95,James Ponsoldt,,"Miles Teller, Shailene Woodley, Masam Holden","Sutter, a popular party animal, unexpectedly meets the introverted Aimee after waking up on a stranger's lawn. As Sutter deals with the problems in his life and Aimee plans for her future beyond school, an unexpected romance blossoms between them.",en,US
Romeo & Juliet,2013,"Romance, Drama",6.7,118,Carlo Carlei,,"Douglas Booth, Hailee Steinfeld, Damian Lewis","In Verona, bad blood between the Montague and Capulet families leads to much bitterness. Despite the hostility, Romeo Montague manages an invitation to a masked ball at the estate of the Capulets and meets Juliet, their daughter. The two are instantly smitten but dismayed to learn that their families are enemies. Romeo and Juliet figure out a way to pursue their romance, but Romeo is banished for his part in the slaying of Juliet's cousin, Tybalt.",en,"US, IT, GB"
Nymphomaniac: Vol. II,2013,"Drama, Mystery",6.7,124,Lars von Trier,Lars von Trier,"Charlotte Gainsbourg, Stellan Skarsgård, Stacy Martin",The continuation of Joe's sexually dictated life delves into the darker aspects of her adult life and what led to her being in Seligman's care.,en,DK
Oblivion,2013,"Action, Science Fiction, Adventure, Mystery",6.7,124,Joseph Kosinski,,"Tom Cruise, Morgan Freeman, Olga Kurylenko","Jack Harper is one of the last few drone repairmen stationed on Earth. Part of a massive operation to extract vital resources after decades of war with a terrifying threat known as the Scavs, Jack’s mission is nearly complete. His existence is brought crashing down when he rescues a beautiful  stranger from a downed spacecraft. Her arrival triggers a chain of events that  forces him to question everything he knows and puts the fate of humanity in his hands.",en,US
Escape Plan,2013,"Action, Thriller",6.7,115,Mikael Håfström,,"Sylvester Stallone, Arnold Schwarzenegger, Jim Caviezel","Ray Breslin is the world's foremost authority on structural security. After analyzing every high security prison and learning a vast array of survival skills so he can design escape-proof prisons, his skills are put to the test. He's framed and incarcerated in a master prison he designed himself. He needs to escape and find the person who put him behind bars.",en,US
Zulu,2013,"Crime, Drama, Thriller",6.7,110,Jérôme Salle,,"Orlando Bloom, Forest Whitaker, Conrad Kemp","As a child, Ali Neuman narrowly escaped being murdered by Inkhata, a militant political party at war with Nelson Mandela's African National Congress. Only he and his mother survived the carnage of those years. But as with many survivors, the psychological scars remain.",en,"FR, ZA"
Ninja: Shadow of a Tear,2013,"Action, Crime, Thriller",6.669,95,Isaac Florentine,David N. White,"Scott Adkins, Kane Kosugi, Shun Sugata","Fight everyone and trust no one: it's the code of survival practiced by martial-arts master Casey Bowman after his life of domestic bliss is shattered by a savage act of violence. Vowing revenge, the fearless American stealthily tracks the killer from Osaka to Bangkok to Rangoon with the help of a wise and crafty sensei. His only clues: a series of victims whose necks bear the distinctive mark of strangulation by barbed wire. Fighting to avenge as well as to survive, Casey must sharpen his razor-like responses and take his battle skills to the next level, even using deep meditation to fake his own death. His target: the sinister drug lord Goro, who is flooding the streets with deadly meth cooked at his remote jungle factory. To prepare for his ultimate confrontation, Casey must finally become an invisible warrior worthy of the name Ninja. But just when his prey is cornered, an unexpected twist shows Casey that his battle is only beginning: he truly can trust no one.",en,US
Insidious: Chapter 2,2013,"Horror, Thriller",6.667,106,James Wan,,"Patrick Wilson, Rose Byrne, Lin Shaye",The haunted Lambert family seeks to uncover the mysterious childhood secret that has left them dangerously connected to the spirit world.,en,US
Man of Steel,2013,"Action, Adventure, Science Fiction",6.63,143,Zack Snyder,,"Henry Cavill, Amy Adams, Russell Crowe","A young boy learns that he has extraordinary powers and is not of this earth. As a young man, he journeys to discover where he came from and what he was sent here to do. But the hero in him must emerge if he is to save the world from annihilation and become the symbol of hope for all mankind.",en,US
Behind the Candelabra,2013,"Drama, Romance",6.625,118,Steven Soderbergh,,"Michael Douglas, Matt Damon, Dan Aykroyd","Based on the autobiographical novel, the tempestuous 6-year relationship between Liberace and his (much younger) lover, Scott Thorson, is recounted.",en,US
Hours,2013,"Drama, Thriller",6.621,97,Eric Heisserer,Eric Heisserer,"Paul Walker, Natalia Safran, Christopher Matthew Cook",A father struggles to keep his infant daughter alive in the wake of Hurricane Katrina.,en,US
Trance,2013,"Thriller, Crime, Drama, Mystery",6.621,101,Danny Boyle,John Hodge,"James McAvoy, Vincent Cassel, Rosario Dawson",A violent gang enlists the help of a hypnotherapist in an attempt to locate a painting which somehow vanished in the middle of a heist.,en,"GB, US"
Evil Dead,2013,Horror,6.6,91,Fede Álvarez,,"Jane Levy, Shiloh Fernandez, Lou Taylor Pucci","Mia, a drug addict, is determined to kick the habit. To that end, she asks her brother, David, his girlfriend, Natalie and their friends Olivia and Eric to accompany her to their family's remote forest cabin to help her through withdrawal. Eric finds a mysterious Book of the Dead at the cabin and reads aloud from it, awakening an ancient demon. All hell breaks loose when the malevolent entity possesses Mia.",en,US
You're Next,2013,"Horror, Thriller, Mystery",6.6,94,Adam Wingard,Simon Barrett,"Sharni Vinson, Nicholas Tucci, Wendy Glenn","When the Davison family comes under attack during their wedding anniversary getaway, the gang of mysterious killers soon learns that one of their victims harbors a secret talent for fighting back.",en,US
Stoker,2013,"Drama, Horror, Thriller",6.6,99,Park Chan-wook,Wentworth Miller,"Mia Wasikowska, Nicole Kidman, Matthew Goode","After India Stoker's father dies, her Uncle Charlie, who she never knew existed, comes to live with her and her unstable mother. She comes to suspect this mysterious, charming man has ulterior motives and becomes increasingly infatuated with him.",en,US
Superman: Unbound,2013,"Animation, Action, Adventure",6.6,75,James Tucker,Bob Goodman,"Matt Bomer, John Noble, Stana Katic","Superman and Supergirl take on the cybernetic being known as Brainiac, who boasts that he possesses ""the knowledge and strength of 10,000 worlds.""",en,US
Side Effects,2013,"Thriller, Crime, Drama",6.6,106,Steven Soderbergh,,"Rooney Mara, Jude Law, Catherine Zeta-Jones",A woman turns to prescription medication as a way of handling her anxiety concerning her husband's upcoming release from prison.,en,US
The Heat,2013,"Action, Comedy, Crime",6.598,117,Paul Feig,Katie Dippold,"Sandra Bullock, Melissa McCarthy, Demián Bichir","Uptight and straight-laced, FBI Special Agent Sarah Ashburn is a methodical investigator with a reputation for excellence--and hyper-arrogance. Shannon Mullins, one of Boston P.D.'s ""finest,"" is foul-mouthed and has a very short fuse, and uses her gut instinct and street smarts to catch the most elusive criminals. Neither has ever had a partner, or a friend for that matter. When these two wildly incompatible law officers join forces to bring down a ruthless drug lord, they become the last thing anyone expected: buddies.",en,US
Ender's Game,2013,"Science Fiction, Action, Adventure",6.587,114,Gavin Hood,,"Asa Butterfield, Hailee Steinfeld, Harrison Ford","Based on the classic novel by Orson Scott Card, Ender's Game is the story of the Earth's most gifted children training to defend their homeplanet in the space wars of the future.",en,US
Out of the Furnace,2013,"Thriller, Drama, Crime",6.565,116,Scott Cooper,,"Christian Bale, Zoe Saldaña, Woody Harrelson","Two brothers live in the economically-depressed Rust Belt, when a cruel twist of fate lands one in prison. His brother is then lured into one of the most violent crime rings in the Northeast.",en,US
2 Guns,2013,"Action, Comedy, Crime",6.54,109,Baltasar Kormákur,,"Denzel Washington, Mark Wahlberg, Paula Patton",A DEA agent and an undercover Naval Intelligence officer who have been tasked with investigating one another find they have been set up by the mob -- the very organization the two men believe they have been stealing money from.,en,US
RED 2,2013,"Action, Comedy, Crime, Thriller",6.524,116,Dean Parisot,Jon Hoeber,"Bruce Willis, John Malkovich, Mary-Louise Parker",Retired C.I.A. agent Frank Moses reunites his unlikely team of elite operatives for a global quest to track down a missing portable nuclear device.,en,US
Thor: The Dark World,2013,"Action, Adventure, Fantasy",6.518,112,Alan Taylor,,"Chris Hemsworth, Natalie Portman, Tom Hiddleston","Thor fights to restore order across the cosmos… but an ancient race led by the vengeful Malekith returns to plunge the universe back into darkness. Faced with an enemy that even Odin and Asgard cannot withstand, Thor must embark on his most perilous and personal journey yet, one that will reunite him with Jane Foster and force him to sacrifice everything to save us all.",en,US
Oculus,2013,Horror,6.5,104,Mike Flanagan,,"Karen Gillan, Brenton Thwaites, Katee Sackhoff",A woman tries to exonerate her brother's murder conviction by proving that the crime was committed by a supernatural phenomenon.,en,US
Epic,2013,"Animation, Adventure, Family, Fantasy",6.5,102,Chris Wedge,,"Colin Farrell, Amanda Seyfried, Christoph Waltz",A teenager finds herself transported to a deep forest setting where a battle between the forces of good and the forces of evil is taking place. She bands together with a rag-tag group characters in order to save their world—and ours.,en,US
Madly Madagascar,2013,"Animation, Comedy, Family",6.5,22,David Soren,David Soren,"Ben Stiller, Chris Rock, David Schwimmer","Your favorite Madagascar pals are back in an all-new adventure! Alex's favorite holiday, Valentine's Day, brings hilarious surprises and excitement for the entire gang. Melman plans a big surprise for Gloria, Marty tries to impress a new friend and everyone wants to get their hands on King Julien's love potion. You'll fall in LOVE with Madly Madagascar!",en,US
Elysium,2013,"Science Fiction, Action, Drama, Thriller",6.5,109,Neill Blomkamp,Neill Blomkamp,"Matt Damon, Jodie Foster, Sharlto Copley","In the year 2159, two classes of people exist: the very wealthy who live on a pristine man-made space station called Elysium, and the rest, who live on an overpopulated, ruined Earth. Secretary Rhodes, a hard line government ofﬁcial, will stop at nothing to enforce anti-immigration laws and preserve the luxurious lifestyle of the citizens of Elysium. That doesn’t stop the people of Earth from trying to get in, by any means they can. When unlucky Max is backed into a corner, he agrees to take on a daunting mission that, if successful, will not only save his life, but could bring equality to these polarized worlds.",en,US
Anna,2013,"Thriller, Drama",6.5,99,Jorge Dorado,,"Mark Strong, Taissa Farmiga, Brian Cox","A man with the ability to enter peoples' memories takes on the case of a brilliant, troubled sixteen-year-old girl to determine whether she is a sociopath or a victim of trauma.",en,"FR, ES, US, GB"
Night Train to Lisbon,2013,"Mystery, Romance, Thriller",6.5,111,Bille August,,"Jeremy Irons, Mélanie Laurent, Jack Huston","Raimund Gregorius, having saved a beautiful Portuguese woman from leaping to her death, stumbles upon a mesmerizing book by a Portuguese author, which compels him to suddenly abandon the boring life he has led for years and to embark on an enthralling adventure.  In search of the author, Gregorius acts as detective, pulling together pieces of a puzzle that involves political and emotional intrigue and the highest possible stakes. His voyage is one that transcends time and space, delving into the realms of history, medicine and love, all in search of true meaning to his life.",en,"DE, PT, CH"
White House Down,2013,"Action, Drama, Thriller",6.468,131,Roland Emmerich,James Vanderbilt,"Channing Tatum, Jamie Foxx, Joey King","Capitol Policeman John Cale has just been denied his dream job with the Secret Service protecting President James Sawyer. Not wanting to let down his little girl with the news, he takes her on a tour of the White House, when the complex is overtaken by a heavily armed paramilitary group. Now, with the nation's government falling into chaos and time running out, it's up to Cale to save the president, his daughter, and the country.",en,US
Warm Bodies,2013,"Horror, Comedy, Romance",6.464,97,Jonathan Levine,,"Nicholas Hoult, Teresa Palmer, Lio Tipton","After a zombie becomes involved with the girlfriend of one of his victims, their romance sets in motion a sequence of events that might transform the entire lifeless world.",en,US
The Mortal Instruments: City of Bones,2013,"Fantasy, Action, Mystery",6.441,130,Harald Zwart,,"Lily Collins, Jamie Campbell Bower, Robert Sheehan","In New York City, Clary Fray, a seemingly ordinary teenager, learns that she is descended from a line of Shadowhunters — half-angel warriors who protect humanity from evil forces. After her mother disappears, Clary joins forces with a group of Shadowhunters and enters Downworld, an alternate realm filled with demons, vampires, and a host of other creatures. Clary and her companions must find and protect an ancient cup that holds the key to her mother's future.",en,"CA, GB, US"
Wolf Creek 2,2013,"Horror, Thriller",6.425,106,Greg McLean,Greg McLean,"John Jarratt, Ryan Corr, Ben Gerrard","Lured by the promise of an Australian holiday, backpackers Rutger, Katarina and Paul visit the notorious Wolf Creek Crater.  Their dream Outback adventure soon becomes a horrific reality when they encounter the site's most infamous local, the last man any traveller to the region ever wants to meet—Mick Taylor.  As the backpackers flee, Mick pursues them on an epic white knuckled rampage across hostile wasteland.",en,AU
Charlie Countryman,2013,"Action, Comedy, Drama, Romance, Thriller",6.408,108,Fredrik Bond,Matt Drake,"Shia LaBeouf, Evan Rachel Wood, Mads Mikkelsen","While traveling abroad, a guy falls for a Romanian beauty whose unreachable heart has its origins in her violent, charismatic ex.",en,"RO, US"
Last Vegas,2013,Comedy,6.406,105,Jon Turteltaub,,"Robert De Niro, Morgan Freeman, Michael Douglas","Aging pals Billy, Paddy, Archie, and Sam have been best friends since childhood. When Billy finally proposes to his much-younger girlfriend, all four friends go to Las Vegas to celebrate the end of Billy's longtime bachelorhood and relive their glory days. However, the four quickly realize that the intervening decades have changed Sin City and tested their friendship in ways they had not imagined.",en,US
Kick-Ass 2,2013,"Action, Adventure, Crime",6.402,103,Jeff Wadlow,,"Aaron Taylor-Johnson, Chloë Grace Moretz, Christopher Mintz-Plasse","After Kick-Ass’ insane bravery inspires a new wave of self-made masked crusaders, he joins a patrol led by the Colonel Stars and Stripes. When these amateur superheroes are hunted down by Red Mist — reborn as The Mother Fucker — only the blade-wielding Hit-Girl can prevent their annihilation.",en,"JP, GB, US"
Cloudy with a Chance of Meatballs 2,2013,"Animation, Family, Comedy",6.4,95,Kris Pearn,,"Bill Hader, Anna Faris, James Caan","After the disastrous food storm in the first film, Flint and his friends are forced to leave the town. Flint accepts the invitation from his idol Chester V to join The Live Corp Company, which has been tasked to clean the island, and where the best inventors in the world create technologies for the betterment of mankind. When Flint discovers that his machine still operates and now creates mutant food beasts like living pickles, hungry tacodiles, shrimpanzees and apple pie-thons, he and his friends must return to save the world.",en,US
Olympus Has Fallen,2013,"Action, Thriller",6.4,120,Antoine Fuqua,Creighton Rothenberger,"Gerard Butler, Aaron Eckhart, Finley Jacobsen","When the White House (Secret Service Code: ""Olympus"") is captured by a terrorist mastermind and the President is kidnapped, disgraced former Presidential guard Mike Banning finds himself trapped within the building. As the national security team scrambles to respond, they are forced to rely on Banning's inside knowledge to help retake the White House, save the President and avert an even bigger disaster.",en,US
The Family,2013,"Crime, Comedy, Action",6.36,111,Luc Besson,,"Robert De Niro, Michelle Pfeiffer, Tommy Lee Jones","After ratting out his Mafia cohorts, Giovanni Manzoni and his family enter the Witness Protection Program and relocate to a sleepy town in France. Despite the best efforts of their handler to keep them in line, Giovanni (now called Fred Blake), his wife and children can't help but resort to doing things the ""family"" way. However, their dependence on such old habits places everyone in danger from vengeful mobsters.",en,US
The Immigrant,2013,"Drama, Romance",6.323,117,James Gray,James Gray,"Marion Cotillard, Joaquin Phoenix, Jeremy Renner",1921 New York. An immigrant woman is tricked into a life of burlesque and vaudeville until a dazzling magician tries to save her and reunite her with her sister who is being held in the confines of Ellis Island.,en,US
John Dies at the End,2013,"Horror, Comedy",6.313,99,Don Coscarelli,Don Coscarelli,"Chase Williamson, Rob Mayes, Doug Jones","A new drug promises out-of-body experiences, but users are coming back changed forever, and an otherworldly invasion of Earth is underway.",en,US
Dark Skies,2013,"Science Fiction, Thriller, Horror",6.305,97,Scott Stewart,Scott Stewart,"Keri Russell, Josh Hamilton, Dakota Goyo","From the producers of Paranormal Activity, Insidious, and Sinister comes Dark Skies: a supernatural thriller that follows a young family living in the suburbs. As husband and wife Daniel and Lacey Barret witness an escalating series of disturbing events involving their family, their safe and peaceful home quickly unravels. When it becomes clear that the Barret family is being targeted by an unimaginably terrifying and deadly force, Daniel and Lacey take matters in their own hands to solve the mystery of what is after their family.",en,US
Mama,2013,Horror,6.3,100,Andy Muschietti,,"Jessica Chastain, Nikolaj Coster-Waldau, Megan Charpentier","Guillermo del Toro presents Mama, a supernatural thriller that tells the haunting tale of two little girls who disappeared into the woods the day that their parents were killed. When they are rescued years later and begin a new life, they find that someone or something still wants to come tuck them in at night.",en,"CA, US"
Riddick,2013,"Science Fiction, Action, Thriller",6.3,119,David Twohy,David Twohy,"Vin Diesel, Matt Nable, Katee Sackhoff","Betrayed by his own kind and left for dead on a desolate planet, Riddick fights for survival against alien predators and becomes more powerful and dangerous than ever before. Soon bounty hunters from throughout the galaxy descend on Riddick only to find themselves pawns in his greater scheme for revenge. With his enemies right where he wants them, Riddick unleashes a vicious attack of vengeance before returning to his home planet of Furya to save it from destruction.",en,"CA, US"
American Mary,2013,"Horror, Thriller",6.3,102,Jen Soska,Sylvia Soska,"Katharine Isabelle, Julia Maxwell, Antonio Cupo",A young medical student struggling to pay tuition is drawn into the shady world of underground body-modification.,en,CA
Byzantium,2013,"Drama, Fantasy, Thriller",6.3,118,Neil Jordan,,"Gemma Arterton, Saoirse Ronan, Sam Riley","Residents of a coastal town learn, with deadly consequences, the secret shared by the two mysterious women who have sought refuge at a local resort.",en,"IE, GB"
I Spit on Your Grave 2,2013,"Thriller, Horror, Crime",6.3,100,Steven R. Monroe,Thomas Fenton,"Jemma Dallender, Joe Absolom, Aleksandar Aleksiev","Broke, and in desperate need to update her portfolio, New York City model Katie calls a number from a tear-off flyer offering free photos. But this innocent attempt quickly turns into an unthinkable kidnapping nightmare where she's ripped away from everyone and everything she knows.",en,"BG, US"
Pain & Gain,2013,"Action, Crime, Comedy, Drama, Mystery",6.3,130,Michael Bay,,"Mark Wahlberg, Dwayne Johnson, Anthony Mackie","Daniel Lugo, manager of the Sun Gym in 1990s Miami, decides that there is only one way to achieve his version of the American dream: extortion. To achieve his goal, he recruits musclemen Paul and Adrian as accomplices. After several failed attempts, they abduct rich businessman Victor Kershaw and convince him to sign over all his assets to them. But when Kershaw makes it out alive, authorities are reluctant to believe his story.",en,US
The Purge,2013,"Science Fiction, Horror, Thriller",6.3,86,James DeMonaco,James DeMonaco,"Ethan Hawke, Lena Headey, Max Burkholder","Given the country's overcrowded prisons, the U.S. government begins to allow 12-hour periods of time in which all illegal activity is legal. During one of these free-for-alls, a family must protect themselves from a home invasion.",en,"FR, US"
The Host,2013,"Action, Adventure, Science Fiction",6.3,125,Andrew Niccol,,"Saoirse Ronan, Diane Kruger, Max Irons","A parasitic alien soul is injected into the body of Melanie Stryder. Instead of carrying out her race's mission of taking over the Earth, ""Wanda"" (as she comes to be called) forms a bond with her host and sets out to aid other free humans.",en,US
The Trials of Cate McCall,2013,Drama,6.3,89,Karen Moncrieff,Karen Moncrieff,"Kate Beckinsale, Nick Nolte, James Cromwell","In order to be reinstated to the bar and recover custody of her daughter, a hotshot lawyer, now in recovery and on probation, must take on the appeal of a woman wrongfully convicted of murder.",en,US
The Frozen Ground,2013,"Thriller, Crime",6.282,105,Scott Walker,Scott Walker,"Nicolas Cage, Vanessa Hudgens, John Cusack",An Alaska State Trooper partners with a young woman who escaped the clutches of serial killer Robert Hansen to bring the murderer to justice. Based on actual events.,en,US
Europa Report,2013,"Science Fiction, Thriller",6.272,90,Sebastián Cordero,,"Anamaria Marinca, Michael Nyqvist, Sharlto Copley",A crew of international astronauts are sent on a private mission to Jupiter's fourth moon.,en,US
Turbo,2013,"Animation, Family",6.225,96,David Soren,,"Ryan Reynolds, Paul Giamatti, Michael Peña",The tale of an ordinary garden snail who dreams of winning the Indy 500.,en,US
V/H/S/2,2013,"Horror, Thriller",6.212,96,Adam Wingard,Simon Barrett,"Lawrence Michael Levine, Kelsy Abbott, L.C. Holt","Inside a darkened house looms a column of TVs littered with VHS tapes, a pagan shrine to forgotten analog gods. The screens crackle and pop endlessly with monochrome vistas of static white noise permeating the brain and fogging concentration. But you must fight the urge to relax: this is no mere movie night. Those obsolete spools contain more than just magnetic tape. They are imprinted with the very soul of evil.",en,US
The Hangover Part III,2013,Comedy,6.211,100,Todd Phillips,Todd Phillips,"Bradley Cooper, Ed Helms, Zach Galifianakis","This time, there's no wedding. No bachelor party. What could go wrong, right? But when the Wolfpack hits the road, all bets are off.",en,US
Walking with Dinosaurs,2013,"Animation, Family, Adventure",6.2,87,Neil Nightingale,John Collee,"Justin Long, John Leguizamo, Tiya Sircar","In a time when dinosaurs rule the Earth, the smallest dinosaur of the herd, a playful Pachyrhinosaurus named Patchi, embarks on the biggest adventure of his life. As he tries to find his place in a spectacular world filled with fun-loving friends and a few dangerous foes, Patchi will discover the courage he needs to become the leader of the herd and a hero for the ages.",en,"AU, US, GB"
This Is the End,2013,"Action, Comedy",6.2,106,Seth Rogen,,"James Franco, Jonah Hill, Seth Rogen","While attending a party at James Franco's house, Seth Rogen, Jay Baruchel and many other celebrities are faced with the apocalypse.",en,US
