Title,Year,Genres,Rating,Runtime,Director,Writer,Actors,Plot,Language,Country
The Innkeepers,2011,"Horror, Thriller",5.399,101,Ti West,Ti West,"Sara Paxton, Pat Healy, Kelly McGillis","During the final days at the Yankee Pedlar Inn, two employees determined to reveal the hotel's haunted past begin to experience disturbing events as old guests check in for a stay.",en,US
The Roommate,2011,"Thriller, Drama, Horror",5.372,91,Christian E. Christiansen,Chris Bylsma,"Leighton Meester, Minka Kelly, Cam Gigandet","When Sara, a young design student from Iowa, arrives for college in Los Angeles, she is eager to fit in and get to know the big city. Her wealthy roommate, Rebecca, is more than eager to take Sara under her wing and show her the ropes. The two become close, but when Sara begins to branch out and make more friends on campus, Rebecca becomes resentful. Alarmed, Sara moves in with her new boyfriend, causing Rebecca's behavior to take a violent turn.",en,US
Conan the Barbarian,2011,"Adventure, Fantasy, Action",5.309,113,Marcus Nispel,Sean Hood,"Jason Momoa, Stephen Lang, Rachel Nichols","A quest that begins as a personal vendetta for the fierce Cimmerian warrior soon turns into an epic battle against hulking rivals, horrific monsters, and impossible odds, as Conan realizes he is the only hope of saving the great nations of Hyboria from an encroaching reign of supernatural evil.",en,US
Apollo 18,2011,"Horror, Thriller, Science Fiction",5.3,86,Gonzalo López-Gallego,,"Ryan Robbins, Warren Christie, Lloyd Owen","Officially, Apollo 17 was the last manned mission to the moon. But a year later in 1973, three American astronauts were sent on a secret mission to the moon funded by the US Department of Defense. What you are about to see is the actual footage which the astronauts captured on that mission. While NASA denies its authenticity, others say it's the real reason we've never gone back to the moon.",en,"CA, US"
The Darkest Hour,2011,"Horror, Action, Thriller, Science Fiction",5.3,89,Chris Gorak,,"Emile Hirsch, Rachael Taylor, Olivia Thirlby","In Moscow, five young people lead the charge against an alien race which has attacked Earth via our power supply.",en,US
Inbred,2011,"Comedy, Horror",5.3,90,Alex Chandon,Alex Chandon,"Jo Hartley, Seamus O'Neill, James Doherty","Four young offenders and their workers spend a weekend in the remote Yorkshire village of Mortlake, which prides on keeping itself to itself. A minor incident with locals rapidly escalates into a blood-soaked, deliriously warped nightmare.",en,"US, GB"
Sleeping Beauty,2011,"Drama, Romance",5.3,102,Julia Leigh,Julia Leigh,"Emily Browning, Rachael Blake, Ewen Leslie","A haunting erotic fairytale about Lucy, a young University student drawn into a mysterious hidden world of beauty and desire.",en,AU
Your Highness,2011,"Comedy, Fantasy, Adventure, Action",5.3,102,David Gordon Green,Danny McBride,"Danny McBride, James Franco, Natalie Portman","A fantasy movie about an arrogant, lazy prince and his more heroic brother who must complete a quest in order to save their father's kingdom.",en,US
The Dilemma,2011,"Comedy, Drama",5.3,111,Ron Howard,Allan Loeb,"Vince Vaughn, Kevin James, Winona Ryder","Longtime friends Ronny and Nick are partners in an auto-design firm. They are hard at work on a presentation for a dream project that would really launch their company. Then Ronny spots Nick's wife out with another man, and in the process of investigating the possible affair, he learns that Nick has a few secrets of his own. As the presentation nears, Ronny agonizes over what might happen if the truth gets out.",en,US
Mean Girls 2,2011,Comedy,5.243,96,Melanie Mayron,Cliff Ruby,"Meaghan Jette Martin, Jennifer Stone, Maiara Walsh","Confident senior Jo begins the new school year by breaking her own cardinal rule: don't get involved in girl drama. but when she sees timid Abby preyed upon by Queen Bee Mandi and her minions, she takes sides in a viciously funny girl-world-war that turns North Shore High School upside down.",en,US
Zombie Apocalypse,2011,"Action, Horror, Science Fiction, TV Movie",5.2,90,Nick Lyon,Brooks Peck,"Ving Rhames, Taryn Manning, Johnny Pacar","Months after a zombie plague has wiped out 90 percent of the American population, a small group of survivors fight their way cross-country to a rumored refuge on the island of Catalina.",en,US
I Don't Know How She Does It,2011,"Romance, Comedy",5.2,89,Douglas McGrath,,"Sarah Jessica Parker, Pierce Brosnan, Greg Kinnear","As an employee at a Boston-based financial firm, Kate Reddy struggles daily to balance the demands of her high-powered career with the needs of her husband, Richard, and their two children. When she gets an account that requires frequent trips to New York and her husband gets a new job, Kate finds herself spread even thinner. Complicating Kate's life even more is her new business associate Jack Abelhammer, who throws temptation into the mix.",en,US
Green Lantern,2011,"Adventure, Action, Thriller, Science Fiction",5.2,114,Martin Campbell,,"Ryan Reynolds, Blake Lively, Peter Sarsgaard","For centuries, a small but powerful force of warriors called the Green Lantern Corps has sworn to keep intergalactic order. Each Green Lantern wears a ring that grants him superpowers. But when a new enemy called Parallax threatens to destroy the balance of power in the Universe, their fate and the fate of Earth lie in the hands of the first human ever recruited.",en,US
Arena,2011,"Action, Thriller, Science Fiction",5.2,94,Jonah Loop,Tony Giglio,"Kellan Lutz, Katia Winter, Johnny Messner","David Lord finds himself forced into the savage world of a modern gladiatorial arena, where men fight to the death for the entertainment of the online masses.",en,US
The Son of No One,2011,"Drama, Thriller, Crime",5.1,90,Dito Montiel,Dito Montiel,"Channing Tatum, Al Pacino, Juliette Binoche",A rookie cop is assigned to the 118 Precinct in the same district where he grew up. The Precinct Captain starts receiving letters about two unsolved murders that happened many years ago in the housing projects when the rookie cop was just a kid. These letters bring back bad memories and old secrets that begin to threaten his career and break up his family.,en,US
Hoodwinked Too! Hood VS. Evil,2011,"Comedy, Animation, Family",5.1,86,Mike Disa,Michael Ludy,"Hayden Panettiere, Glenn Close, Patrick Warburton","Red Riding Hood is training in the group of Sister Hoods, when she and the Wolf are called to examine the sudden mysterious disappearance of Hansel and Gretel.",en,US
Twixt,2011,"Mystery, Fantasy, Horror",5.07,88,Francis Ford Coppola,,"Val Kilmer, Bruce Dern, Elle Fanning","A struggling horror writer visiting a small town on a book tour gets caught up in a murder mystery involving a young girl. That night in a dream, he is approached by a mysterious young ghost named V.",en,US
Catch.44,2011,"Drama, Action, Thriller",5.058,93,Aaron Harvey,,"Bruce Willis, Malin Åkerman, Nikki Reed","The lives of three female assassins take a sudden turn when their charming boss lures them into one last job. They soon find themselves thrust into a bizarre situation involving a psychotic hit man, a grizzled trucker and a delusional line cook.",en,US
Ghost Rider: Spirit of Vengeance,2011,"Action, Fantasy, Thriller",5.0,96,Mark Neveldine,,"Nicolas Cage, Fergus Riordan, Violante Placido","When the devil resurfaces with aims to take over the world in human form, Johnny Blaze reluctantly comes out of hiding to transform into the flame-spewing supernatural hero Ghost Rider -- and rescue a 10-year-old boy from an unsavory end.",en,"AE, US"
Night of the Demons,2011,"Horror, Action, Comedy",5.0,93,Adam Gierasch,,"Monica Keena, Edward Furlong, Shannon Elizabeth","Angela is throwing a decadent Halloween party at New Orleans' infamous Broussard Mansion. But after the police break up the festivities, Maddie and a few friends stay behind. Trapped inside the locked mansion gates, the remaining guests uncover a horrifying secret and soon fall victim to seven vicious, blood-thirsty demons.",en,US
Shark Night 3D,2011,"Thriller, Horror",4.992,91,David R. Ellis,,"Sara Paxton, Dustin Milligan, Chris Carmack",A weekend at a lake house in the Louisiana Gulf turns into a nightmare for seven vacationers as they are subjected to fresh-water shark attacks.,en,US
"A Fairly Odd Movie: Grow Up, Timmy Turner!",2011,"Family, Fantasy, TV Movie",4.852,57,Savage Steve Holland,Butch Hartman,"Drake Bell, Daniella Monet, Tara Strong","The television movie is set in the city of Dimmsdale and centers on the series' main protagonist Timmy Turner with his fairy godparents Cosmo and Wanda and his fairy godbrother Poof. In the movie, Timmy is now 23 years old but is still in fifth grade with his fairy-obsessed fifth grade teacher Mr. Crocker. Despite being grown up, Timmy finds a loophole in the fairy rulebook Da Rules: if he continues to act like a kid, he will still get to keep his fairies. However, the dilemma rises when Tootie, who was once a dorky girl when she was 10 years old, returns to Dimmsdale as an attractive woman. Timmy falls in love with her, a sign that he is growing up to an adult, which means he is closer to losing his fairies. Meanwhile, an oil business tycoon named Hugh J. Magnate, Jr., who teams up with Mr. Crocker, plans to use Timmy's fairies' magic in order to promote his oil business.",en,"US, CA"
Passion Play,2011,"Drama, Romance, Fantasy",4.819,94,Mitch Glazer,,"Megan Fox, Mickey Rourke, Bill Murray",An angel under the thumb of a ruthless gangster is saved by a trumpet player down on his luck.,en,US
The Human Centipede 2 (Full Sequence),2011,"Drama, Horror, Crime",4.8,91,Tom Six,Tom Six,"Laurence R. Harvey, Ashlynn Yennie, Dominic Borrelli","Inspired by the fictional Dr. Heiter, disturbed loner Martin dreams of creating a 12-person centipede and sets out to realize his sick fantasy.",en,NL
