Title,Year,Genres,Rating,Popularity,Runtime,Director,Writer,Actors,Keywords,Plot,Ratings Amount,Language,Country
Take Shelter,2011,"Thriller, Drama, Horror",7.0,7.839,120,Jeff Nichols,Jeff Nichols,"Michael Shannon, Jessica Chastain, Shea Whigham","small town, beach, schizophrenia, nightmare, obsession, deaf, ohio, shelter, end of the world, premonition, sanity, apocalypse, storm, mental illness, construction worker, bank loan, storm shelter, apocalyptic vision, ambiguous","Plagued by a series of apocalyptic visions, a young husband and father questions whether to shelter his family from a coming storm, or from himself.",1792,en,US
In Time,2011,"Action, Thriller, Science Fiction",6.969,20.894,109,Andrew Niccol,,"Justin Timberlake, Amanda Seyfried, Cillian Murphy","future, race against time, immortality, bank, dystopia, time, love, on the run, class differences, biting, cops and robbers , aggressive, rich vs poor, in time, antagonistic, defiant, urgent","In the not-too-distant future, the aging gene has been switched off. To avoid overpopulation, time has become the currency and the way people pay for luxuries and necessities. The rich can live forever, while the rest struggle to negotiate for their immortality. A poor young man who suddenly comes into a fortune of time finds himself on the run from a corrupt police force known as the ""time keepers"".",11489,en,US
Pixie Hollow Games,2011,"Animation, Family",6.951,8.071,23,Bradley Raymond,,"Megan Hilty, Brenda Song, Jason Dolley","sports, magic, competition, fairy tale, olympic games, fairy, sport competition, duringcreditsstinger","Rosetta and new arrival Chloe band together to try to break the garden fairies' legendary losing streak in the Pixie Hollow Games, a sports spectacle filled with pixie pageantry, fantastic fairy events and hilarious surprises.",288,en,US
Insidious,2011,"Horror, Thriller",6.9,19.51,102,James Wan,Leigh Whannell,"Patrick Wilson, Rose Byrne, Lin Shaye","medium, haunted house, evil spirit, house warming, new home, aftercreditsstinger, other dimension, insidious, supernatural power, distressing, supernatural thriller, moving into haunted house, possessed child","A family discovers that dark spirits have invaded their home after their son inexplicably falls into an endless sleep. When they reach out to a professional for help, they learn things are a lot more personal than they thought.",6852,en,US
Thriller Night,2011,"Animation, Music, Horror, Comedy",6.9,18.729,6,Sean Bishop,,"Michael Gough, Dean Edwards, Holly Fields",,"A Shrek parody of Michael Jackson's Thriller song and music video, with Donkey singing.",98,en,US
Barbie: A Fairy Secret,2011,"Animation, Family, Fantasy",6.9,7.787,72,William Lau,Elise Allen,"Diana Kaarina, Adrian Petriw, Britt Irvin","fairy, based on toy, female protagonist","Get ready for Barbie: A Fairy Secret, an amazing adventure with Barbie where she discovers there are fairies living secretly all around us! When Ken is suddenly whisked away by a group of fairies, Barbie's two fashion stylist friends reveal they are actually fairies and that Ken has been taken to a magical secret fairy world not far away! Barbie and her rival Raquelle take off with the fairy friends on an action-packed journey to bring him back. Along the way they must stick together and learn that the real magic lies not just in the fairy world itself, but in the power of friendship.",503,en,US
Perfect Sense,2011,"Drama, Science Fiction, Romance",6.9,7.115,93,David Mackenzie,,"Ewan McGregor, Eva Green, Ewen Bremner","glasgow, scotland, street riots, co-workers relationship, chef, boyfriend girlfriend relationship, pandemic, human nature, epidemiologist, five senses","In Glasgow, Scotland, while a mysterious pandemic begins to spread around the world, Susan, a brilliant epidemiologist, falls in love with Michael, a skillful cook.",1151,en,GB
Rango,2011,"Animation, Comedy, Family, Western, Adventure",6.9,23.374,112,Gore Verbinski,John Logan,"Johnny Depp, Isla Fisher, Ned Beatty","hero, gunslinger, sheriff, nevada, mayor, pet, native american, water supply, outlaw, water shortage, spirit, mariachi, disillusionment, desert, construction, frontier town, small western town, animal life, animal protagonist, old west, high noon","When Rango, a lost family pet, accidentally winds up in the gritty, gun-slinging town of Dirt, the less-than-courageous lizard suddenly finds he stands out. Welcomed as the last hope the town has been waiting for, new Sheriff Rango is forced to play his new role to the hilt.",6590,en,US
Margin Call,2011,"Thriller, Drama",6.9,9.929,108,J.C. Chandor,,"Kevin Spacey, Zachary Quinto, Paul Bettany","capitalism, brokerage, wall street, based on true story, morality, economics, downsizing, financial crisis, stock market, stock market crash, investment, investment banker",A thriller that revolves around the key people at an investment bank over a 24-hour period during the early stages of the financial crisis.,1830,en,US
Small Fry,2011,"Animation, Family, Comedy",6.9,7.673,7,Angus MacLane,Angus MacLane,"Tom Hanks, Tim Allen, Joan Cusack","fast food restaurant, fast food, short film",A fast food restaurant mini variant of Buzz forcibly switches places with the real Buzz and his friends have to deal with the obnoxious impostor.,551,en,US
The Adventures of Tintin,2011,"Adventure, Animation, Mystery",6.898,11.187,107,Steven Spielberg,,"Jamie Bell, Andy Serkis, Daniel Craig","treasure, captain, riddle, morocco, belgium, treasure hunt, liquor, based on comic, sunken treasure, reporter, belgian, 1950s","Intrepid young reporter, Tintin, and his loyal dog, Snowy, are thrust into a world of high adventure when they discover a ship carrying an explosive secret. As Tintin is drawn into a centuries-old mystery, Ivan Ivanovitch Sakharine suspects him of stealing a priceless treasure. Tintin and Snowy, with the help of salty, cantankerous Captain Haddock and bumbling detectives, Thompson and Thomson, travel half the world, one step ahead of their enemies, as Tintin endeavors to find the Unicorn, a sunken ship that may hold a vast fortune, but also an ancient curse.",5427,en,US
The Adjustment Bureau,2011,"Science Fiction, Thriller, Romance",6.8,10.549,106,George Nolfi,,"Matt Damon, Emily Blunt, John Slattery","hotel, future, plan, dancer, hat, marriage, senator, kiss, politician, honesty, alone, speech, fate, foot chase, covert agency, courthouse, political campaign, destiny, based on short story","A man glimpses the future Fate has planned for him – and chooses to fight for his own destiny. Battling the powerful Adjustment Bureau across, under and through the streets of New York, he risks his destined greatness to be with the only woman he's ever loved.",4568,en,US
Book of Dragons,2011,"Fantasy, Animation, Action, Comedy, Family",6.8,7.379,18,Steve Hickner,Steve Hickner,"Jay Baruchel, Craig Ferguson, America Ferrera","vikings (norsemen), dragon","So you want to be a dragon trainer do you? Prepare yourself for adventure, excitement and training as Hiccup, Astrid, Toothless and Gobber tell the legend behind the Book of Dragons and reveal insider training secrets about new, never-before-seen dragons.",177,en,US
Super 8,2011,"Thriller, Science Fiction, Mystery",6.8,9.017,112,J.J. Abrams,J.J. Abrams,"Joel Courtney, Elle Fanning, Riley Griffiths","1970s, alien, train crash, firecracker, super 8mm footage, duringcreditsstinger, amused, familiar","In 1979 Ohio, several youngsters are making a zombie movie with a Super-8 camera. In the midst of filming, the friends witness a horrifying train derailment and are lucky to escape with their lives. They soon discover that the catastrophe was no accident, as a series of unexplained events and disappearances soon follows. Deputy Jackson Lamb, the father of one of the kids, searches for the terrifying truth behind the crash.",6636,en,US
Marvel One-Shot: A Funny Thing Happened on the Way to Thor's Hammer,2011,"Science Fiction, Fantasy",6.8,7.43,4,Leythum,Eric Pearson,"Clark Gregg, Jessica Manuel, Jeff Prewett","shield, based on comic, agent, marvel cinematic universe (mcu), short film, convenience store",Agent Coulson stops at a convenience store and deals with a coincidental robbery during his visit.,489,en,US
The Descendants,2011,"Comedy, Drama",6.8,7.428,115,Alexander Payne,,"George Clooney, Shailene Woodley, Amara Miller","daughter, infidelity, hawaii, father-in-law, beach house, boating accident, estate, dying mother, teenage daughter, trustee, trust fund, wild girl, wild child, realtor, thoughtful","With his wife Elizabeth on life support after a boating accident, Hawaiian land baron Matt King takes his daughters on a trip from Oahu to Kauai to confront a young real estate broker, who was having an affair with Elizabeth before her misfortune.",2821,en,US
Arthur Christmas,2011,"Drama, Animation, Family, Comedy",6.8,7.708,97,Sarah Smith,,"James McAvoy, Hugh Laurie, Bill Nighy","sleigh, elves, holiday, assistant, santa claus, wish, reindeer, family, north pole, high tech, clumsiness, duringcreditsstinger, letter to santa claus, woman director, christmas, father son relationship, brother brother relationship","For hundreds of years, the Claus family has delegated the title ""Santa"" to a chosen few of its members, which can be passed down upon retirement. Each Christmas, Santa and his vast army of highly trained elves produce gifts and distribute them around the world in a one-night high-tech operation. However, when one of 600 million children to receive a gift from Santa on Christmas Eve is missed, it is deemed ‘acceptable’ to all but one—Arthur Claus, the current Santa’s misfit son deemed ineligible for the title, who executes an unauthorised rookie mission to get the last present halfway around the globe before dawn on Christmas morning.",1503,en,US
Thor,2011,"Adventure, Fantasy, Action",6.8,27.258,115,Kenneth Branagh,,"Chris Hemsworth, Natalie Portman, Tom Hiddleston","new mexico, superhero, redemption, banishment, based on comic, brother against brother, norse mythology, aftercreditsstinger, marvel cinematic universe (mcu), worlds collide, god of thunder, fantasy, egotistical","Against his father Odin's will, The Mighty Thor - a powerful but arrogant warrior god - recklessly reignites an ancient war. Thor is cast down to Earth and forced to live among humans as punishment. Once here, Thor learns what it takes to be a true hero when the most dangerous villain of his world sends the darkest forces of Asgard to invade Earth.",21343,en,US
Rio,2011,"Animation, Adventure, Comedy, Family",6.739,21.76,96,Carlos Saldanha,,"Jesse Eisenberg, Anne Hathaway, Leslie Mann","rio de janeiro, pet, villain, carnival, parrot, musical, canary, jungle, samba, animals, duringcreditsstinger, pets, cartoon bird, brazil, smugglers","Captured by smugglers when he was just a hatchling, a macaw named Blu never learned to fly and lives a happily domesticated life in Minnesota with his human friend, Linda. Blu is thought to be the last of his kind, but when word comes that Jewel, a lone female, lives in Rio de Janeiro, Blu and Linda go to meet her. Animal smugglers kidnap Blu and Jewel, but the pair soon escape and begin a perilous adventure back to freedom -- and Linda.",6743,en,"BR, US"
Madea's Big Happy Family,2011,"Comedy, Drama",6.727,7.126,106,Tyler Perry,Tyler Perry,"Tyler Perry, Loretta Devine, Shad Moss","dying and death, relationship problems, family clan, family drama, niece, single mother, illness, family conflict, bickering, duringcreditsstinger, emasculation, health crisis, black cinema, ungratefulness, secrets","When Shirley, Madea's niece, receives distressing news about her health, the only thing she wants is her family gathered around her. However, Shirley's three adult children are too preoccupied with their own troubled lives to pay attention to their mother. It is up to Madea, with the help of rowdy Aunt Bam, to bring the clan together and help Shirley deal with her crisis.",141,en,US
"Good Luck Charlie, It's Christmas!",2011,"Comedy, Family, Drama, TV Movie",6.7,7.125,85,Arlene Sanford,Geoff Rodkey,"Bridgit Mendler, Leigh-Allyn Baker, Jason Dolley","road trip, woman director, christmas","Teddy Duncan's middle-class family embarks on a road trip from their home in Denver to visit Mrs. Duncans Parents, the Blankenhoopers, in Palm Springs. When they find themselves stranded between Denver and Utah, they try to hitch a ride to Las Vegas with a seemingly normal older couple in a station wagon from Roswell, New Mexico. It turns out that the couple believes they are the victims of alien abduction. The Duncan's must resort to purchasing a clunker Yugo to get to Utah, have their luggage stolen in Las Vegas, and survive a zany Christmas with Grandpa and Grandma Blankenhooper.",412,en,US
Paul,2011,"Adventure, Comedy, Science Fiction",6.7,13.212,104,Greg Mottola,Nick Frost,"Simon Pegg, Nick Frost, Seth Rogen","san diego, california, alien, area 51, alien space craft, duringcreditsstinger, 1980s","For the past 60 years, a space-traveling smart-ass named Paul has been locked up in a top-secret military base, advising world leaders about his kind. But when he worries he’s outlived his usefulness and the dissection table is drawing uncomfortably close, Paul escapes on the first RV that passes by his compound in Area 51. Fortunately, it contains the two earthlings who are most likely to rescue and harbor an alien on the run.",5821,en,"US, GB"
Another Earth,2011,"Drama, Science Fiction",6.7,7.207,92,Mike Cahill,Mike Cahill,"Brit Marling, William Mapother, Matthew-Lee Erlbach","affectation, earth, tragedy, janitor, planet, cosmology, ego, solar system, philosophical, anxious, introspective, provocative, adoring, ambiguous, antagonistic, ghoulish, gloomy, powerful, pretentious","On the night of the discovery of a duplicate Earth in the Solar system, an ambitious young student and an accomplished composer cross paths in a tragic accident.",1643,en,US
Just Go with It,2011,"Comedy, Romance",6.7,19.723,117,Dennis Dugan,,"Adam Sandler, Jennifer Aniston, Brooklyn Decker","friendship, hawaii, assistant, plastic surgery, romcom, waterfall, falling in love, older man younger woman relationship, young woman, family vacation, single mother, plastic surgeon, divorced, schoolteacher, rich man, favor, elaborate ruse, pretending to be wife, pretend marriage, backstory, lies to cover lies, pretend family, sorority sister","While romancing Palmer, a much younger schoolteacher, plastic surgeon Danny Maccabee enlists his loyal assistant Katherine to pretend to be his soon to be ex-wife, in order to cover up a careless lie. When more lies backfire, Katherine's kids become involved, and everyone heads off for a weekend in Hawaii that will change all their lives.",5770,en,US
The Muppets,2011,"Comedy, Family, Music",6.7,7.57,103,James Bobin,Jason Segel,"Jason Segel, Amy Adams, Chris Cooper","musical, based on toy, puppetry, hollywood, los angeles, california, oil tycoon, studio tour, duringcreditsstinger, puppets, based on tv series, comedy","When Kermit the Frog and the Muppets learn that their beloved theater is slated for demolition, a sympathetic human, Gary, and his puppet brother, Walter, swoop in to help the gang put on a show and raise the $10 million they need to save the day.",1583,en,US
The Tree of Life,2011,"Drama, Fantasy",6.7,7.557,139,Terrence Malick,Terrence Malick,"Brad Pitt, Sean Penn, Jessica Chastain","sibling relationship, parent child relationship, afterlife, christianity, philosophy, tree, sun, texas, telegram, bible, surrealism, meteor, coming of age, spirituality, grief, space, religion, memory, dinosaur, birth, death, grace, childhood, death of brother, silhouette, existentialism, organist, masculinity, cosmos, 1950s, philosophical, self reflection, newborn baby, organ player, waco texas, father son relationship, mother son relationship, brother brother relationship, stream of consciousness, life, existential crisis, pantheism","The impressionistic story of a Texas family in the 1950s. The film follows the life journey of the eldest son, Jack, through the innocence of childhood to his disillusioned adult years as he tries to reconcile a complicated relationship with his father. Jack finds himself a lost soul in the modern world, seeking answers to the origins and meaning of life while questioning the existence of faith.",3103,en,US
The Ides of March,2011,Drama,6.7,8.021,101,George Clooney,,"Ryan Gosling, George Clooney, Philip Seymour Hoffman","politics, ohio, dirty tricks, cynical, presidential campaign, endorsement, campaign speech, presidential debate",Dirty tricks stand to soil an ambitious young press spokesman's idealism in a cutthroat presidential campaign where 'victory' is relative.,2508,en,US
Geek Charming,2011,"Comedy, Drama, Family, TV Movie",6.7,7.123,99,Jeffrey Hornaday,,"Sarah Hyland, Matt Prokop, Vanessa Morgan","high school, based on novel or book, geek, unlikely lovers, documentary filmmaking, teenage romance, based on young adult novel","Film geek Josh is looking for the subject of his new documentary when a chance meeting puts the perfect star in his sights—Dylan, his school's most popular junior. But Dylan's hopes of using the film to become Blossom Queen don't quite match with Josh's goal to make a hard-hitting exposé about popularity. Will Josh shoot the film as planned, or show Dylan as the truly interesting person she is?",757,en,US
The Smurfs: A Christmas Carol,2011,"Animation, Comedy, Family",6.7,11.799,22,Troy Quane,Todd Berger,"Jack Angel, Fred Armisen, Hank Azaria","holiday, christmas spirit, christmas","When Grouchy Smurf behaves badly to everyone and refuses to celebrate Christmas, the Smurfs of Christmas Past, Present and Future teach him to appreciate Christmas.",260,en,US
Machine Gun Preacher,2011,"Action, Thriller, Crime",6.7,14.608,129,Marc Forster,,"Gerard Butler, Michelle Monaghan, Kathy Baker",duringcreditsstinger,"The true story of Sam Childers, a former drug-dealing biker who finds God and became a crusader for hundreds of Sudanese children who've been kidnapped and pressed into duty as soldiers.",1054,en,US
Megamind: The Button of Doom,2011,"Animation, Action, Comedy, Family",6.7,7.413,16,Simon J. Smith,Brent Simons,"Will Ferrell, David Cross, Michelle Belforte",,"For their first day on the job as the new protectors of Metro City, Megamind and Minion are selling off the gadgets from their evil lair. But when one seemingly harmless ""button"" unleashes the gigantic robot MEGA-MEGAmind, the duo will have to resort to their old tricks to restore order.",245,en,US
Unknown,2011,"Action, Mystery, Thriller",6.678,10.35,113,Jaume Collet-Serra,,"Liam Neeson, Diane Kruger, January Jones","hotel, taxi, coma, taxi driver, prince, briefcase, hospital, stolen identity","A man awakens from a coma, only to discover that someone has taken on his identity and that no one, (not even his wife), believes him. With the help of a young woman, he sets out to prove who he is.",3896,en,US
Friends with Benefits,2011,"Romance, Comedy",6.655,13.838,110,Will Gluck,,"Justin Timberlake, Mila Kunis, Jenna Elfman","new york city, friendship, job interview, dementia, alzheimer's disease, love, friends, break-up, lust, beach house, headhunter, job hunting, sex comedy, casual sex, aftercreditsstinger, duringcreditsstinger, new job, flash mob, sexual relationship, film within a film, sex, anti-romance, friends with benefits, job, art director",Dylan is done with relationships. Jamie decides to stop buying into the Hollywood clichés of true love. When the two become friends they decide to try something new and take advantage of their mutual attraction - but without any emotional attachment.,7984,en,US
Contagion,2011,"Drama, Thriller, Science Fiction",6.643,9.149,106,Steven Soderbergh,Scott Z. Burns,"Marion Cotillard, Matt Damon, Laurence Fishburne","quarantine, saving the world, mutation, infection, terminal illness, outbreak, disease, vaccine, lethal virus, scientist, epidemic, prophetic, virus, pandemic, medical drama, anxious","As an epidemic of a lethal airborne virus - that kills within days - rapidly grows, the worldwide medical community races to find a cure and control the panic that spreads faster than the virus itself.",6129,en,"AE, US"
Diary of a Wimpy Kid: Rodrick Rules,2011,"Family, Comedy",6.638,7.988,99,David Bowers,,"Zachary Gordon, Devon Bostick, Robert Capron","based on novel or book, sibling rivalry, middle school, based on children's book","Wimpy Greg Heffley, now in seventh grade, thinks he has it all together. He has mastered middle school and gotten rid of the Cheese Touch. However, Greg's older brother, Rodrick, is itching to cut him down to size. He gets the perfect opportunity when their mother tries to force the boys to bond. Rodrick may be Greg's chief tormentor, but he feels his constant pranks are just what his little brother needs to prepare him for life's hard knocks.",1141,en,US
Colombiana,2011,"Action, Thriller, Crime, Drama",6.633,20.863,108,Olivier Megaton,,"Zoe Saldaña, Cliff Curtis, Callum Blue","street gang, uncle, female assassin, witness to murder","After witnessing her parents’ murder as a child in Bogota, Cataleya Restrepo grows up to be a stone-cold assassin. She works for her uncle as a hitman by day, but her personal time is spent engaging in vigilante murders that she hopes will lead her to her ultimate target: the mobster responsible for her parents' death.",2640,en,US
Tinker Tailor Soldier Spy,2011,"Drama, Thriller, Mystery",6.62,9.057,127,Tomas Alfredson,,"Gary Oldman, Colin Firth, Tom Hardy","london, england, budapest, hungary, espionage, spy, cold war, 1970s, secret agent, mi6, mole, british spy, british intelligence","In the bleak days of the Cold War, espionage veteran George Smiley is forced from semi-retirement to uncover a Soviet mole within his former colleagues at the heart of MI6.",2662,en,GB
Martha Marcy May Marlene,2011,"Drama, Thriller",6.617,7.248,101,Sean Durkin,Sean Durkin,"Elizabeth Olsen, Sarah Paulson, Hugh Dancy","mind control, rape, sexual abuse, sibling relationship, post-traumatic stress disorder (ptsd), paranoia, group sex, cult, patriarchy, polygamy, connecticut, memory, brainwashing, home invasion, drugged, boundary violations, running away, estranged sister, sexual predator, manipulated woman, drugging someone, manipulative male lead, flashbacks, murderous cult","After several years of living with a cult, Martha finally escapes and calls her estranged sister, Lucy, for help. Martha finds herself at the quiet Connecticut home Lucy shares with her new husband, Ted, but the memories of what she experienced in the cult make peace hard to find. As flashbacks continue to torment her, Martha fails to shake a terrible sense of dread, especially in regard to the cult's manipulative leader.",750,en,US
Puss in Boots,2011,"Animation, Family, Fantasy, Adventure, Comedy",6.6,15.96,90,Chris Miller,,"Antonio Banderas, Salma Hayek Pinault, Zach Galifianakis","small town, fairy tale, rebel, spin off, wild west, talking cat, pets, playful, amused, farcical","Long before he even met Shrek, the notorious fighter, lover and outlaw Puss in Boots becomes a hero when he sets off on an adventure with the tough and street smart Kitty Softpaws and the mastermind Humpty Dumpty to save his town. This is the true story of The Cat, The Myth, The Legend... The Boots.",4132,en,US
Green Lantern: Emerald Knights,2011,"Action, Adventure, Animation, Science Fiction, Drama",6.6,7.37,84,Jay Oliva,,"Nathan Fillion, Jason Isaacs, Elisabeth Moss","superhero, based on comic, super power, woman director","As the home planet of the Green Lantern Corps faces a battle with an ancient enemy, Hal Jordan prepares new recruit Arisia for the coming conflict by relating stories of the first Green Lantern and several of Hal's comrades.",500,en,US
Horrible Bosses,2011,"Comedy, Crime",6.6,12.711,98,Seth Gordon,,"Jason Bateman, Charlie Day, Jason Sudeikis","bad boss, employee, death of father, stakeout, duringcreditsstinger","For Nick, Kurt and Dale, the only thing that would make the daily grind more tolerable would be to grind their intolerable bosses into dust. Quitting is not an option, so, with the benefit of a few-too-many drinks and some dubious advice from a hustling ex-con, the three friends devise a convoluted and seemingly foolproof plan to rid themselves of their respective employers... permanently.",6394,en,US
The Hunter,2011,"Drama, Thriller, Adventure",6.6,7.773,102,Daniel Nettheim,,"Willem Dafoe, Frances O'Connor, Sam Neill","hunter, mercenary, wilderness, little boy, environmentalist, sole survivor, tasmanian tiger, tasmania, thylacine","Martin, a mercenary, is sent from Europe by an anonymous biotech company to the Tasmanian wilderness on a hunt for the last Tasmanian tiger.",655,en,"AU, CA"
Hanna,2011,"Action, Thriller, Adventure",6.6,7.664,111,Joe Wright,,"Saoirse Ronan, Eric Bana, Cate Blanchett","assassin, berlin, germany, strong woman, self sacrifice, empowerment, killing, feminism, warrior woman, secret agent, coming of age, teenage girl, female protagonist, finland, duringcreditsstinger, female empowerment, aggressive, intense, audacious","Raised by her father, an ex-CIA agent, in the wilds of Finland, Hanna's upbringing has been geared to making her the perfect assassin. Sent into the world by her father on a mission, Hanna journeys across Europe, eluding agents dispatched after her by a ruthless intelligence operative. As she nears her ultimate target, Hanna faces startling revelations about her existence.",3406,en,US
Monster High: Fright On!,2011,"Family, Animation, Fantasy",6.6,7.948,46,Victor Dal Chele,Mike Montesano,"Kate Higgins, Salli Saffioti, Debi Derryberry","high school, vampire, werewolf",See what happens when the student bodies of an all-vampire school and an all-werewolf school integrate with Monster High.,45,en,US
