Title,Year,Genres,Rating,Runtime,Director,Writer,Actors,Plot,Language,Country
Cinderella,2021,"Fantasy, Romance, Comedy",6.4,113,Kay Cannon,Kay Cannon,"Camila Cabello, Nicholas Galitzine, Idina Menzel","Cinderella, an orphaned girl with an evil stepmother, has big dreams and with the help of her Fabulous Godmother, she perseveres to make them come true.",en,US
Apache Junction,2021,"Western, Action, Crime",6.4,94,Justin Lee,Justin Lee,"Stuart Townsend, Scout Taylor-Compton, Trace Adkins","Apache Junction is an outpost of lawlessness, a haven for thieves and cold-blooded killers. After big-city reporter Annabelle Angel arrives to write an article on the town, she becomes a target when notorious gunslinger Jericho Ford comes to her aid. Now Annabelle must entrust her future to a man with a deadly past, as Jericho heads toward a tense showdown.",en,US
Mainstream,2021,"Comedy, Drama",6.4,95,Gia Coppola,,"Andrew Garfield, Maya Hawke, Nat Wolff",A young woman thinks she’s found a path to internet stardom when she starts making YouTube videos with a charismatic stranger  – until the dark side of viral celebrity threatens to ruin them both.,en,US
The Matrix Resurrections,2021,"Science Fiction, Action, Adventure",6.389,147,Lana Wachowski,David Mitchell,"Keanu Reeves, Carrie-Anne Moss, Yahya Abdul-Mateen II","Plagued by strange memories, Neo's life takes an unexpected turn when he finds himself back inside the Matrix.",en,US
Coming 2 America,2021,Comedy,6.385,110,Craig Brewer,,"Eddie Murphy, Arsenio Hall, Jermaine Fowler","Prince Akeem Joffer is set to become King of Zamunda when he discovers he has a son he never knew about in America – a street savvy Queens native named Lavelle. Honoring his royal father's dying wish to groom this son as the crown prince, Akeem and Semmi set off to America once again.",en,US
Hell Hath No Fury,2021,"Action, War",6.384,94,Jesse V. Johnson,Romain Serir,"Nina Bergman, Daniel Bernhardt, Louis Mandylor","Branded a traitor by her countrymen, French national Marie DuJardin is rescued by American soldiers on one condition: to survive, she must lead them to a cache of gold - before the Nazis return to claim it for themselves.",en,"BY, US"
Outside the Wire,2021,"Thriller, Action, Science Fiction",6.36,116,Mikael Håfström,Rowan Athale,"Anthony Mackie, Damson Idris, Enzo Cilenti","In the near future, a drone pilot is sent into a deadly militarized zone and must work with an android officer to locate a doomsday device.",en,US
The Little Things,2021,"Drama, Crime, Thriller",6.336,128,John Lee Hancock,,"Denzel Washington, Rami Malek, Jared Leto","Deputy Sheriff Joe ""Deke"" Deacon joins forces with Sgt. Jim Baxter to search for a serial killer who's terrorizing Los Angeles. As they track the culprit, Baxter is unaware that the investigation is dredging up echoes of Deke's past, uncovering disturbing secrets that could threaten more than his case.",en,US
Old,2021,"Thriller, Mystery, Horror",6.332,108,M. Night Shyamalan,,"Vicky Krieps, Gael García Bernal, Rufus Sewell",A group of families on a tropical holiday discover that the secluded beach where they are staying is somehow causing them to age rapidly – reducing their entire lives into a single day.,en,US
The Many Saints of Newark,2021,"Crime, Drama",6.325,120,Alan Taylor,David Chase,"Alessandro Nivola, Leslie Odom Jr., Michael Gandolfini","Young Anthony Soprano is growing up in one of the most tumultuous eras in Newark, N.J., history, becoming a man just as rival gangsters start to rise up and challenge the all-powerful DiMeo crime family. Caught up in the changing times is the uncle he idolizes, Dickie Moltisanti, whose influence over his nephew will help shape the impressionable teenager into the all-powerful mob boss, Tony Soprano.",en,US
Megaboa,2021,"Action, Horror, Science Fiction",6.3,100,Mario N. Bonassin,,"Eric Roberts, Michelle Elizabeth O'Shea, Emilia Torello","On a trip to Colombia, a group of college students encounter a fifty-foot boa constrictor, hungry for blood.",en,US
Encounter,2021,"Science Fiction, Mystery, Thriller, Drama",6.3,108,Michael Pearce,Michael Pearce,"Riz Ahmed, Octavia Spencer, Lucian-River Chauhan","A decorated Marine goes on a rescue mission to save his two young sons from an unhuman threat. As their journey takes them in increasingly dangerous directions, the boys will need to leave their childhoods behind.",en,"US, GB"
Dear Evan Hansen,2021,Drama,6.3,137,Stephen Chbosky,,"Ben Platt, Amy Adams, Kaitlyn Dever","Evan Hansen, a high schooler with social anxiety, unintentionally gets caught up in a lie after the family of a classmate who committed suicide mistakes one of Hansen’s letters for their son’s suicide note.",en,US
Copshop,2021,"Thriller, Crime, Action",6.27,108,Joe Carnahan,,"Gerard Butler, Frank Grillo, Alexis Louder","On the run from a lethal assassin, a wily con artist devises a scheme to hide out inside a small-town police station. However, when the hit man turns up at the precinct, an unsuspecting rookie cop finds herself caught in the crosshairs.",en,US
Extinct,2021,"Animation, Comedy, Family, Adventure",6.238,85,David Silverman,Joel H. Cohen,"Adam Devine, Rachel Bloom, Zazie Beetz","Op and Ed, two adorable donut-shaped animals - flummels - accidentally time-travel from 1835 to modern-day Shanghai.  There they discover traffic, trans fats, and worst of all, that flummels are now extinct. It's up to this bumbling pair to save themselves and their species...and, just maybe, change the course of history.",en,"CN, CA, US"
Antlers,2021,"Drama, Horror, Mystery",6.2,99,Scott Cooper,,"Keri Russell, Jesse Plemons, Jeremy T. Thomas","A small-town Oregon teacher and her brother, the local sheriff, discover a young student is harbouring a dangerous secret that could have frightening consequences.",en,"CA, US"
Diary of a Wimpy Kid,2021,"Animation, Comedy, Family",6.2,58,Swinton O. Scott III,,"Brady Noon, Ethan William Childress, Hunter Dillon",Greg Heffley is a scrawny but ambitious kid with an active imagination and big plans to be rich and famous – he just has to survive middle school first.,en,US
VIRGO,2021,"Adventure, Music",6.2,6,Alyssa Toledo,,"Drew Starkey, Rudy Pankow, Elaine Siemek",Three young people recall the story of how they got into trouble.,en,US
Caveat,2021,"Horror, Mystery, Thriller",6.2,88,Damian Mc Carthy,Damian Mc Carthy,"Jonathan French, Leila Sykes, Ben Caplan",A lone drifter suffering from partial memory loss accepts a job to look after a psychologically troubled woman in an abandoned house on an isolated island.,en,IE
Aftermath,2021,"Horror, Crime, Drama, Thriller",6.2,114,Peter Winther,Dakota Gorman,"Ashley Greene, Shawn Ashmore, Britt Baron","Desperate to save their marriage, a young couple takes a deal to move into their dream home, but disturbing events reveal the house's troubled history.",en,US
Last Man Down,2021,"Action, Thriller, Mystery",6.2,87,Fansu Njie,,"Daniel Stisen, Olga Kent, Daniel Nehme","After civilization succumbs to a deadly pandemic and his wife is murdered, a special forces soldier abandons his duty and becomes a hermit in the Nordic wilderness. Years later, a wounded woman appears on his doorstep. She's escaped from a lab and her pursuers believe her blood is the key to a worldwide cure. He's hesitant to get involved, but all doubts are cast aside when he discovers her pursuer is none other than Commander Stone, the man that murdered his wife some years ago.",en,GB
Zola,2021,"Comedy, Crime",6.178,86,Janicza Bravo,,"Taylour Paige, Riley Keough, Colman Domingo","A waitress agrees to accompany an exotic dancer, her put-upon boyfriend, and her mysterious and domineering roommate on a road trip to Florida to seek their fortune at a high-end strip club.",en,US
Paranormal Activity: Next of Kin,2021,"Horror, Mystery",6.1,98,William Eubank,,"Emily Bader, Ari Notartomaso, Alexa Shae Niziak",Margot is a documentary filmmaker looking to meet her long-lost mother and extended family in a secluded Amish community. She and her film crew soon realize the family that welcomes them into their home might be hiding a sinister secret.,en,US
V/H/S/94,2021,"Horror, Thriller",6.1,103,Jennifer Reeder,Chloe Okuno,"Anna Hopkins, Anthony Christian Potenza, Brian Paul","After the discovery of a mysterious VHS tape, a brutish police SWAT team launches a high-intensity raid on a remote warehouse, only to discover a sinister cult compound whose collection of pre-recorded material uncovers a nightmarish conspiracy.",en,US
Teen Titans Go! See Space Jam,2021,"Animation, Comedy, Family, Fantasy, Science Fiction",6.1,83,Peter Rida Michail,Brady Klosterman,"Greg Cipes, Scott Menville, Khary Payton","The Teen Titans are visited by the Nerdlucks, the Space Jam villains who tried to capture Michael Jordan and the Looney Tunes. Astonished to discover his fellow Titans have never seen Space Jam, Cyborg organizes an exclusive watch party.",en,US
Castle Falls,2021,"Action, Crime, Thriller, Drama",6.061,89,Dolph Lundgren,Andrew Knauer,"Scott Adkins, Dolph Lundgren, Kim DeLonghi","Rival gangs seek out millions of dollars hidden inside a luxury condominium that's scheduled to be demolished, but first they have to deal with the demolition prep crewman who found the loot first.",en,US
Dangerous,2021,"Action, Thriller",6.028,99,David Hackl,Christopher Borrelli,"Scott Eastwood, Mel Gibson, Tyrese Gibson","A reformed sociopath heads to a remote island after the death of his brother. Soon after his arrival, the island falls under siege from a deadly gang of mercenaries, and when he discovers their role in his brother’s demise, he sets out on a relentless quest for vengeance.",en,"AL, US"
The Deep House,2021,Horror,6.02,85,Julien Maury,,"James Jagger, Camille Rowe, Eric Savin","While diving in a remote French lake, a couple of YouTubers who specialise in underwater exploration videos discover a house submerged in the deep waters. What was initially a unique finding soon turns into a nightmare when they discover that the house was the scene of atrocious crimes. Trapped, with their oxygen reserves falling dangerously, they realise the worst is yet to come: they are not alone in the house.",en,US
Willy's Wonderland,2021,"Action, Horror, Comedy, Thriller",6.018,88,Kevin Lewis,,"Nicolas Cage, Emily Tosta, Beth Grant","When his car breaks down, a quiet loner agrees to clean an abandoned family fun center in exchange for repairs. He soon finds himself waging war against possessed animatronic mascots while trapped inside Willy's Wonderland.",en,US
The Woman in the Window,2021,"Crime, Mystery, Thriller",6.007,102,Joe Wright,,"Amy Adams, Gary Oldman, Anthony Mackie",An agoraphobic woman living alone in New York begins spying on her new neighbors only to witness a disturbing act of violence.,en,US
Dark Web: Cicada 3301,2021,"Thriller, Action, Comedy",6.0,104,Alan Ritchson,Alan Ritchson,"Jack Kesy, Conor Leslie, Ron Funches","Genius hacker Connor discovers Cicada 3301, an online treasure hunt that could be a recruiting tool for a secret society. Soon Conner, art-expert friend Avi, and secretive librarian Gwen are dashing from graffiti sites to ancient libraries to uncover real-world clues. But they must outrun aggressive NSA agents, also hot on the trail of Cicada, who want the glory for themselves.",en,US
Silent Night,2021,"Comedy, Science Fiction, Horror",6.0,92,Camille Griffin,,"Keira Knightley, Matthew Goode, Roman Griffin Davis","Nell, Simon, and their boy Art are ready to welcome friends and family for what promises to be a perfect Christmas gathering. Perfect except for one thing: everyone is going to die.",en,GB
Hunters,2021,Action,6.0,95,Justin Lee,Justin Lee,"Phil Burke, Ed Morrone, Ian Ziering","As John T. Wrecker continues his task of protecting a group of refugees from a virus, the threat of something new and even more dangerous grows ever closer in the form of monstrous mutants.",en,US
Wrong Turn,2021,"Horror, Thriller",6.0,110,Mike P. Nelson,,"Charlotte Vega, Adain Bradley, Bill Sage","Jen and a group of friends set out to hike the Appalachian Trail. Despite warnings to stick to the trail, the hikers stray off course—and cross into land inhabited by The Foundation, a hidden community of mountain dwellers who use deadly means to protect their way of life.",en,"US, GB"
Stowaway,2021,"Science Fiction, Drama, Thriller, Adventure",6.0,117,Joe Penna,Joe Penna,"Anna Kendrick, Toni Collette, Daniel Dae Kim",A three-person crew on a mission to Mars faces an impossible choice when an unplanned passenger jeopardizes the lives of everyone on board.,en,"DE, GB, US"
Redemption Day,2021,"Action, Romance, War",6.0,100,Hicham Hajji,Hicham Hajji,"Gary Dourdan, Serinda Swan, Andy García","When his wife is kidnapped by terrorists for ransom, veteran war hero Brad Paxton races against the clock to rescue her in a daring and deadly operation that pits him against powerful and dark forces.",en,US
Werewolves Within,2021,"Horror, Comedy",6.0,97,Josh Ruben,,"Sam Richardson, Milana Vayntrub, George Basil","When a proposed pipeline creates hostilities between residents of a small town, a newly-arrived forest ranger must keep the peace after a snowstorm confines the townspeople to an old lodge. But when a mysterious creature begins terrorizing the group, their worst tendencies and prejudices rise to the surface, and it is up to the ranger to keep the residents alive, both from each other and the monster which plagues them.",en,US
The Desperate Hour,2021,Thriller,5.982,84,Phillip Noyce,Chris Sparling,"Naomi Watts, Colton Gobbo, Sierra Maltby",A woman desperately races to save her child after police place her hometown on lockdown due to an active shooter incident.,en,"US, CA"
Resident Evil: Welcome to Raccoon City,2021,"Action, Horror, Science Fiction",5.965,107,Johannes Roberts,Johannes Roberts,"Kaya Scodelario, Hannah John-Kamen, Robbie Amell","Once the booming home of pharmaceutical giant Umbrella Corporation, Raccoon City is now a dying Midwestern town. The company’s exodus left the city a wasteland…with great evil brewing below the surface. When that evil is unleashed, the townspeople are forever…changed…and a small group of survivors must work together to uncover the truth behind Umbrella and make it through the night.",en,US
Voyagers,2021,"Science Fiction, Thriller",5.953,108,Neil Burger,Neil Burger,"Tye Sheridan, Lily-Rose Depp, Fionn Whitehead","With the future of the human race at stake, a group of young men and women -- bred for intelligence and obedience -- embark on an expedition to colonize a distant planet. When they uncover disturbing secrets about the mission, they defy their training and begin to explore their most primitive natures. As life on the ship descends into chaos, they soon become consumed by fear, lust and an insatiable hunger for power.",en,US
Spiral: From the Book of Saw,2021,"Horror, Mystery",5.943,93,Darren Lynn Bousman,Pete Goldfinger,"Chris Rock, Samuel L. Jackson, Max Minghella","Working in the shadow of an esteemed police veteran, brash Detective Ezekiel “Zeke” Banks and his rookie partner take charge of a grisly investigation into murders that are eerily reminiscent of the city’s gruesome past.  Unwittingly entrapped in a deepening mystery, Zeke finds himself at the center of the killer’s morbid game.",en,US
13 Minutes,2021,"Action, Drama, Thriller",5.9,109,Lindsay Gossling,,"Trace Adkins, Yancey Arias, Thora Birch","As a new day begins in the small American town of Minninnewah, the residents start their day as ordinary as the next. Mother Nature, however, has other plans for them. Inhabitants have just 13 minutes to seek shelter before the largest tornado on record ravages the town, leaving them struggling to protect their loved ones and fighting for their lives. Left to deal with the aftermath, four families must overcome their differences and find strength in each other in order to survive.",en,US
Midnight in the Switchgrass,2021,"Crime, Mystery, Thriller, Action",5.9,99,Randall Emmett,,"Megan Fox, Bruce Willis, Emile Hirsch","FBI Agent Karl Helter and his partner Rebecca Lombardo are very close to busting a sex-trafficking ring. When they realize their investigation has crossed the path of a brutal serial killer, they team up with a FDLE agent to put an end to the infamous 'Truck Stop Killer'.",en,US
Awake,2021,"Drama, Science Fiction, Thriller",5.873,96,Mark Raso,Joseph Raso,"Gina Rodriguez, Ariana Greenblatt, Lucius Hoyos","After a sudden global event wipes out all electronics and takes away humankind’s ability to sleep, chaos quickly begins to consume the world. Only Jill, an ex-soldier with a troubled past, may hold the key to a cure in the form of her own daughter. The question is, can Jill safely deliver her daughter and save the world before she herself loses her mind.",en,US
No One Gets Out Alive,2021,"Horror, Mystery, Thriller",5.856,85,Santiago Menghini,,"Cristina Rodlo, Marc Menchaca, David Figlioli",An immigrant in search of the American dream is forced to take a room in a boarding house and soon finds herself in a nightmare from which she can't escape.,en,US
SAS: Red Notice,2021,"Drama, Action, Thriller",5.813,120,Magnus Martens,,"Sam Heughan, Ruby Rose, Andy Serkis","An off-duty SAS soldier, Tom Buckingham, must thwart a terror attack on a train running through the Channel Tunnel. As the action escalates on the train, events transpire in the corridors of power that may make the difference as to whether Buckingham and the civilian passengers make it out of the tunnel alive.",en,"US, CH, GB"
Mother/Android,2021,"Science Fiction, Thriller",5.8,111,Mattson Tomlin,Mattson Tomlin,"Chloë Grace Moretz, Algee Smith, Raúl Castillo","Georgia and her boyfriend Sam go on a treacherous journey to escape their country, which is caught in an unexpected war with artificial intelligence. Days away from the arrival of their first child, the couple must face No Man’s Land—a stronghold of the android uprising—in hopes of reaching safety before giving birth.",en,US
Coming Home in the Dark,2021,"Mystery, Thriller, Horror, Crime",5.713,93,James Ashcroft,Eli Kent,"Daniel Gillies, Erik Thomson, Miriama McDowell",A school teacher is forced to confront a brutal act from his past when a pair of ruthless drifters takes him and his family on a nightmare road-trip.,en,NZ
Things Heard & Seen,2021,Horror,5.7,121,Shari Springer Berman,,"Amanda Seyfried, James Norton, Natalia Dyer","Catherine Clare reluctantly trades life in 1980 Manhattan for a remote home in the tiny hamlet of Chosen, New York, after her husband George lands a job teaching art history at a small Hudson Valley college. Even as she does her best to transform the old dairy farm into a place where young daughter Franny will be happy, Catherine increasingly finds herself isolated and alone. She soon comes to sense a sinister darkness lurking both in the walls of the ramshackle property—and in her marriage to George.",en,US
Fortress,2021,"Action, Thriller, Crime",5.7,100,James Cullen Bressack,Alan Horsnail,"Jesse Metcalfe, Bruce Willis, Chad Michael Murray","The story revolves around a top-secret resort for retired U.S. intelligence officers. A group of criminals led by Balzary breach the compound, hellbent on revenge on Robert, forcing the retired officer and his son to save the day.",en,US
The Resort,2021,Horror,5.6,75,Taylor Chien,Taylor Chien,"Bianca Haase, Brock O'Hurn, Michael Vlamis","Four friends head to Hawaii to investigate reports of a haunting at an abandoned resort in hopes of finding the infamous Half-Faced Girl. When they arrive, they soon learn you should be careful what you wish for.",en,US
Bliss,2021,"Science Fiction, Romance, Drama",5.5,103,Mike Cahill,,"Owen Wilson, Salma Hayek Pinault, Nesta Cooper","A mind-bending love story following Greg who, after recently being divorced and then fired, meets the mysterious Isabel, a woman living on the streets and convinced that the polluted, broken world around them is just a computer simulation. Doubtful at first, Greg eventually discovers there may be some truth to Isabel’s wild conspiracy.",en,US
Meteor,2021,"Science Fiction, Thriller",5.5,84,Brett Bentman,Brett Bentman,"Robert Keith, Olivia Nash, Thom Hallum","After a meteor collides into Earth, a lonely rancher and a lost young girl are on the run from vicious mercenaries.",en,US
The Misfits,2021,"Action, Thriller",5.463,94,Renny Harlin,Kurt Wimmer,"Pierce Brosnan, Tim Roth, Nick Cannon","After being recruited by a group of unconventional thieves, renowned criminal Richard Pace finds himself caught up in an elaborate gold heist that promises to have far-reaching implications on his life and the lives of countless others.",en,US
Die in a Gunfight,2021,"Action, Comedy, Romance",5.4,92,Collin Schiffli,,"Diego Boneta, Alexandra Daddario, Travis Fimmel","Mary and Ben are the star-crossed black sheep of two powerful families engaged in a centuries-long feud. When the pair reignite a romance after many years apart, their forbidden love draws a motley assortment of schemers and killers into their orbit, and as fists and bullets fly, it becomes clear that violent delights will have violent ends.",en,US
John and the Hole,2021,"Drama, Thriller, Horror",5.4,103,Pascual Sisto,,"Charlie Shotwell, Taissa Farmiga, Jennifer Ehle","While exploring the neighboring woods, 13-year-old John discovers an unfinished bunker — a deep hole in the ground. Seemingly without provocation, he drugs his affluent parents and older sister and drags their unconscious bodies into the bunker, where he holds them captive. As they anxiously wait for John to free them from the hole, the boy returns home, where he can finally do what he wants.",en,US
Vanquish,2021,"Action, Adventure, Thriller",5.3,96,George Gallo,George Gallo,"Ruby Rose, Morgan Freeman, Patrick Muldoon","Victoria is a young mother trying to put her dark past as a Russian drug courier behind her, but retired cop Damon forces Victoria to do his bidding by holding her daughter hostage. Now, Victoria must use guns, guts and a motorcycle to take out a series of violent gangsters—or she may never see her child again.",en,US
Apex,2021,"Action, Thriller, Science Fiction",5.2,108,Edward Drake,,"Neal McDonough, Bruce Willis, Corey Large","Ex-cop Thomas Malone is serving a life sentence for a crime he didn’t commit. He is offered a chance at freedom if he can survive a deadly game of Apex, in which six hunters pay for the pleasure of hunting another human on a remote island. He accepts, and once he arrives, all hell breaks loose.",en,US
Risen,2021,"Science Fiction, Drama, Thriller",5.1,109,Eddie Arya,Eddie Arya,"Nicole Schalmo, Jack Campbell, Caroline McQuade","Disaster unfolds when a meteor strikes a small town, turning the environment uninhabitable and killing everything in the surrounding area. Exobiologist Lauren Stone is called to find answers to the unearthly event. As she begins to uncover the truth, imminent danger awakens and it becomes a race against time to save mankind.",en,"AU, CA, US, JP"
Deadly Illusions,2021,"Thriller, Drama",5.0,114,Anna Elizabeth James,Anna Elizabeth James,"Kristin Davis, Dermot Mulroney, Shanola Hampton","A bestselling female novelist, suffering from writer's block, hires an innocent young woman to watch over her twin children. As the novelist dangerously indulges in her new best seller, the line between the life she's writing and the one she's living becomes blurred.",en,US
Prisoners of the Ghostland,2021,"Action, Fantasy, Horror, Thriller",5.0,103,Sion Sono,Aaron Hendry,"Nicolas Cage, Sofia Boutella, Nick Cassavetes","In the treacherous frontier city of Samurai Town, a ruthless bank robber is sprung from jail by wealthy warlord The Governor, whose adopted granddaughter Bernice has gone missing. The Governor offers the prisoner his freedom in exchange for retrieving the runaway. Strapped into a leather suit that will self-destruct within five days, the bandit sets off on a journey to find the young woman—and his own path to redemption.",en,US
Settlers,2021,"Science Fiction, Thriller, Drama",4.938,104,Wyatt Rockefeller,Wyatt Rockefeller,"Sofia Boutella, Ismael Cruz Cordova, Brooklynn Prince","Remmy and her parents, refugees from Earth, have found peace on the Martian outskirts until strangers appear in the hills beyond their farm. Told as a triptych, the film follows Remmy as she struggles to survive in an uneasy landscape.",en,GB
Doors,2021,Science Fiction,4.9,84,Saman Kesh,Saman Kesh,"Josh Peck, Wilson Bethel, Lina Esco","Without warning, millions of mysterious alien “doors” suddenly appear around the globe. In a rush to determine the reason for their arrival, mankind must work together to understand the purpose of these cosmic anomalies.",en,US
Home Sweet Home Alone,2021,"Family, Comedy, Crime",4.891,93,Dan Mazer,,"Ellie Kemper, Rob Delaney, Archie Yates","After being left at home by himself for the holidays, 10-year-old Max Mercer must work to defend his home from a married couple who tries to steal back a valuable heirloom.",en,US
Survive,2021,"Adventure, Thriller",2.7,71,Ben Carland,Ben Carland,"Taylor Girard, Jennifer Trudrung, Riya May Atwood","In a near-future post apocalyptic world, a father must cross a dangerous landscape to reunite with his wife and daughter.",en,US
