Title,Year,Genres,Rating,Runtime,Director,Writer,Actors,Plot,Language,Country
Delivery Man,2013,Comedy,6.2,105,Ken Scott,,"Vince Vaughn, Cobie Smulders, Chris Pratt",An affable underachiever finds out he's fathered 533 children through anonymous donations to a fertility clinic 20 years ago. Now he must decide whether or not to come forward when 142 of them file a lawsuit to reveal his identity.,en,US
47 Ronin,2013,"Drama, Action, Fantasy",6.187,119,Carl Rinsch,,"Keanu Reeves, Hiroyuki Sanada, Ko Shibasaki","Kai—an outcast—joins Oishi, the leader of 47 outcast samurai.  Together they seek vengeance upon the treacherous overlord who killed their master and banished their kind.  To restore honour to their homeland, the warriors embark upon a quest that challenges them with a series of trials that would destroy ordinary warriors.",en,US
Hummingbird,2013,"Action, Thriller",6.166,100,Steven Knight,,"Jason Statham, Agata Buzek, Vicky McClure","Homeless and on the run from a military court martial, a damaged ex-special forces soldier navigating London's criminal underworld seizes an opportunity to assume another man's identity, transforming into an avenging angel in the process.",en,"GB, US"
The Art of the Steal,2013,"Comedy, Crime",6.164,90,Jonathan Sobol,,"Kurt Russell, Matt Dillon, Jay Baruchel","Crunch Calhoun, a third-rate motorcycle daredevil and part-time art thief, teams up with his snaky brother to steal one of the most valuable books in the world. But it's not just about the book for Crunch — he's keen to rewrite some chapters of his own past as well.",en,"CA, US"
Dead Man Down,2013,"Thriller, Action, Crime, Drama",6.157,118,Niels Arden Oplev,,"Colin Farrell, Noomi Rapace, Terrence Howard","In New York City, a crime lord's right-hand man is seduced by a woman seeking retribution.",en,US
Jobs,2013,"Drama, History",6.125,129,Joshua Michael Stern,Matt Whiteley,"Ashton Kutcher, Josh Gad, Lukas Haas",The story of Steve Jobs' ascension from college dropout into one of the most revered creative entrepreneurs of the 20th century.,en,US
Jackass Presents: Bad Grandpa,2013,Comedy,6.113,92,Jeff Tremaine,,"Johnny Knoxville, Jackson Nicoll, Georgina Cates","86-year-old Irving Zisman is on a journey across America with the most unlikely companion: his 8 year-old grandson, Billy.",en,US
Snitch,2013,"Thriller, Drama, Action",6.109,112,Ric Roman Waugh,,"Dwayne Johnson, Barry Pepper, Susan Sarandon","Construction company owner John Matthews learns that his estranged son, Jason, has been arrested for drug trafficking. Facing an unjust prison sentence for a first time offender courtesy of mandatory minimum sentence laws, Jason has nothing to offer for leniency in good conscience. Desperately, John convinces the DEA and the opportunistic DA Joanne Keeghan to let him go undercover to help make arrests big enough to free his son in return. With the unwitting help of an ex-con employee, John enters the narcotics underworld where every move could be his last in an operation that will demand all his resources, wits and courage to survive.",en,US
Blood Ties,2013,"Thriller, Crime, Drama",6.107,128,Guillaume Canet,,"Clive Owen, Billy Crudup, Marion Cotillard","Two brothers, on either side of the law, face off over organized crime in Brooklyn during the 1970s.",en,FR
The Zero Theorem,2013,"Drama, Fantasy, Science Fiction",6.104,107,Terry Gilliam,,"Christoph Waltz, David Thewlis, Mélanie Thierry","A computer hacker's goal to discover the reason for human existence continually finds his work interrupted thanks to the Management; this time, they send a teenager and lusty love interest to distract him.",en,GB
Grudge Match,2013,Comedy,6.1,113,Peter Segal,,"Robert De Niro, Sylvester Stallone, Alan Arkin",A pair of aging boxing rivals are coaxed out of retirement to fight one final bout -- 30 years after their last match.,en,US
The Last Stand,2013,"Action, Crime, Thriller",6.1,107,Kim Jee-woon,Jeffrey Nachmanoff,"Arnold Schwarzenegger, Johnny Knoxville, Jaimie Alexander","Ray Owens is sheriff of the quiet US border town of Sommerton Junction after leaving the LAPD following a bungled operation. Following his escape from the FBI, a notorious drug baron, his gang, and a hostage are heading toward Sommerton Junction where the police are preparing to make a last stand to intercept them before they cross the border. Owens is reluctant to become involved but ultimately joins in with the law enforcement efforts",en,US
Haunter,2013,"Horror, Mystery, Thriller",6.1,97,Vincenzo Natali,Brian King,"Abigail Breslin, Stephen McHattie, David Hewlett",A teenager is stuck in a time loop that is not quite the same each time. She must uncover the truth but her actions have consequences for herself and others.,en,"CA, US"
Palo Alto,2013,Drama,6.1,100,Gia Coppola,,"Emma Roberts, Jack Kilmer, Nat Wolff",A lack of parental guidance encourages teens in an affluent California town to rebel with substance abuse and casual sex.,en,US
In Secret,2013,"Drama, Thriller, Crime, Romance",6.1,101,Charlie Stratton,,"Elizabeth Olsen, Tom Felton, Jessica Lange","In 1860s Paris, a young woman, Therese, is trapped in a loveless marriage to the sickly Camille by her domineering aunt, Madame Raquin. She spends her days behind the counter of a small shop and her evenings watching Madame play dominos with an eclectic group. After she meets her husband’s alluring friend, Laurent, she embarks on an illicit affair that leads to tragic consequences. Based on Emile Zola’s novel, Thérèse Raquin.",en,US
Man of Tai Chi,2013,"Action, Drama",6.1,106,Keanu Reeves,Michael G. Cooney,"Tiger Chen Hu, Keanu Reeves, Karen Mok Man-Wai","In Beijing, a young martial artist's skill places him in position to experience opportunities and sacrifices.",en,"CN, US, HK"
The Lone Ranger,2013,"Action, Adventure, Western",6.1,149,Gore Verbinski,,"Johnny Depp, Armie Hammer, Tom Wilkinson","The Texas Rangers chase down a gang of outlaws led by Butch Cavendish, but the gang ambushes the Rangers, seemingly killing them all. One survivor is found, however, by an American Indian named Tonto, who nurses him back to health. The Ranger, donning a mask and riding a white stallion named Silver, teams up with Tonto to bring the unscrupulous gang and others of that ilk to justice.",en,US
Hansel & Gretel: Witch Hunters,2013,"Fantasy, Horror, Action",6.1,88,Tommy Wirkola,Tommy Wirkola,"Jeremy Renner, Gemma Arterton, Famke Janssen","After getting a taste for blood as children, Hansel and Gretel have become the ultimate vigilantes, hell-bent on retribution. Now, unbeknownst to them, Hansel and Gretel have become the hunted, and must face an evil far greater than witches... their past.",en,BR
Grown Ups 2,2013,Comedy,6.1,101,Dennis Dugan,Tim Herlihy,"Adam Sandler, Kevin James, Chris Rock","Lenny has relocated his family back to the small town where he and his friends grew up. This time around, the grown ups are the ones learning lessons from their kids on a day notoriously full of surprises—the last day of school.",en,US
Anchorman 2: The Legend Continues,2013,Comedy,6.1,119,Adam McKay,,"Will Ferrell, Steve Carell, Paul Rudd","With the 70s behind him, San Diego's top rated newsman, Ron Burgundy, returns to take New York's first 24-hour news channel by storm.",en,US
Sweetwater,2013,"Western, Thriller",6.06,96,Logan Miller,,"January Jones, Jason Isaacs, Ed Harris","In the late 1800s, a fanatical religious leader, a renegade Sheriff, and a former prostitute collide in a blood triangle on the rugged plains of the New Mexico Territory.",en,US
Percy Jackson: Sea of Monsters,2013,"Adventure, Family, Fantasy",6.028,106,Thor Freudenthal,,"Logan Lerman, Brandon T. Jackson, Alexandra Daddario","In their quest to confront the ultimate evil, Percy and his friends battle swarms of mythical creatures to find the mythical Golden Fleece and to stop an ancient evil from rising.",en,US
Lovelace,2013,Drama,6.02,92,Rob Epstein,Andy Bellin,"Amanda Seyfried, Sharon Stone, Robert Patrick","Story of Linda Lovelace, who is used and abused by the porn industry at the behest of her coercive husband, before taking control of her life.",en,US
Don Jon,2013,"Romance, Comedy, Drama",6.013,90,Joseph Gordon-Levitt,Joseph Gordon-Levitt,"Joseph Gordon-Levitt, Scarlett Johansson, Julianne Moore","A New Jersey guy dedicated to his family, friends, and church, develops unrealistic expectations from watching porn and works to find happiness and intimacy with his potential true love.",en,US
Beautiful Creatures,2013,"Fantasy, Drama, Romance",6.0,124,Richard LaGravenese,,"Alden Ehrenreich, Alice Englert, Jeremy Irons","Ethan Wate just wants to get to know Lena Duchannes better, but unbeknownst to him, Lena has strange powers.  As Lena's 16th birthday approaches she might decide her fate, to be good or evil.  A choice which will impact her relationship forever.",en,US
The Fifth Estate,2013,"Drama, Thriller",6.0,128,Bill Condon,,"Benedict Cumberbatch, Daniel Brühl, Anthony Mackie","A look at the relationship between WikiLeaks founder Julian Assange and his early supporter and eventual colleague Daniel Domscheit-Berg, and how the website's growth and influence led to an irreparable rift between the two friends.",en,US
I'm in Love with a Church Girl,2013,"Drama, Romance",6.0,118,Steve Race,Galley Molina,"Ja Rule, Adrienne Bailon-Houghton, Stephen Baldwin","Miles Montego has it all - cars, boats, good looks, mansion, money, women, but more importantly, he has a past.",en,US
Carrie,2013,"Drama, Horror",6.0,100,Kimberly Peirce,,"Chloë Grace Moretz, Julianne Moore, Gabriella Wilde","A contemporary take on the horror classic about an awkward, telekinetic teenage girl, whose lonely life is dominated by relentless bullying at school and an oppressive religious fanatic mother at home. When her tormentors pull a humiliating prank at the senior prom, she unleashes a horrifying chaos on everyone, leaving nothing but destruction in her wake.",en,US
Would You Rather,2013,"Thriller, Horror",5.965,93,David Guy Levy,,"Brittany Snow, Jeffrey Combs, Jonny Coyne","Desperate to help her ailing brother, a young woman agrees to compete in a deadly game of ""Would You Rather"" hosted by a sadistic aristocrat.",en,US
The Sacrament,2013,"Horror, Thriller",5.962,99,Ti West,Ti West,"Joe Swanberg, AJ Bowen, Kentucker Audley","Two journalists set out to document their friend's journey to reunite with his estranged sister. They track her to an undisclosed location where they are welcomed into the remote world of ""Eden Parish,"" a self-sustained rural utopia composed of nearly two hundred members and overseen by a mysterious leader known only as ""Father."" It quickly becomes evident to the newcomers that this paradise may not be as it seems. Eden Parish harbors a twisted secret. What started as just another documentary shoot soon becomes a fight for survival.",en,US
Open Grave,2013,"Horror, Thriller, Mystery",5.959,102,Gonzalo López-Gallego,Eddie Borey,"Sharlto Copley, Joseph Morgan, Thomas Kretschmann","A man awakes-- without memory -- in a pit full of bodies and must figure out if the people who rescued him are the killers, or if he is the murderer.",en,US
Broken City,2013,"Thriller, Crime, Drama",5.9,109,Allen Hughes,Brian Tucker,"Mark Wahlberg, Russell Crowe, Catherine Zeta-Jones","In a broken city rife with injustice, ex-cop Billy Taggart seeks redemption and revenge after being double-crossed and then framed by its most powerful figure, the mayor. Billy's relentless pursuit of justice, matched only by his streetwise toughness, makes him an unstoppable force - and the mayor's worst nightmare.",en,US
The Dyatlov Pass Incident,2013,"Thriller, Mystery",5.9,100,Renny Harlin,Vikram Weet,"Holly Goss, Matt Stokoe, Luke Albright","In February of 1959, nine Russian hikers ventured into a remote area of the Ural Mountains. Two weeks later, all of them were found dead. What happened is a mystery that has baffled investigators and researchers for decades. It has become known as the Dyatlov Pass Incident.  When five ambitious American college students are issued a grant to return to the site of the original events, they gear up with the belief that they can uncover and document the truth of what happened to the supposedly experienced hikers. But what they find is more shocking than anything they could have imagined. Retracing the steps of the Russians' ill-fated journey, the students are plagued by strange and increasingly terrifying phenomena that suggest that in spite of the desolate surroundings, they are not alone. The forces at work in the Dyatlov Pass Incident have been waiting for them.",en,"US, GB"
Oz the Great and Powerful,2013,"Fantasy, Adventure, Family",5.9,130,Sam Raimi,,"James Franco, Mila Kunis, Rachel Weisz","Oscar Diggs, a small-time circus illusionist and con-artist, is whisked from Kansas to the Land of Oz where the inhabitants assume he's the great wizard of prophecy, there to save Oz from the clutches of evil.",en,US
Identity Thief,2013,"Comedy, Crime",5.9,111,Seth Gordon,,"Jason Bateman, Melissa McCarthy, Jon Favreau","When a mild-mannered businessman learns his identity has been stolen, he hits the road in an attempt to foil the thief -- a trip that puts him in the path of a deceptively harmless-looking woman.",en,US
Assault on Wall Street,2013,"Drama, Thriller, Action",5.9,99,Uwe Boll,Uwe Boll,"Dominic Purcell, Erin Karpluk, Edward Furlong","Jim is an average New Yorker living a peaceful life with a well paying job and a loving family. Suddenly, everything changes when the economy crashes causing Jim to lose everything. Filled with anger and rage, Jim snaps and goes to extreme lengths to seek revenge for the life taken from him.",en,"CA, US"
Oldboy,2013,"Drama, Thriller, Mystery, Action",5.9,104,Spike Lee,,"Josh Brolin, Elizabeth Olsen, Sharlto Copley",A man has only three and a half days and limited resources to discover why he was imprisoned in a nondescript room for 20 years without any explanation.,en,US
Planes,2013,"Animation, Family, Adventure, Comedy",5.9,91,Klay Hall,,"Dane Cook, Carlos Alazraqui, Val Kilmer","Dusty is a cropdusting plane who dreams of competing in a famous aerial race. The problem? He is hopelessly afraid of heights. With the support of his mentor Skipper and a host of new friends, Dusty sets off to make his dreams come true.",en,US
Curse of Chucky,2013,"Horror, Thriller",5.9,97,Don Mancini,Don Mancini,"Fiona Dourif, Brad Dourif, Danielle Bisutti","After her mother's mysterious death, Nica begins to suspect that the talking, red-haired doll her visiting niece has been playing with may be the key to the mounting bloodshed and chaos.",en,US
The Machine,2013,"Science Fiction, Thriller",5.9,92,Caradog W. James,Caradog W. James,"Caity Lotz, Toby Stephens, Denis Lawson","Already deep into a second Cold War, Britain’s Ministry of Defense seeks a game-changing weapon. Programmer Vincent McCarthy unwittingly provides an answer in The Machine, a super-strong human cyborg. When a programming bug causes the prototype to decimate his lab, McCarthy takes his obsessive efforts underground, far away from inquisitive eyes.",en,"GB, US"
A Haunted House,2013,"Comedy, Horror",5.9,86,Michael Tiddes,Marlon Wayans,"Marlon Wayans, Essence Atkins, Nick Swardson","Malcolm and Kisha move into their dream home, but soon learn a demon also resides there. When Kisha becomes possessed, Malcolm - determined to keep his sex life on track - turns to a priest, a psychic, and a team of ghost-busters for help in this spoof of all the ""found-footage/documentary style"" films released in recent years.",en,US
Free Birds,2013,"Animation, Comedy, Family",5.878,91,Jimmy Hayward,,"Owen Wilson, Woody Harrelson, Amy Poehler",Two turkeys from opposite sides of the tracks must put aside their differences and team up to travel back in time to change the course of history—and get turkey off the holiday menu for good.,en,US
The Big Wedding,2013,Comedy,5.86,90,Justin Zackham,,"Robert De Niro, Diane Keaton, Ben Barnes","To the amusement of their adult children and friends, long-divorced couple Don and Ellie Griffin are forced to play the happy couple for the sake of their adopted son's wedding after his ultra conservative Catholic biological mother unexpectedly decides to fly halfway across the world to attend. With all of the wedding guests looking on, the Griffins are hilariously forced to confront their past, present and future - and hopefully avoid killing each other in the process.",en,US
Death Race: Inferno,2013,"Action, Science Fiction, Thriller",5.834,104,Roel Reiné,,"Luke Goss, Ving Rhames, Danny Trejo","Carl Lucas / Frankenstein has won four of his races and needs to win one more to win his freedom. Before his final race, Lucas and his team, car and all, are transferred to another prison where they will compete in a Death Race in the desert. Also, at the same time, Ceaser runs into a marketer who wants to franchise the Death Race program.",en,US
R.I.P.D.,2013,"Fantasy, Action, Comedy",5.83,96,Robert Schwentke,,"Jeff Bridges, Ryan Reynolds, Kevin Bacon",A recently slain cop joins a team of undead police officers working for the Rest in Peace Department and tries to find the man who murdered him.,en,US
21 & Over,2013,Comedy,5.829,93,Jon Lucas,,"Skylar Astin, Justin Chon, Miles Teller","Brilliant student Jeff Chang has the most important interview of his life tomorrow.  But today is still his birthday, what starts off as a casual celebration with friends evolves into a night of debauchery that risks to derail his life plan.",en,US
Only God Forgives,2013,"Drama, Thriller, Crime",5.8,90,Nicolas Winding Refn,Nicolas Winding Refn,"Ryan Gosling, Kristin Scott Thomas, Vithaya Pansringarm","Julian, who runs a Thai boxing club as a front organization for his family's drug smuggling operation, is forced by his mother Crystal to find and kill the individual responsible for his brother's recent death.",en,"DK, US"
Jack the Giant Slayer,2013,"Fantasy, Action, Adventure, Drama",5.8,114,Bryan Singer,,"Nicholas Hoult, Eleanor Tomlinson, Ewan McGregor","The story of an ancient war that is reignited when a young farmhand unwittingly opens a gateway between our world and a fearsome race of giants. Unleashed on the Earth for the first time in centuries, the giants strive to reclaim the land they once lost, forcing the young man, Jack into the battle of his life to stop them. Fighting for a kingdom, its people, and the love of a brave princess, he comes face to face with the unstoppable warriors he thought only existed in legend–and gets the chance to become a legend himself.",en,US
The Haunting in Connecticut 2: Ghosts of Georgia,2013,"Horror, Drama, Thriller",5.8,101,Tom Elkins,,"Chad Michael Murray, Katee Sackhoff, Abigail Spencer","A young family moves into a historic home in Georgia, only to learn they are not the house's only inhabitants. Soon they find themselves in the presence of a secret rising from underground and threatening to bring down anyone in its path.",en,US
Very Good Girls,2013,Drama,5.8,91,Naomi Foner,Naomi Foner,"Dakota Fanning, Elizabeth Olsen, Boyd Holbrook","Two New York City girls make a pact to lose their virginity during their first summer out of high school. When they both fall for the same street artist, the friends find their connection tested for the first time.",en,US
The To Do List,2013,"Comedy, Romance",5.782,104,Maggie Carey,,"Aubrey Plaza, Johnny Simmons, Bill Hader","Feeling pressured to become more sexually experienced before she goes to college, Brandy Klark makes a list of things to accomplish before hitting campus in the fall.",en,US
Life of Crime,2013,"Comedy, Crime",5.729,94,Daniel Schechter,,"Jennifer Aniston, John Hawkes, Yasiin Bey",Two common criminals get more than they bargained for after kidnapping the wife of a corrupt real-estate developer who shows no interest in paying the $1 million dollar ransom for her safe return.,en,US
Paranoia,2013,"Drama, Thriller",5.724,106,Robert Luketic,,"Liam Hemsworth, Harrison Ford, Gary Oldman","An entry-level employee at a powerful corporation finds himself occupying a corner office, but at a dangerous price—he must spy on his boss's old mentor to secure for him a multi-billion dollar advantage.",en,"FR, IN, US"
The Incredible Burt Wonderstone,2013,Comedy,5.7,100,Don Scardino,,"Steve Carell, Steve Buscemi, Olivia Wilde","After breaking up with his longtime stage partner, a famous but jaded Vegas magician fights for relevance when a new, ""hip"" street magician appears on the scene.",en,US
Penthouse North,2013,"Thriller, Drama",5.7,85,Joseph Ruben,,"Michael Keaton, Michelle Monaghan, Andrew W. Walker","A reclusive, blind photojournalist lives quietly in a New York penthouse with her boyfriend, until a smooth but sadistic criminal looking for a hidden fortune enters her life.",en,US
The Green Inferno,2013,"Adventure, Horror",5.7,100,Eli Roth,,"Lorenza Izzo, Ariel Levy, Sky Ferreira","A group of student activists travel from New York City to the Amazon to save the rainforest.  However, once they arrive in this vast green landscape, they soon discover that they are not alone… and that no good deed goes unpunished.",en,"CA, US"
Bounty Killer,2013,"Action, Science Fiction",5.7,93,Henry Saine,Henry Saine,"Christian Pitre, Mindy Robinson, Kristanna Loken","It’s been 20 years since the corporations took over the world’s governments. Their thirst for power and profits led to the Corporate Wars, a fierce global battle that laid waste to society as we know it. Born from the ash, the Council of Nine rose as a new law and order for this dark age. To avenge the corporations’ reckless destruction, the Council issues death warrants for all white collar criminals. Their hunters—the bounty killer. From amateur savage to graceful assassin, the bounty killers now compete for body count, fame and a fat stack of cash. They’re ending the plague of corporate greed and providing the survivors of the apocalypse with retribution. These are the new heroes. This is the age of the BOUNTY KILLER.",en,US
The Smurfs 2,2013,"Fantasy, Family, Comedy, Animation",5.7,105,Raja Gosnell,,"Hank Azaria, Neil Patrick Harris, Jayma Mays","The evil wizard Gargamel creates a couple of mischievous Smurf-like creatures called the Naughties that he hopes will let him harness the all-powerful, magical Smurf-essence. But when he discovers that only a real Smurf can give him what he wants, and only a secret spell that Smurfette knows can turn the Naughties into real Smurfs, Gargamel kidnaps Smurfette and brings her to Paris, where he has been winning the adoration of millions as the world¹s greatest sorcerer. It's up to Papa, Clumsy, Grouchy, and Vanity to return to our world, reunite with their human friends Patrick and Grace Winslow, and rescue her! Will Smurfette, who has always felt different from the other Smurfs, find a new connection with the Naughties Vexy and Hackus or will the Smurfs convince her that their love for her is True Blue?",en,US
Pawn Shop Chronicles,2013,"Action, Comedy",5.7,107,Wayne Kramer,Adam Minarovich,"Paul Walker, Elijah Wood, Norman Reedus","The stories of a missing wife, a couple of meth heads and an Elvis impersonator are connected by the items found in a small town's pawn shop.",en,US
Runner Runner,2013,"Crime, Thriller, Drama",5.642,88,Brad Furman,Brian Koppelman,"Justin Timberlake, Ben Affleck, Gemma Arterton","When a poor college student who cracks an online poker game goes bust, he arranges a face-to-face with the man he thinks cheated him, a sly offshore entrepreneur.",en,US
G.I. Joe: Retaliation,2013,"Action, Science Fiction, Adventure",5.629,110,Jon M. Chu,Paul Wernick,"Dwayne Johnson, Bruce Willis, Jonathan Pryce","Framed for crimes against the country, the G.I. Joe team is terminated by Presidential order. This forces the G.I. Joes into not only fighting their mortal enemy Cobra; they are forced to contend with threats from within the government that jeopardize their very existence.",en,US
The Adventurer: The Curse of the Midas Box,2013,"Fantasy, Adventure, Family",5.6,99,Jonathan Newman,Christian Taylor,"Aneurin Barnard, Michael Sheen, Lena Headey","Seventeen-year-old Mariah Mundi's life is turned upside down when his parents vanish and his younger brother is kidnapped. Following a trail of clues to the darkly majestic Prince Regent Hotel, Mariah discovers a hidden realm of child-stealing monsters, deadly secrets and a long-lost artefact that grants limitless wealth—but also devastating supernatural power. With the fate of his world, and his family at stake, Mariah will risk everything to unravel the Curse of the Midas Box.",en,"US, GB"
Machete Kills,2013,"Action, Crime, Thriller",5.6,107,Robert Rodriguez,,"Danny Trejo, Mel Gibson, Demián Bichir",Ex-Federale agent Machete is recruited by the President of the United States for a mission which would be impossible for any mortal man – he must take down a madman revolutionary and an eccentric billionaire arms dealer who has hatched a plan to spread war and anarchy across the planet.,en,US
The Haunting of Helena,2013,"Horror, Thriller",5.574,87,Christian Bisceglia,Christian Bisceglia,"Harriet MacMasters-Green, Sabrina Jolie Perez, Jarreth J. Merz","After a divorce, Sophia moves to the south of Italy with her daughter, Helena. Their new home, an apartment within an austere building of the fascist age, is a chance for them to start a new life. But inside an old storage room hides a mysterious closet and a buried secret. After the loss of Helena’s first baby tooth, a chilling obsession begins and an apparition haunts her sleep...",en,US
The Look of Love,2013,"Comedy, Drama",5.572,105,Michael Winterbottom,,"Steve Coogan, Anna Friel, Imogen Poots","Paul Raymond builds a porn, entertainment and real estate empire that makes him the wealthiest man in Britain, but drugs doom his beloved daughter, Debbie.",en,"US, GB"
