Title,Year,Genres,Rating,Popularity,Runtime,Director,Writer,Actors,Keywords,Plot,Ratings Amount,Language,Country
The Phantom of the Opera at the Royal Albert Hall,2011,"Music, Drama, Romance",8.4,7.865,160,Laurence Connor,Richard Stilgoe,"Ramin Karimloo, Sierra Boggess, Hadley Fraser","opera, london, england, paris, france, love triangle, musical, based on play or musical, gothic horror, sabotage, disfigurement, chandelier, literary adaptation, ostracism, 1910s, ballet performance, filmed play, live theatre, romantic thriller, filmed theater, royal albert hall, romantic drama, 歌剧, 魅影","A disfigured musical genius, hidden away in the Paris Opera House, terrorises the opera company for the unwitting benefit of a young protégée whom he trains and loves. The 25th anniversary of the first public performance of Phantom of the Opera was celebrated with a grand performance at the Royal Albert Hall in London.",175,en,"US, GB"
The Help,2011,Drama,8.2,21.26,146,Tate Taylor,,"Emma Stone, Viola Davis, Bryce Dallas Howard","based on novel or book, mississippi river, exploitation, racial segregation, racism, writer, maid, moral courage, ressentiment, southern belle, racial issues, 1960s, newspaper columnist, desperate, cautionary, authoritarian","Aibileen Clark is a middle-aged African-American maid who has spent her life raising white children and has recently lost her only son; Minny Jackson is an African-American maid who has often offended her employers despite her family's struggles with money and her desperate need for jobs; and Eugenia ""Skeeter"" Phelan is a young white woman who has recently moved back home after graduating college to find out her childhood maid has mysteriously disappeared. These three stories intertwine to explain how life in Jackson, Mississippi revolves around ""the help""; yet they are always kept at a certain distance because of racial lines.",8424,en,US
Harry Potter and the Deathly Hallows: Part 2,2011,"Fantasy, Adventure",8.1,38.653,130,David Yates,,"Daniel Radcliffe, Emma Watson, Rupert Grint","witch, dying and death, saving the world, self sacrifice, magic, school of witchcraft, sorcerer, school, battle, ghost, wizard, teenage hero, mysterious, christmas, based on young adult novel, good versus evil","Harry, Ron and Hermione continue their quest to vanquish the evil Voldemort once and for all. Just as things begin to look hopeless for the young wizards, Harry discovers a trio of magical objects that endow him with powers to rival Voldemort's formidable skills.",20831,en,GB
Samsara,2011,Documentary,8.1,7.104,102,Ron Fricke,Mark Magidson,"Ni Made Megahadi Pratiwi, Puti Sri Candra Dewi, Putu Dinda Pratika","eating, around the world, balance, skyline, sunset, modern life, moonrise, poetic documentary","Filmed over nearly five years in twenty-five countries on five continents, and shot on seventy-millimetre film, Samsara transports us to the varied worlds of sacred grounds, disaster zones, industrial complexes, and natural wonders.",618,en,US
Kill Bill: The Whole Bloody Affair,2011,"Action, Crime, Thriller",8.0,7.522,247,Quentin Tarantino,Quentin Tarantino,"Uma Thurman, Lucy Liu, Vivica A. Fox","martial arts, kung fu, sword, martial law, revenge, wedding","An assassin is shot and almost killed by her ruthless employer, Bill, and other members of their assassination circle – but she lives to plot her vengeance.",1034,en,US
Warrior,2011,"Drama, Action",7.8,13.755,140,Gavin O'Connor,,"Joel Edgerton, Tom Hardy, Nick Nolte","bank, training, beating, mixed martial arts (mma), teacher, muscleman, combat, alcoholic, gym, exercise, pittsburgh, pennsylvania","The youngest son of an alcoholic former boxer returns home, where he's trained by his father for competition in a mixed martial arts tournament – a path that puts the fighter on a collision course with his estranged, older brother.",4626,en,US
Scooby-Doo! Legend of the Phantosaur,2011,"Animation, Mystery, Comedy, Family",7.79,7.344,75,Ethan Spaulding,Doug Langdale,"Frank Welker, Mindy Cohn, Grey DeLisle","talking dog, dinosaur","A relaxing spa getaway evolves into a prehistoric panic when Scooby-Doo and the gang uncover the horrible Phantosaur, an ancient legend come to life to protect hidden treasures buried in secret desert caves. But this scare-a-saurus doesn’t stand a chance with Shaggy around, after he finds his inner hero with the help of new-age hypnosis. Like, it makes him more brave and less hungry!",212,en,US
Drive,2011,"Drama, Thriller, Crime",7.6,14.167,100,Nicolas Winding Refn,,"Ryan Gosling, Carey Mulligan, Bryan Cranston","robbery, car mechanic, stuntman, beaten to death, revenge, organized crime, neighbor, police chase, los angeles, california, brutality, jacket, scorpion, toothpick, getaway driver, crime lord, stunt driver, existentialism, detached, neo-noir, vindictive, hammer, bold","Driver is a skilled Hollywood stuntman who moonlights as a getaway driver for criminals. Though he projects an icy exterior, lately he's been warming up to a pretty neighbor named Irene and her young son, Benicio. When Irene's husband gets out of jail, he enlists Driver's help in a million-dollar heist. The job goes horribly wrong, and Driver must risk his life to protect Irene and Benicio from the vengeful masterminds behind the robbery.",12754,en,US
Courageous,2011,Drama,7.573,7.665,129,Alex Kendrick,Stephen Kendrick,"Ken Bevel, Alex Kendrick, Kevin Downes","husband wife relationship, police, funeral, faith, prayer, christianity, pastor, father, family relationships, grief, gang, church, police officer, responsibility, fatherhood, death of daughter, integrity, resolution, father daughter relationship, death of a child, christian film, christian","Law enforcement officers Adam Mitchell, Nathan Hayes, and their partners stand up to the worst the streets have to offer with confidence and focus. Yet at the end of the day, they face a challenge that none of them are truly prepared to tackle: fatherhood. They know that God desires to turn the hearts of fathers to their children, but their children are beginning to drift further and further away from them. When tragedy hits home, these men are left wrestling with their hopes, their fears, their faith, and their fathering. Can a newfound urgency help these dads draw closer to God... and to their children?",372,en,US
Midnight in Paris,2011,"Fantasy, Comedy, Romance",7.5,14.475,94,Woody Allen,Woody Allen,"Owen Wilson, Rachel McAdams, Kathy Bates","paris, france, based on novel or book, detective, screenwriter, camping, diary, time travel, forbidden love, painter, midnight, nostalgia, past, versailles, sculpture, romance, magic realism, art history, back in time, wine drinking","While on a trip to Paris with his fiancée's family, a nostalgic screenwriter finds himself mysteriously going back to the 1920s every day at midnight.",7333,en,US
50 Greatest Harry Potter Moments,2011,Documentary,7.5,7.414,93,,,"Robbie Coltrane, Daniel Radcliffe, Emma Watson",,"To mark the release two weeks ago of the eighth and final movie in the series, Robbie Coltrane narrates a countdown of the movie franchise's best moments. From Harry's first meeting with Ron and Hermione aboard the Hogwarts Express through to magical mysteries.",130,en,GB
We Need to Talk About Kevin,2011,"Drama, Thriller",7.5,9.089,113,Lynne Ramsay,,"Tilda Swinton, John C. Reilly, Ezra Miller","based on novel or book, psychopath, mass murder, pregnancy, violence in schools, robin hood, connecticut, flashback, sociopath, murder, massacre, suburb, parenting, killing spree, prison visit, bow and arrow, school shooting, evil child, woman director, disturbed, angry, small community, desperate, teenage killer, mother son relationship, malicious, independent film, teenager, apathetic, audacious, baffled, bewildered","After her son Kevin commits a horrific act, troubled mother Eva reflects on her complicated relationship with her disturbed son as he grew from a toddler into a teenager.",2841,en,"GB, US"
Barbie: Princess Charm School,2011,"Family, Animation, Fantasy",7.5,11.868,79,Ezekiel Norton,Kati Rocky,"Diana Kaarina, Morwenna Banks, Nicole Oliver","princess, based on toy, school","Barbie stars as Blair Willows, a kind-hearted girl who is chosen to attend Princess Charm School: a magical, modern place that teaches dancing, how to have tea parties, and proper princess manners. Blair loves her classes -- as well as the helpful magical sprites and her new friends, Princesses Hadley and Isla. But when royal teacher Dame Devin discovers that Blair looks a lot like the kingdom’s missing princess, she turns Blair’s world upside down to stop her from claiming the throne. Now Blair, Hadley and Delancy must find an enchanted crown to prove Blair’s true identity in this charming and magical princess story!",822,en,US
One Day,2011,"Drama, Romance",7.422,12.54,107,Lone Scherfig,,"Anne Hathaway, Jim Sturgess, Tom Mison","based on novel or book, comedian, love, author, writer, divorce, friends in love, woman director, missed opportunity","A romantic comedy centered on Dexter and Emma, who first meet during their graduation in 1988 and proceed to keep in touch regularly. The film follows what they do on July 15 annually, usually doing something together.",4283,en,"US, GB"
The Girl with the Dragon Tattoo,2011,"Thriller, Crime, Mystery",7.4,19.326,158,David Fincher,Steven Zaillian,"Daniel Craig, Rooney Mara, Christopher Plummer","journalist, island, rape, hacker, based on novel or book, nazi, journalism, investigation, punk rock, scandinavia, stockholm, sweden, remake, antisocial personality disorder, disappearance, serial killer, hacking, sadist, biting, bible quote, dead cat, millennium, based on movie, mysterious, aggressive, abuse, grim, locked room mystery, dreary, tense, cruel","Disgraced journalist Mikael Blomkvist investigates the disappearance of a weary patriarch's niece from 40 years ago. He is aided by the pierced, tattooed, punk computer hacker named Lisbeth Salander. As they work together in the investigation, Blomkvist and Salander uncover immense corruption beyond anything they have ever imagined.",7059,en,US
Submarine,2011,"Drama, Comedy, Romance",7.374,7.126,97,Richard Ayoade,Richard Ayoade,"Noah Taylor, Paddy Considine, Craig Roberts","friendship, wales, beach, bullying, loss of virginity, coming of age, teenage girl, teenage protagonist, swansea, romantic, sarcastic","15-year-old deep-thinking Welsh schoolboy Oliver Tate struggles to initiate and maintain a relationship with Jordana, his devilish, dark-haired classmate at their Swansea high school. As his parents' marriage begins to fall apart, similar problems arise in his relationship with Jordana.",1468,en,GB
Rise of the Planet of the Apes,2011,"Thriller, Action, Drama, Science Fiction",7.331,19.886,105,Rupert Wyatt,,"Andy Serkis, James Franco, Freida Pinto","san francisco, california, solidarity, gorilla, intelligence, dystopia, zoo, alzheimer's disease, death of father, cage, anthropomorphism, golden gate bridge, disease, ape, orangutan, chimpanzee, medical research, primate, duringcreditsstinger, sign languages, virus, animal testing, contagion, father son relationship, animal human friendship, cgi-live action hybrid, violence against animals, meddling neighbor, medical trials, amused, exhilarated","A highly intelligent chimpanzee named Caesar has been living a peaceful suburban life ever since he was born. But when he gets taken to a cruel primate facility, Caesar decides to revolt against those who have harmed him.",12034,en,US
Source Code,2011,"Thriller, Science Fiction, Mystery",7.303,11.799,93,Duncan Jones,Ben Ripley,"Jake Gyllenhaal, Michelle Monaghan, Vera Farmiga","race against time, bomb, virtual reality, identity, investigation, bomber, suspicion, surrealism, time loop, soldier, helicopter pilot, augmented reality, action","When decorated soldier Captain Colter Stevens wakes up in the body of an unknown man, he discovers he's part of a mission to find the bomber of a Chicago commuter train.",8434,en,"US, CA"
War Horse,2011,"War, History, Adventure",7.3,9.222,146,Steven Spielberg,Richard Curtis,"Jeremy Irvine, Peter Mullan, Emily Watson","world war i, horse, farm life, execution, trapped, alcoholic, cavalry, plowing, artillery, candid, loving, depressing, compassionate","On the brink of the First World War, Albert's beloved horse Joey is sold to the Cavalry by his father. Against the backdrop of the Great War, Joey begins an odyssey full of danger, joy, and sorrow, and he transforms everyone he meets along the way. Meanwhile, Albert, unable to forget his equine friend, searches the battlefields of France to find Joey and bring him home.",3432,en,US
Weekend,2011,"Drama, Romance",7.3,7.309,96,Andrew Haigh,Andrew Haigh,"Tom Cullen, Chris New, Jonathan Race","gay club, one-night stand, nottingham, club, lgbt, autumn, gay theme, gay relationship, boys' love (bl)","After a drunken house party with his straight mates, Russell heads out to a gay club. Just before closing time he picks up Glen but what's expected to be just a one-night stand becomes something else, something special.",530,en,GB
"Crazy, Stupid, Love.",2011,"Comedy, Drama, Romance",7.3,18.234,118,Glenn Ficarra,,"Steve Carell, Ryan Gosling, Julianne Moore","friendship, soulmates, marriage crisis, midlife crisis, babysitter, womanizer, law school, los angeles, california, middle school, relationship, love affair, divorcee, teenage love","Cal Weaver is living the American dream. He has a good job, a beautiful house, great children and a beautiful wife, named Emily. Cal's seemingly perfect life unravels, however, when he learns that Emily has been unfaithful and wants a divorce. Over 40 and suddenly single, Cal is adrift in the fickle world of dating. Enter, Jacob Palmer, a self-styled player who takes Cal under his wing and teaches him how to be a hit with the ladies.",8641,en,US
Moneyball,2011,Drama,7.278,9.976,134,Bennett Miller,,"Brad Pitt, Jonah Hill, Philip Seymour Hoffman","underdog, california, sports, baseball, based on true story, oakland, california, job transfer, oakland athletics, franchise, talent manager, statistics, 2000s, major league baseball (mlb), inspirational","The story of Oakland Athletics general manager Billy Beane's successful attempt to put together a baseball team on a budget, by employing computer-generated analysis to draft his players.",5235,en,US
Jane Eyre,2011,"Drama, Romance",7.212,8.1,120,Cary Joji Fukunaga,,"Mia Wasikowska, Michael Fassbender, Jamie Bell","friendship, prayer, smoking, painting, man woman relationship, love, rural area, snow, memory, orphan, cruelty, free will, guardian, wedding ceremony, ward","After a bleak childhood, Jane Eyre goes out into the world to become a governess. As she lives happily in her new position at Thornfield Hall, she meet the dark, cold, and abrupt master of the house, Mr. Rochester. Jane and her employer grow close in friendship and she soon finds herself falling in love with him. Happiness seems to have found Jane at last, but could Mr. Rochester's terrible secret be about to destroy it forever?",1470,en,GB
The Lincoln Lawyer,2011,"Crime, Drama, Thriller",7.203,10.192,119,Brad Furman,,"Matthew McConaughey, Ryan Phillippe, William H. Macy","california, prostitute, based on novel or book, judge, attempted murder, video surveillance, jury, playboy, private investigator, lawyer, crime scene, motorcycle gang, courtroom, defense attorney, divorced father, uncover truth, courtroom drama, car driver, innocent in jail, murder of a prostitute, legal thriller, defense lawyer, attorney client privilege, high-profile client","Mick Haller is a charismatic defense attorney who does business out of his Lincoln Continental sedan. Mick spends most of his time defending petty crooks and other bottom-feeders, so it comes as quite a surprise when he lands the case of a lifetime: defending a Beverly Hills playboy who is accused of attempted murder. However, what Mick initially thinks is an open-and-shut case with a big monetary reward develops into something more sinister.",3313,en,US
Limitless,2011,"Thriller, Mystery, Science Fiction",7.2,12.758,105,Neil Burger,,"Bradley Cooper, Robert De Niro, Abbie Cornish","new york city, medicine, politician, iq, pill, stalking, superhuman, writer, drugs, threat, knowledge, nootropics, mind booster",The life of an unsuccessful writer is transformed by a top-secret 'smart drug' that allows him to use 100% of his brain and become a perfect version of himself. His enhanced abilities soon attract shadowy forces that threaten his new life.,10729,en,US
Hugo,2011,"Adventure, Drama, Family",7.2,9.73,126,Martin Scorsese,,"Asa Butterfield, Ben Kingsley, Chloë Grace Moretz","paris, france, based on novel or book, library, clock tower, key, movie business, clock, museum, train accident, montparnasse, steampunk, orphan, robot, hiding, filmmaking, security guard, leg brace, doberman, toy store, runaway train, railway station, guard dog, toy maker, mechanics, cinema history, mechanical toys, ticking clock, based on young adult novel, clockwork, train station, toy, stationmaster, clockmaker, mechanical dolls","Orphaned and alone except for an uncle, Hugo Cabret lives in the walls of a train station in 1930s Paris. Hugo's job is to oil and maintain the station's clocks, but to him, his more important task is to protect a broken automaton and notebook left to him by his late father. Accompanied by the goddaughter of an embittered toy merchant, Hugo embarks on a quest to solve the mystery of the automaton and find a place he can call home.",7253,en,US
A Better Life,2011,Drama,7.2,7.189,98,Chris Weitz,,"Demián Bichir, José Julián, Chelsea Rendon","immigrant, california, garden, truck, undocumented immigrant, gardener, stolen truck, 9/11",A gardener in East L.A. struggles to keep his son away from gangs and immigration agents while traveling across town to perform landscaping work for the city's wealthy landowners.,230,en,US
Melancholia,2011,"Drama, Science Fiction",7.2,7.423,130,Lars von Trier,,"Kirsten Dunst, Charlotte Gainsbourg, Kiefer Sutherland","depression, suicide, nihilism, wedding reception, wedding planner, surrealism, end of the world, wealth, mansion, power outage, destruction of planet, sister sister relationship","Justine and Michael are celebrating their marriage at a sumptuous party in the home of her sister Claire, and brother-in-law John. Despite Claire’s best efforts, the wedding is a fiasco, with family tensions mounting and relationships fraying. Meanwhile, a planet called Melancholia is heading directly towards Earth…",3537,en,DK
Batman: Year One,2011,"Action, Animation, Crime, Science Fiction, Drama, Thriller",7.2,7.209,64,Lauren Montgomery,,"Ben McKenzie, Bryan Cranston, Eliza Dushku","superhero, based on comic, vigilante, police corruption, based on graphic novel, origin of hero, masked vigilante, adult animation, police vigilantism, woman director, vigilantism",A wealthy playboy named Bruce Wayne and a Chicago cop named Jim Gordon both return to Gotham City where their lives unexpectedly intersect.,967,en,US
50/50,2011,"Comedy, Drama",7.2,7.594,100,Jonathan Levine,Will Reiser,"Joseph Gordon-Levitt, Seth Rogen, Anna Kendrick","friendship, parent child relationship, therapist, painter, cancer, psychologist, hospital, best friend, doctor, patient, doctor patient relationship, vomiting, chemotherapy","Inspired by a true story, a comedy centered on a 27-year-old guy who learns of his cancer diagnosis and his subsequent struggle to beat the disease.",3805,en,US
Sherlock Holmes: A Game of Shadows,2011,"Adventure, Action, Crime, Mystery",7.139,14.862,129,Guy Ritchie,,"Robert Downey Jr., Jude Law, Noomi Rapace","london, england, paris, france, detective inspector, steampunk, buddy, criminal mastermind, 19th century, sherlock holmes","There is a new criminal mastermind at large (Professor Moriarty) and not only is he Holmes’ intellectual equal, but his capacity for evil and lack of conscience may give him an advantage over the  detective.",10394,en,US
Phineas and Ferb The Movie: Across the 2nd Dimension,2011,"Animation, Comedy, Family, TV Movie, Science Fiction, Adventure, Action, Music",7.1,8.875,77,Robert Hughes,Jon Colton Barry,"Vincent Martella, Thomas Brodie-Sangster, Dee Bradley Baker","monster, sibling relationship, one-sided love, secret agent, mad scientist, alternate dimension, growing up, dating, super villain, pet owner reunion","Phineas and Ferb get trapped in an alternate dimension where the evil Doofenshmirtz rules the tri-state area. They must find a way back home with the help of their pet platypus named Perry, who they discover is a secret agent.",557,en,US
Dragons: Gift of the Night Fury,2011,"Animation, Comedy, Adventure, Family",7.1,7.727,22,Tom Owens,,"Jay Baruchel, Gerard Butler, Craig Ferguson","holiday, human animal relationship, vikings (norsemen), best friend, dragon, teenage hero, christmas, father son relationship, christmas special, dragon egg",Hiccup and Toothless go on an exciting adventure and discover an island of new dragons.,381,en,US
Mission: Impossible - Ghost Protocol,2011,"Action, Thriller, Adventure",7.094,22.471,133,Brad Bird,André Nemec,"Tom Cruise, Paula Patton, Simon Pegg","assassin, budapest, hungary, skyscraper, secret intelligence service, sandstorm, seattle, washington, satellite, mumbai (bombay), india, car crash, sequel, prison escape, dubai, billionaire, terrorism, disguise, bombing, jet, nuclear threat, undercover operation, moscow, russia, field agent, clandestine, analyst, nuclear submarine, kremlin, disavowed, based on tv series, nuclear launch codes, burj khalifa, scaling a building","Ethan Hunt and his team are racing against time to track down a dangerous terrorist named Hendricks, who has gained access to Russian nuclear launch codes and is planning a strike on the United States. An attempt to stop him ends in an explosion causing severe destruction to the Kremlin and the IMF to be implicated in the bombing, forcing the President to disavow them. No longer being aided by the government, Ethan and his team chase Hendricks around the globe, although they might still be too late to stop a disaster.",9989,en,US
Kung Fu Panda 2,2011,"Animation, Family, Comedy",7.038,23.489,91,Jennifer Yuh Nelson,Jonathan Aibel,"Jack Black, Angelina Jolie, Dustin Hoffman","mission, martial arts, kung fu, hope, villain, fleet, sequel, panda, friends, woman director","Po and his friends fight to stop a peacock villain from conquering China with a deadly new weapon, but first the Dragon Warrior must come to terms with his past.",7306,en,US
Extremely Loud & Incredibly Close,2011,Drama,7.0,7.302,129,Stephen Daldry,,"Tom Hanks, Sandra Bullock, Thomas Horn","new york city, based on novel or book, key, autism, death of father, scavenger hunt, young boy, tambourine, lock, 9/11, grieving, asperger's syndrome, post 9/11, child protagonist","A year after his father's death, Oskar, a troubled young boy, discovers a mysterious key he believes was left for him by his father and embarks on a scavenger hunt to find the matching lock.",2015,en,US
Real Steel,2011,"Action, Science Fiction, Drama",7.0,32.25,127,Shawn Levy,,"Hugh Jackman, Dakota Goyo, Evangeline Lilly","future, sports, parent child relationship, fight, robot, prizefight, father son reunion, robot fighting, 2020s","Charlie Kenton is a washed-up fighter who retired from the ring when robots took over the sport. After his robot is trashed, he reluctantly teams up with his estranged son to rebuild and train an unlikely contender.",8465,en,US
Soul Surfer,2011,"Family, Drama",7.0,7.311,112,Sean McNamara,,"AnnaSophia Robb, Helen Hunt, Dennis Quaid","depression, surfing, surfer, surfboard, beach, based on novel or book, hawaii, shark attack, thailand, comeback, based on true story, bikini, volunteer, family relationships, hospital, doctor, based on memoir or autobiography, shark, prosthetic arm, swimsuit, christian film, christian, surfing contest, female surfer, severed arm, inspirational, defiant","The true story of teen surfer Bethany Hamilton, who lost her arm in a shark attack and courageously overcame all odds to become a champion again, through her sheer determination and unwavering faith.",1186,en,US
Captain America: The First Avenger,2011,"Action, Adventure, Science Fiction",7.0,35.791,124,Joe Johnston,,"Chris Evans, Hayley Atwell, Sebastian Stan","new york city, nazi, superhero, world war ii, heroism, shield, based on comic, super soldier, period drama, brooklyn, new york city, aftercreditsstinger, marvel cinematic universe (mcu), origin story, soldiers, war, celebratory, excited, hopeful","During World War II, Steve Rogers is a sickly man from Brooklyn who's transformed into super-soldier Captain America to aid in the war effort. Rogers must stop the Red Skull – Adolf Hitler's ruthless head of weaponry, and the leader of an organization that intends to use a mysterious device of untold powers for world domination.",21637,en,US
A Princess for Christmas,2011,"Comedy, Family, TV Movie, Romance, Drama",7.0,7.162,91,Michael Damian,Michael Damian,"Katie McGrath, Sam Heughan, Miles Richardson","holiday, servant, butler, prince, castle, royalty, ballroom dancing, maid, christmas","After her sister and brother-in-law's tragic deaths, an American woman who is the guardian for her young niece and nephew is invited to a royal European castle for Christmas by her late brother-in-law's father, the Duke of Castlebury. Feeling out of place as a commoner, she is determined to give her family a merry Christmas and surprises herself when she falls for a handsome prince.",404,en,US
