Title,Year,Genres,Rating,Popularity,Runtime,Director,Writer,Actors,Keywords,Plot,Ratings Amount,Language,Country
Ghostbusters: Afterlife,2021,"Fantasy, Comedy, Adventure, Science Fiction",7.357,14.792,124,Jason Reitman,Jason Reitman,"Mckenna Grace, Finn Wolfhard, Carrie Coon","small town, afterlife, ghostbuster, nostalgia, sequel, ghost, nostalgic, aftercreditsstinger, duringcreditsstinger, dead grandfather, ancient evil, otherworldly beings, paranormal events, father absence, ghostbusters","When single mom Callie and her two kids Trevor and Phoebe arrive in a small Oklahoma town, they begin to discover their connection to the original Ghostbusters and the secret legacy their grandfather left behind.",4718,en,US
Jungle Cruise,2021,"Fantasy, Adventure",7.345,16.61,127,Jaume Collet-Serra,,"Dwayne Johnson, Emily Blunt, Edgar Ramírez","jungle, riverboat, 1910s, amazon river, based on theme park ride","Dr. Lily Houghton enlists the aid of wisecracking skipper Frank Wolff to take her down the Amazon in his dilapidated boat. Together, they search for an ancient tree that holds the power to heal – a discovery that will change the future of medicine.",5769,en,US
Minari,2021,Drama,7.338,8.193,115,Lee Isaac Chung,Lee Isaac Chung,"Steven Yeun, Han Ye-ri, Youn Yuh-jung","american dream, arkansas, church, east asian lead, farmland, farmer, semi autobiographical, heart condition, family tension, hatchery, 1980s, vegetable farm, korean american, mobile home, rural setting, grandmother grandson relationship, korean, asian american, korean food, korean immigrant","A Korean American family moves to an Arkansas farm in search of its own American dream. Amidst the challenges of this new life in the strange and rugged Ozarks, they discover the undeniable resilience of family and what really makes a home.",1636,en,US
Judas and the Black Messiah,2021,"Drama, History",7.319,8.218,126,Shaka King,,"Daniel Kaluuya, LaKeith Stanfield, Jesse Plemons","chicago, illinois, assassination, black panther party, based on true story, betrayal, betrayal by friend, hard, 1960s, african american history, rainbow coalition, awestruck, exhilarated",Bill O'Neal infiltrates the Black Panthers on the orders of FBI Agent Mitchell and J. Edgar Hoover. As Black Panther Chairman Fred Hampton ascends—falling for a fellow revolutionary en route—a battle wages for O’Neal’s soul.,1550,en,US
The Hating Game,2021,"Drama, Comedy, Romance",7.318,14.955,102,Peter Hutchings,,"Lucy Hale, Austin Stowell, Corbin Bernsen","new york city, based on novel or book, rivalry, love-hate relationship, nemesis, falling in love, young woman, young man, merger, job promotion, office romance, publishing house, holidays, enemies to lovers, romantic, adoring, working toward job promotion","Resolving to achieve professional success without compromising her ethics, Lucy embarks on a ruthless game of one-upmanship against cold and efficient nemesis Joshua, a rivalry that is complicated by her growing attraction to him.",1079,en,US
Last Night in Soho,2021,"Horror, Mystery, Thriller, Drama",7.302,9.657,116,Edgar Wright,,"Thomasin McKenzie, Anya Taylor-Joy, Matt Smith","london, england, nightmare, go-go dancer, time travel, nostalgia, fashion designer, murder, soho london, burlesque, clairvoyant, fashion design, mysterious, shocking, 1960s, somber, mirror, pub, suspenseful, amused, audacious, exuberant, tragic","A young girl, passionate about fashion design, is mysteriously able to enter the 1960s where she encounters her idol, a dazzling wannabe singer. But 1960s London is not what it seems, and time seems to be falling apart with shady consequences.",3485,en,GB
Vivo,2021,"Animation, Family, Comedy",7.3,8.275,103,Kirk DeMicco,,"Lin-Manuel Miranda, Ynairaly Simo, Zoe Saldaña","musical, monkey, animals",A music-loving kinkajou named Vivo embarks on the journey of a lifetime to fulfill his destiny and deliver a love song for an old friend.,708,en,US
The Boss Baby: Family Business,2021,"Animation, Comedy, Adventure, Family",7.3,20.227,107,Tom McGrath,Michael McCullers,"Alec Baldwin, James Marsden, Amy Sedaris","baby, boss, sequel, sibling, family",The Templeton brothers — Tim and his Boss Baby little bro Ted — have become adults and drifted away from each other. But a new boss baby with a cutting-edge approach and a can-do attitude is about to bring them together again … and inspire a new family business.,2549,en,US
Cherry,2021,"Drama, Crime",7.3,11.164,140,Joe Russo,,"Tom Holland, Ciara Bravo, Jack Reynor","post-traumatic stress disorder (ptsd), based on novel or book, war veteran, heroin, drug addiction, bank robber, us army, iraq war veteran, iraq war, army medic","Cherry drifts from college dropout to army medic in Iraq - anchored only by his true love, Emily. But after returning from the war with PTSD, his life spirals into drugs and crime as he struggles to find his place in the world.",1285,en,US
Spirit Untamed,2021,"Animation, Adventure, Family",7.3,8.242,88,Elaine Bogan,John Fusco,"Isabela Merced, Julianne Moore, Marsai Martin","horse, mustang, female protagonist, animals, wild horse, reboot, 3d animation",Lucky Prescott's life is changed forever when she moves from her home in the city to a small frontier town and befriends a wild mustang named Spirit.,522,en,US
Firebird,2021,"Drama, Romance, War",7.3,7.801,107,Peeter Rebane,Tom Prior,"Tom Prior, Oleg Zagorodnii, Diana Pozharskaya","cold war, 1970s, lgbt, lgbt in the military, gay theme, boys' love (bl)","At the height of the Cold War, a troubled soldier forms a forbidden love triangle with a daring fighter pilot and his female comrade amid the dangerous surroundings of a Soviet Air Force Base.",188,en,"EE, DE, GB"
The Loud House Movie,2021,"Animation, Family, Comedy, Adventure, Fantasy",7.3,7.776,83,Dave Needham,,"Asher Bishop, David Tennant, Michelle Gomez",musical,The Loud family travel to Scotland and discover they are descendants of Scottish royalty as they move into their giant ancestral castle.,181,en,US
Old Henry,2021,"Western, Action, Drama",7.256,7.946,99,Potsy Ponciroli,,"Tim Blake Nelson, Scott Haze, Gavin Lewis","double cross, hidden cache, headstrong son, hell unleashed, old west legend, branded gang","A widowed farmer and his son warily take in a mysterious, injured man with a satchel of cash. When a posse of men claiming to be the law come for the money, the farmer must decide who to trust. Defending a siege of his homestead, the farmer reveals a talent for gun-slinging that surprises everyone calling his true identity into question.",584,en,US
"The Good, the Bart, and the Loki",2021,"Animation, Comedy, Family",7.23,7.855,6,David Silverman,Jeff Westbrook,"Tom Hiddleston, Dan Castellaneta, Nancy Cartwright","springfield illinois, mischief",Loki is banished from Asgard once again and must face his toughest opponents yet: the Simpsons and Springfield’s mightiest heroes. The God of Mischief teams up with Bart Simpson in the ultimate crossover event paying tribute to the Marvel Cinematic Universe of superheroes and villains.,670,en,US
South Park: Post COVID,2021,"Animation, Comedy, TV Movie",7.2,7.664,59,Trey Parker,Trey Parker,"Trey Parker, Matt Stone, April Stewart","future, blunt, pandemic, covid-19","What happened to the children who lived through the Pandemic? Stan, Kyle, Cartman and Kenny survived but will never be the same Post Covid.",338,en,US
C'mon C'mon,2021,Drama,7.2,7.683,109,Mike Mills,Mike Mills,"Joaquin Phoenix, Gaby Hoffmann, Woody Norman","new york city, new orleans, louisiana, interview, los angeles, california, black and white, parenting, childhood, uncle nephew relationship, motherhood, bipolar disorder, brother sister relationship, kids speaking",Johnny and his young nephew forge a tenuous but transformational relationship when they embark on a cross-country trip to see life away from Los Angeles.,685,en,US
In the Heights,2021,"Drama, Romance",7.2,7.673,143,Jon M. Chu,,"Anthony Ramos, Corey Hawkins, Leslie Grace","musical, based on play or musical, love, aftercreditsstinger","The story of Usnavi, a bodega owner who has mixed feelings about closing his store and retiring to the Dominican Republic or staying in Washington Heights.",726,en,US
Black Widow,2021,"Action, Adventure, Science Fiction",7.2,25.136,134,Cate Shortland,,"Scarlett Johansson, Florence Pugh, Rachel Weisz","assassin, hero, spy, kgb, based on comic, female assassin, female spy, female hero, aftercreditsstinger, marvel cinematic universe (mcu), woman director","Natasha Romanoff, also known as Black Widow, confronts the darker parts of her ledger when a dangerous conspiracy with ties to her past arises. Pursued by a force that will stop at nothing to bring her down, Natasha must deal with her history as a spy and the broken relationships left in her wake long before she became an Avenger.",10361,en,US
Nomadland,2021,Drama,7.2,11.641,108,Chloé Zhao,,"Frances McDormand, David Strathairn, Linda May","factory worker, van, based on novel or book, nevada, affectation, recession, homelessness, road trip, unemployment, recreational vehicle, road movie, death of husband, western usa, nomad, late stage capitalism, clinical","A woman in her sixties embarks on a journey through the western United States after losing everything in the Great Recession, living as a van-dwelling modern-day nomad.",3036,en,US
Fear Street: 1978,2021,"Horror, Mystery",7.189,10.657,111,Leigh Janiak,,"Sadie Sink, Emily Rudd, Ryan Simpkins","based on novel or book, summer camp, 1970s, curse, teenage girl, slasher, witchcraft, sister sister relationship","In 1978, two rival groups at Camp Nightwing must band together to solve a terrifying mystery when horrors from their towns' history come alive.",1958,en,US
Clifford the Big Red Dog,2021,"Family, Adventure, Comedy, Fantasy, Animation",7.177,12.832,97,Walt Becker,,"Darby Camp, Jack Whitehall, Izaac Wang","based on novel or book, dog, giant dog, pets, live action and animation, cgi-live action hybrid, animated character","As Emily struggles to fit in at home and at school, she discovers a small red puppy who is destined to become her best friend. When Clifford magically undergoes one heck of a growth spurt, becomes a gigantic dog and attracts the attention of a genetics company, Emily and her Uncle Casey have to fight the forces of greed as they go on the run across New York City. Along the way, Clifford affects the lives of everyone around him and teaches Emily and her uncle the true meaning of acceptance and unconditional love.",1740,en,US
Fear Street: 1666,2021,"Mystery, Horror",7.1,7.897,115,Leigh Janiak,Kate Trefry,"Kiana Madeira, Benjamin Flores Jr., Olivia Scott Welch","based on novel or book, curse, teenage girl, witchcraft, witch hunt, 17th century, 1990s","In 1666, a colonial town is gripped by a hysterical witch-hunt that has deadly consequences for centuries to come, and it's up to teenagers in 1994 to finally put an end to their town's curse, before it's too late.",1738,en,US
F9,2021,"Action, Adventure, Crime",7.1,18.795,143,Justin Lin,,"Vin Diesel, Michelle Rodriguez, Tyrese Gibson","speed, family relationships, sequel, duringcreditsstinger, fast car, brother brother relationship, farcical",Dominic Toretto and his crew battle the most skilled assassin and high-performance driver they've ever encountered: his forsaken brother.,7287,en,US
Vacation Friends,2021,Comedy,7.1,8.354,103,Clay Tarver,,"Lil Rel Howery, Yvonne Orji, John Cena","mexico, vacation, wedding, drugs, proposal, drinking, interrupted vacation, best man, engaged couple, annoying, partying, disapproving parent, frustration, tropical resort, construction company owner, fiasco","When a straight-laced couple that has fun with a rowdy couple on vacation in Mexico return to the States, they discover that the crazy couple they met in Mexico followed them back home and decide to play tricks on them.",786,en,US
The Map of Tiny Perfect Things,2021,"Fantasy, Romance",7.1,7.752,99,Ian Samuels,,"Kyle Allen, Kathryn Newton, Jermaine Harris","small town, love, cancer, time loop, based on short story, loss of mother, love story, teenager",Two teenagers trapped in an endless time loop set out to find all the tiny things that make that one day perfect.,783,en,US
Peter Rabbit 2: The Runaway,2021,"Family, Adventure, Animation",7.087,9.716,93,Will Gluck,Will Gluck,"James Corden, Rose Byrne, Domhnall Gleeson",peter rabbit,"Peter Rabbit runs away from his human family when he learns they are going to portray him in a bad light in their book. Soon, he crosses paths with an older rabbit who ropes him into a heist.",814,en,"AU, US"
Don't Look Up,2021,"Comedy, Science Fiction, Drama",7.075,21.101,138,Adam McKay,,"Leonardo DiCaprio, Jennifer Lawrence, Meryl Streep","artificial intelligence (a.i.), the white house, asteroid, climate change, satire, global warming, comet, end of the world, social commentary, social satire, meteorite, astronomer, disaster, teacher student relationship, denial, mass hysteria, aftercreditsstinger, duringcreditsstinger, amused, antagonistic",Two astronomers go on a media tour to warn humankind of a planet-killing comet hurtling toward Earth. The response from a distracted world: Meh.,8437,en,US
The French Dispatch,2021,"Drama, Comedy",7.032,8.992,108,Wes Anderson,,"Benicio del Toro, Adrien Brody, Tilda Swinton","art collector, journalist, small town, france, poison, 1970s, journalism, editor-in-chief, artist, imprisonment, painter, riot, anthology, magazine, food poisoning, murderer, chef, lecture, post world war ii, child kidnapping, obituary, bicycle tour, poisoning, father son relationship, lighthearted, whimsical, vibrant","The staff of an American magazine based in France puts out its last issue, with stories featuring an artist sentenced to life imprisonment, student riots, and a kidnapping resolved by a chef.",2646,en,US
AINBO: Spirit of the Amazon,2021,"Adventure, Animation, Family, Fantasy",7.0,7.528,84,José Zelada,Larry Wilson,"Lola Raie, Alejandra Gollas, Thom Hoffman","protection, amazon rainforest, threatened ecosystem, 亞馬遜守護者：安珀傳奇","An epic journey of a young hero and her Spirit Guides, 'Dillo' a cute and humorous armadillo and ""Vaca"" a goofy oversized tapir, who embark on a quest to save their home in the spectacular Amazon Rainforest.",438,en,PE
After We Fell,2021,"Romance, Drama",7.0,24.588,99,Castille Landon,Sharon Soboil,"Josephine Langford, Hero Fiennes Tiffin, Louise Lombard","based on novel or book, family history, love, teenage crush, woman director, family tension","Just as Tessa's life begins to become unglued, nothing is what she thought it would be. Not her friends nor her family. The only person that she should be able to rely on is Hardin, who is furious when he discovers the massive secret that she's been keeping. Before Tessa makes the biggest decision of her life, everything changes because of revelations about her family.",2616,en,US
A Journal for Jordan,2021,"Drama, Romance",7.0,7.812,131,Denzel Washington,,"Michael B. Jordan, Chanté Adams, Jalon Christian",9/11,"Based on the true story of First Sergeant Charles Monroe King, a soldier deployed to Iraq begins to keep a journal of love and advice for his infant son. Back at home, senior New York Times editor Dana Canedy revisits the story of her unlikely, life-altering relationship with King and his enduring devotion to her and their child.",118,en,"CA, US"
The Addams Family 2,2021,"Animation, Family, Comedy, Fantasy, Adventure",7.0,10.181,93,Greg Tiernan,Ben Queen,"Oscar Isaac, Charlize Theron, Chloë Grace Moretz","kidnapping, supernatural, grand canyon, niagara falls, family, san antonio, texas, scientific experiment, comedy",The Addams get tangled up in more wacky adventures and find themselves involved in hilarious run-ins with all sorts of unsuspecting characters.,1311,en,US
Don't Breathe 2,2021,"Thriller, Horror",7.0,11.834,98,Rodo Sayagues,Rodo Sayagues,"Stephen Lang, Madelyn Grace, Brendan Sexton III","home, invasion, sin, sequel, gunfight, blind, home invasion, criminal, handgun, aftercreditsstinger, blind man, hammer","The Blind Man has been hiding out for several years in an isolated cabin and has taken in and raised a young girl orphaned from a devastating house fire. Their quiet life together is shattered when a group of criminals kidnap the girl, forcing the Blind Man to leave his safe haven to save her.",2601,en,US
Tom Clancy's Without Remorse,2021,"Action, Thriller, War",7.0,14.466,109,Stefano Sollima,,"Michael B. Jordan, Jamie Bell, Guy Pearce",duringcreditsstinger,An elite Navy SEAL uncovers an international conspiracy while seeking justice for the murder of his pregnant wife.,2470,en,US
Mortal Kombat,2021,"Action, Fantasy, Adventure",7.0,16.132,110,Simon McQuoid,,"Lewis Tan, Jessica McNamee, Mehcad Brooks","saving the world, magic, ninja fighter, god, alternate dimension, shaolin monk, fighting, based on video game, martial arts tournament, hand to hand combat","Washed-up MMA fighter Cole Young, unaware of his heritage, and hunted by Emperor Shang Tsung's best warrior, Sub-Zero, seeks out and trains with Earth's greatest champions as he prepares to stand against the enemies of Outworld in a high stakes battle for the universe.",5912,en,"AU, CA, US"
West Side Story,2021,"Drama, Romance, Crime",6.983,8.292,156,Steven Spielberg,Stephen Sondheim,"Ansel Elgort, Rachel Zegler, Ariana DeBose","new york city, dancing, dance, street gang, love at first sight, forbidden love, musical, based on play or musical, interracial relationship, racism, nostalgic, young love, broadway musical, 1950s, romeo & juliet, latino, romantic, bold, tragic","Two youngsters from rival New York City gangs fall in love, but tensions between their respective friends build toward tragedy.",1587,en,US
Nightmare Alley,2021,"Crime, Drama, Thriller",6.982,9.162,150,Guillermo del Toro,,"Bradley Cooper, Cate Blanchett, Toni Collette","infidelity, based on novel or book, love triangle, tarot cards, mentor, hustler, lie, supernatural, carnival, con artist, murder, fugitive, alcoholic, grifter, séance, carny, neo-noir, freak show, 1940s, spiritism, mentalist, violence, gloomy",An ambitious carnival man with a talent for manipulating people with a few well-chosen words hooks up with a female psychologist who is even more dangerous than he is.,2978,en,US
Licorice Pizza,2021,"Drama, Comedy, Romance",6.971,7.777,133,Paul Thomas Anderson,Paul Thomas Anderson,"Alana Haim, Cooper Hoffman, Sean Penn","high school, california, jealousy, 1970s, politician, coming of age, love, teenage love, young love, san fernando valley, pinball machine, young entrepreneur, closeted homosexual, brother brother relationship, jewish, age-gap relationship, period piece, lighthearted, teenager","The story of Gary Valentine and Alana Kane growing up, running around and going through the treacherous navigation of first love in the San Fernando Valley, 1973.",2297,en,"US, CA"
The Tragedy of Macbeth,2021,"Drama, War",6.9,8.217,105,Joel Coen,,"Denzel Washington, Frances McDormand, Alex Hassell","witch, husband wife relationship, scotland, ambition, treason, based on play or musical, black and white, rise to power, non-traditional casting","Macbeth, the Thane of Glamis, receives a prophecy from a trio of witches that one day he will become King of Scotland. Consumed by ambition and spurred to action by his wife, Macbeth murders his king and takes the throne for himself.",769,en,US
The Forever Purge,2021,"Action, Horror, Thriller",6.9,12.986,103,Everardo Gout,James DeMonaco,"Ana de la Reguera, Josh Lucas, Willow Beuoy","texas, sequel, prequel, murder, desert, purge, family surviving alone, guns and weapons",All the rules are broken as a sect of lawless marauders decides that the annual Purge does not stop at daybreak and instead should never end as they chase a group of immigrants who they want to punish because of their harsh historical past.,2523,en,US
Finding You,2021,"Romance, Drama",6.9,7.75,119,Brian Baugh,Brian Baugh,"Rose Reid, Jedidiah Goodacre, Katherine McNamara","celebrity, grief, ireland, movie star, based on young adult novel, christian film, death of sibling","Finley, a talented aspiring violinist, meets Beckett, a famous young movie star, on the way to her college semester abroad program in a small coastal village in Ireland. An unexpected romance emerges as the heartthrob Beckett leads the uptight Finley on an adventurous reawakening, and she emboldens him to take charge of his future, until the pressures of his stardom get in the way.",198,en,US
The Kissing Booth 3,2021,"Romance, Comedy",6.885,12.046,112,Vince Marcello,,"Joey King, Joel Courtney, Jacob Elordi","based on novel or book, college, sequel, summer","It’s the summer before Elle heads to college, and she has a secret decision to make. Elle has been accepted into Harvard, where boyfriend Noah is matriculating, and also Berkeley, where her BFF Lee is headed and has to decide if she should stay or not.",1922,en,"US, GB"
Boss Level,2021,"Action, Science Fiction, Thriller",6.867,8.095,101,Joe Carnahan,Joe Carnahan,"Frank Grillo, Mel Gibson, Naomi Watts","video game, time loop, philosophical, satirical, absurd, audacious, defiant, scathing","A former special forces agent is trapped in a time loop and relives his death over and over again. To escape the terrible situation, he must track down those responsible and stop them.",1659,en,US
Army of Thieves,2021,"Action, Crime, Comedy",6.836,14.89,127,Matthias Schweighöfer,,"Matthias Schweighöfer, Nathalie Emmanuel, Ruby O. Fee","europe, interpol, prequel, zombie, safecracker, bank teller",A mysterious woman recruits bank teller Ludwig Dieter to lead a group of aspiring thieves on a top-secret heist during the early stages of the zombie apocalypse.,2078,en,US
Eternals,2021,"Science Fiction, Action, Adventure",6.832,25.841,156,Chloé Zhao,,"Gemma Chan, Richard Madden, Angelina Jolie","superhero, supernatural, based on comic, alien, super power, lgbt, aftercreditsstinger, marvel cinematic universe (mcu), woman director, sign languages, ancient, god-like, clinical","The Eternals are a team of ancient aliens who have been living on Earth in secret for thousands of years. When an unexpected tragedy forces them out of the shadows, they are forced to reunite against mankind’s most ancient enemy, the Deviants.",8426,en,US
The Dry,2021,"Crime, Thriller, Mystery",6.822,7.521,117,Robert Connolly,,"Eric Bana, Genevieve O'Reilly, Keir O'Donnell","australia, small town, drowning, based on novel or book, funeral, gambling debt, investigation, flashback, murder, tragic past, family tragedy, haunted by the past, drought, bar fight, childhood memory",Aaron Falk returns to his drought-stricken hometown to attend a tragic funeral. But his return opens a decades-old wound - the unsolved death of a teenage girl.,701,en,AU
The Vault,2021,"Drama, Action, Thriller",6.81,9.296,114,Jaume Balagueró,,"Freddie Highmore, Astrid Bergès-Frisbey, Jose Coronado","madrid, spain, world cup, heist, bank vault, treasure hunter, treasure heist","Madrid, Spain, 2010. While the whole city follows the national team's successful participation in the World Cup, a group of daring thieves look for a way into one of the most secure and guarded places on the planet.",966,en,"FR, ES"
The Ice Road,2021,"Action, Thriller",6.809,7.787,108,Jonathan Hensleigh,,"Liam Neeson, Marcus Thomas, Laurence Fishburne","truck, truck driver, mine explosion, manitoba, ice road","After a remote diamond mine collapses in far northern Canada, an ice road driver must lead an impossible rescue mission over a frozen ocean to save the trapped miners.",1719,en,"CA, US"
The Power of the Dog,2021,"Drama, Western",6.8,13.395,127,Jane Campion,Jane Campion,"Benedict Cumberbatch, Kodi Smit-McPhee, Kirsten Dunst","husband wife relationship, based on novel or book, sadism, sexuality, widow, montana, eroticism, banjo, cigarette, ranch, marriage, bullying, death of father, sexual tension, period drama, masturbation, alcoholic, humiliation, gender roles, cowboy, homoeroticism, lgbt, misogynist, mentor protégé relationship, woman director, medical student, drunkenness, masculinity, animal cruelty, 1920s, hula hoop, mother son relationship, brother brother relationship, toxic masculinity, repressed sexuality, gay theme, brothers, homosexuality, 20th century, antagonistic, baffled","A domineering but charismatic rancher wages a war of intimidation on his brother's new wife and her teen son, until long-hidden secrets come to light.",2703,en,"AU, NZ"
Tom & Jerry,2021,"Comedy, Family, Animation",6.8,13.098,101,Tim Story,Kevin Costello,"Chloë Grace Moretz, Michael Peña, Colin Jost","aftercreditsstinger, live action and animation","Tom the cat and Jerry the mouse get kicked out of their home and relocate to a fancy New York hotel, where a scrappy employee named Kayla will lose her job if she can’t evict Jerry before a high-class wedding at the hotel. Her solution? Hiring Tom to get rid of the pesky mouse.",2464,en,US
Red Rocket,2021,"Drama, Comedy",6.8,8.365,130,Sean Baker,Chris Bergoch,"Simon Rex, Suzanna Son, Bree Elrod","texas, narcissism, relationship problems, porn star, estranged wife, selfishness, ex-husband ex-wife relationship, return home, 2010s, return to hometown, texas city, unlikeable protagonist","Finding himself down and out in Los Angeles, former porn star Mikey Saber decides to crawl back to his hometown of Texas City, Texas, where his estranged wife and mother-in-law are living. Just as this dysfunctional family seems to be making things work, Mikey meets a young woman named Strawberry working the cash register at a local doughnut shop.",509,en,US
