Title,Year,Genres,Rating,Runtime,Director,Writer,Actors,Plot,Language,Country
The Map of Tiny Perfect Things,2021,"Fantasy, Romance",7.1,99,Ian Samuels,,"Kyle Allen, Kathryn Newton, Jermaine Harris",Two teenagers trapped in an endless time loop set out to find all the tiny things that make that one day perfect.,en,US
Vacation Friends,2021,Comedy,7.1,103,Clay Tarver,,"Lil Rel Howery, Yvonne Orji, John Cena","When a straight-laced couple that has fun with a rowdy couple on vacation in Mexico return to the States, they discover that the crazy couple they met in Mexico followed them back home and decide to play tricks on them.",en,US
F9,2021,"Action, Adventure, Crime",7.1,143,Justin Lin,,"Vin Diesel, Michelle Rodriguez, Tyrese Gibson",Dominic Toretto and his crew battle the most skilled assassin and high-performance driver they've ever encountered: his forsaken brother.,en,US
Peter Rabbit 2: The Runaway,2021,"Family, Adventure, Animation",7.087,93,Will Gluck,Will Gluck,"James Corden, Rose Byrne, Domhnall Gleeson","Peter Rabbit runs away from his human family when he learns they are going to portray him in a bad light in their book. Soon, he crosses paths with an older rabbit who ropes him into a heist.",en,"AU, US"
Don't Look Up,2021,"Comedy, Science Fiction, Drama",7.075,138,Adam McKay,,"Leonardo DiCaprio, Jennifer Lawrence, Meryl Streep",Two astronomers go on a media tour to warn humankind of a planet-killing comet hurtling toward Earth. The response from a distracted world: Meh.,en,US
The French Dispatch,2021,"Drama, Comedy",7.032,108,Wes Anderson,,"Benicio del Toro, Adrien Brody, Tilda Swinton","The staff of an American magazine based in France puts out its last issue, with stories featuring an artist sentenced to life imprisonment, student riots, and a kidnapping resolved by a chef.",en,US
AINBO: Spirit of the Amazon,2021,"Adventure, Animation, Family, Fantasy",7.0,84,José Zelada,Larry Wilson,"Lola Raie, Alejandra Gollas, Thom Hoffman","An epic journey of a young hero and her Spirit Guides, 'Dillo' a cute and humorous armadillo and ""Vaca"" a goofy oversized tapir, who embark on a quest to save their home in the spectacular Amazon Rainforest.",en,PE
A Journal for Jordan,2021,"Drama, Romance",7.0,131,Denzel Washington,,"Michael B. Jordan, Chanté Adams, Jalon Christian","Based on the true story of First Sergeant Charles Monroe King, a soldier deployed to Iraq begins to keep a journal of love and advice for his infant son. Back at home, senior New York Times editor Dana Canedy revisits the story of her unlikely, life-altering relationship with King and his enduring devotion to her and their child.",en,"CA, US"
Mortal Kombat,2021,"Action, Fantasy, Adventure",7.0,110,Simon McQuoid,,"Lewis Tan, Jessica McNamee, Mehcad Brooks","Washed-up MMA fighter Cole Young, unaware of his heritage, and hunted by Emperor Shang Tsung's best warrior, Sub-Zero, seeks out and trains with Earth's greatest champions as he prepares to stand against the enemies of Outworld in a high stakes battle for the universe.",en,"AU, CA, US"
After We Fell,2021,"Romance, Drama",7.0,99,Castille Landon,Sharon Soboil,"Josephine Langford, Hero Fiennes Tiffin, Louise Lombard","Just as Tessa's life begins to become unglued, nothing is what she thought it would be. Not her friends nor her family. The only person that she should be able to rely on is Hardin, who is furious when he discovers the massive secret that she's been keeping. Before Tessa makes the biggest decision of her life, everything changes because of revelations about her family.",en,US
Don't Breathe 2,2021,"Thriller, Horror",7.0,98,Rodo Sayagues,Rodo Sayagues,"Stephen Lang, Madelyn Grace, Brendan Sexton III","The Blind Man has been hiding out for several years in an isolated cabin and has taken in and raised a young girl orphaned from a devastating house fire. Their quiet life together is shattered when a group of criminals kidnap the girl, forcing the Blind Man to leave his safe haven to save her.",en,US
22 vs. Earth,2021,"Family, Comedy, Fantasy, Animation",7.0,9,Kevin Nolting,Josh Cooley,"Tina Fey, Alice Braga, Richard Ayoade","Set before the events of ‘Soul’, 22 refuses to go to Earth, enlisting a gang of 5 new souls in attempt of rebellion. However, 22’s subversive plot leads to a surprising revelation about the meaning of life.",en,US
The Addams Family 2,2021,"Animation, Family, Comedy, Fantasy, Adventure",7.0,93,Greg Tiernan,Ben Queen,"Oscar Isaac, Charlize Theron, Chloë Grace Moretz",The Addams get tangled up in more wacky adventures and find themselves involved in hilarious run-ins with all sorts of unsuspecting characters.,en,US
West Side Story,2021,"Drama, Romance, Crime",6.983,156,Steven Spielberg,Stephen Sondheim,"Ansel Elgort, Rachel Zegler, Ariana DeBose","Two youngsters from rival New York City gangs fall in love, but tensions between their respective friends build toward tragedy.",en,US
Nightmare Alley,2021,"Crime, Drama, Thriller",6.982,150,Guillermo del Toro,,"Bradley Cooper, Cate Blanchett, Toni Collette",An ambitious carnival man with a talent for manipulating people with a few well-chosen words hooks up with a female psychologist who is even more dangerous than he is.,en,US
Licorice Pizza,2021,"Drama, Comedy, Romance",6.971,133,Paul Thomas Anderson,Paul Thomas Anderson,"Alana Haim, Cooper Hoffman, Sean Penn","The story of Gary Valentine and Alana Kane growing up, running around and going through the treacherous navigation of first love in the San Fernando Valley, 1973.",en,"US, CA"
The Forever Purge,2021,"Action, Horror, Thriller",6.9,103,Everardo Gout,James DeMonaco,"Ana de la Reguera, Josh Lucas, Willow Beuoy",All the rules are broken as a sect of lawless marauders decides that the annual Purge does not stop at daybreak and instead should never end as they chase a group of immigrants who they want to punish because of their harsh historical past.,en,US
The Tragedy of Macbeth,2021,"Drama, War",6.9,105,Joel Coen,,"Denzel Washington, Frances McDormand, Alex Hassell","Macbeth, the Thane of Glamis, receives a prophecy from a trio of witches that one day he will become King of Scotland. Consumed by ambition and spurred to action by his wife, Macbeth murders his king and takes the throne for himself.",en,US
The Electrical Life of Louis Wain,2021,"Drama, History, Comedy, Romance",6.9,111,Will Sharpe,Simon Stephenson,"Benedict Cumberbatch, Claire Foy, Andrea Riseborough","The extraordinary true story of eccentric British artist Louis Wain, whose playful, sometimes even psychedelic pictures helped to transform the public's perception of cats forever.",en,GB
Finding You,2021,"Romance, Drama",6.9,119,Brian Baugh,Brian Baugh,"Rose Reid, Jedidiah Goodacre, Katherine McNamara","Finley, a talented aspiring violinist, meets Beckett, a famous young movie star, on the way to her college semester abroad program in a small coastal village in Ireland. An unexpected romance emerges as the heartthrob Beckett leads the uptight Finley on an adventurous reawakening, and she emboldens him to take charge of his future, until the pressures of his stardom get in the way.",en,US
Mad God,2021,"Animation, Fantasy, Horror, Science Fiction, War",6.9,84,Phil Tippett,Phil Tippett,"Alex Cox, Niketa Roman, Satish Ratakonda","A figure known as ""The Assassin"" descends from the heavens into a nightmarish pit full of monsters, titans, and cruelty.",en,US
Boss Level,2021,"Action, Science Fiction, Thriller",6.867,101,Joe Carnahan,Joe Carnahan,"Frank Grillo, Mel Gibson, Naomi Watts","A former special forces agent is trapped in a time loop and relives his death over and over again. To escape the terrible situation, he must track down those responsible and stop them.",en,US
The Dig,2021,"Drama, History",6.865,112,Simon Stone,,"Carey Mulligan, Ralph Fiennes, Lily James","As WWII looms, a wealthy widow hires an amateur archaeologist to excavate the burial mounds on her estate. When they make a historic discovery, the echoes of Britain's past resonate in the face of its uncertain future‎.",en,GB
Eternals,2021,"Science Fiction, Action, Adventure",6.832,156,Chloé Zhao,,"Gemma Chan, Richard Madden, Angelina Jolie","The Eternals are a team of ancient aliens who have been living on Earth in secret for thousands of years. When an unexpected tragedy forces them out of the shadows, they are forced to reunite against mankind’s most ancient enemy, the Deviants.",en,US
The Dry,2021,"Crime, Thriller, Mystery",6.822,117,Robert Connolly,,"Eric Bana, Genevieve O'Reilly, Keir O'Donnell",Aaron Falk returns to his drought-stricken hometown to attend a tragic funeral. But his return opens a decades-old wound - the unsolved death of a teenage girl.,en,AU
The Ice Road,2021,"Action, Thriller",6.809,108,Jonathan Hensleigh,,"Liam Neeson, Marcus Thomas, Laurence Fishburne","After a remote diamond mine collapses in far northern Canada, an ice road driver must lead an impossible rescue mission over a frozen ocean to save the trapped miners.",en,"CA, US"
LEGO Star Wars Terrifying Tales,2021,"Animation, Family, Science Fiction, Comedy, TV Movie",6.8,45,Ken Cunningham,David Shayne,"Jake Green, Raphael Alejandro, Dana Snyder","Poe Dameron and BB-8 must face the greedy crime boss Graballa the Hutt, who has purchased Darth Vader’s castle and is renovating it into the galaxy’s first all-inclusive Sith-inspired luxury hotel.",en,US
The Marksman,2021,"Action, Drama, Thriller",6.8,108,Robert Lorenz,Robert Lorenz,"Liam Neeson, Jacob Perez, Katheryn Winnick","Jim Hanson’s quiet life is suddenly disturbed by two people crossing the US/Mexico border – a woman and her young son – desperate to flee a Mexican cartel. After a shootout leaves the mother dead, Jim becomes the boy’s reluctant defender. He embraces his role as Miguel’s protector and will stop at nothing to get him to safety, as they go on the run from the relentless assassins.",en,US
The Power of the Dog,2021,"Drama, Western",6.8,127,Jane Campion,Jane Campion,"Benedict Cumberbatch, Kodi Smit-McPhee, Kirsten Dunst","A domineering but charismatic rancher wages a war of intimidation on his brother's new wife and her teen son, until long-hidden secrets come to light.",en,"AU, NZ"
Respect,2021,"Drama, Music, History",6.8,145,Liesl Tommy,,"Jennifer Hudson, Forest Whitaker, Marlon Wayans",The rise of Aretha Franklin’s career from a child singing in her father’s church’s choir to her international superstardom.,en,"CA, US"
Rumble,2021,"Animation, Family",6.8,95,Hamish Grieve,,"Will Arnett, Geraldine Viswanathan, Stephen A. Smith","In a world where monster wrestling is a global sport and monsters are superstar athletes, teenage Winnie seeks to follow in her father’s footsteps by coaching a loveable underdog monster into a champion.",en,US
Tom & Jerry,2021,"Comedy, Family, Animation",6.8,101,Tim Story,Kevin Costello,"Chloë Grace Moretz, Michael Peña, Colin Jost","Tom the cat and Jerry the mouse get kicked out of their home and relocate to a fancy New York hotel, where a scrappy employee named Kayla will lose her job if she can’t evict Jerry before a high-class wedding at the hotel. Her solution? Hiring Tom to get rid of the pesky mouse.",en,US
The Vault,2021,"Drama, Action, Thriller",6.8,114,Jaume Balagueró,,"Freddie Highmore, Astrid Bergès-Frisbey, Jose Coronado","Madrid, Spain, 2010. While the whole city follows the national team's successful participation in the World Cup, a group of daring thieves look for a way into one of the most secure and guarded places on the planet.",en,"FR, ES"
Red Rocket,2021,"Drama, Comedy",6.8,130,Sean Baker,Chris Bergoch,"Simon Rex, Suzanna Son, Bree Elrod","Finding himself down and out in Los Angeles, former porn star Mikey Saber decides to crawl back to his hometown of Texas City, Texas, where his estranged wife and mother-in-law are living. Just as this dysfunctional family seems to be making things work, Mikey meets a young woman named Strawberry working the cash register at a local doughnut shop.",en,US
Venom: Let There Be Carnage,2021,"Science Fiction, Action, Adventure",6.78,97,Andy Serkis,,"Tom Hardy, Woody Harrelson, Michelle Williams","After finding a host body in investigative reporter Eddie Brock, the alien symbiote must face a new enemy, Carnage, the alter ego of serial killer Cletus Kasady.",en,US
Spencer,2021,"Drama, History",6.774,117,Pablo Larraín,Steven Knight,"Kristen Stewart, Timothy Spall, Jack Nielen","During her Christmas holidays with the royal family at the Sandringham estate in Norfolk, England, Diana decides to leave her marriage to Prince Charles.",en,GB
Malignant,2021,"Horror, Mystery",6.767,111,James Wan,,"Annabelle Wallis, Maddie Hasson, George Young","Madison is paralyzed by shocking visions of grisly murders, and her torment worsens as she discovers that these waking dreams are in fact terrifying realities with a mysterious tie to her past.",en,"US, HK"
Red Notice,2021,"Action, Comedy, Crime",6.765,118,Rawson Marshall Thurber,Rawson Marshall Thurber,"Dwayne Johnson, Ryan Reynolds, Gal Gadot","An Interpol-issued Red Notice is a global alert to hunt and capture the world's most wanted. But when a daring heist brings together the FBI's top profiler and two rival criminals, there's no telling what will happen.",en,US
The King's Man,2021,"Action, Adventure, Thriller",6.751,131,Matthew Vaughn,,"Ralph Fiennes, Gemma Arterton, Rhys Ifans","As a collection of history's worst tyrants and criminal masterminds gather to plot a war to wipe out millions, one man must race against time to stop them.",en,US
Till Death,2021,"Horror, Thriller",6.714,89,SK Dale,Jason Carvey,"Megan Fox, Eoin Macken, Aml Ameen","After a romantic evening at their secluded lake house, a woman wakes up handcuffed to her dead husband. Trapped and isolated in the dead of winter, she must fight off hired killers to escape her late spouse's twisted plan.",en,US
Descendants: The Royal Wedding,2021,"Animation, Family, Comedy, Drama",6.7,22,Salvador Simó,Sara Parriott,"Dove Cameron, Sofia Carson, Booboo Stewart","Happily-ever-after continues for Auradon's power couple as they prepare to say ""I do"" at an epic celebration with their friends and family, but Hades threatens to ruin it all.",en,US
One Shot,2021,"Action, Thriller",6.7,97,James Nunn,Jamie Russell,"Scott Adkins, Ashley Greene, Ryan Phillippe","An elite squad of Navy SEALs, on a covert mission to transport a prisoner off a CIA black site island prison, are trapped when insurgents attack while trying to rescue the same prisoner.",en,"US, GB"
YES DAY,2021,"Family, Comedy",6.7,86,Miguel Arteta,,"Jennifer Garner, Edgar Ramírez, Jenna Ortega",A mom and dad who usually say no decide to say yes to their kids' wildest requests — with a few ground rules — on a whirlwind day of fun and adventure.,en,US
Run Hide Fight,2021,"Action, Crime, Thriller",6.7,109,Kyle Rankin,,"Isabel May, Thomas Jane, Radha Mitchell","A 17-year-old girl uses her wits, survival skills, and compassion to fight for her life, and those of her fellow classmates, against a group of live-streaming school shooters.",en,US
Fear Street: 1994,2021,"Horror, Mystery",6.699,108,Leigh Janiak,,"Kiana Madeira, Olivia Scott Welch, Benjamin Flores Jr.","After a series of brutal slayings, a teen and her friends take on an evil force that's plagued their notorious town for centuries.",en,US
Hitman's Wife's Bodyguard,2021,"Action, Comedy, Crime, Thriller",6.668,99,Patrick Hughes,,"Ryan Reynolds, Samuel L. Jackson, Salma Hayek Pinault","The world’s most lethal odd couple – bodyguard Michael Bryce and hitman Darius Kincaid – are back on another life-threatening mission. Still unlicensed and under scrutiny, Bryce is forced into action by Darius's even more volatile wife, the infamous international con artist Sonia Kincaid. As Bryce is driven over the edge by his two most dangerous protectees, the trio get in over their heads in a global plot and soon find that they are all that stand between Europe and a vengeful and powerful madman.",en,US
The Harder They Fall,2021,Western,6.646,139,Jeymes Samuel,,"Jonathan Majors, Idris Elba, Regina King","Gunning for revenge, outlaw Nat Love saddles up with his gang to take down enemy Rufus Buck, a ruthless crime boss who just got sprung from prison.",en,US
Those Who Wish Me Dead,2021,"Thriller, Action",6.643,100,Taylor Sheridan,,"Angelina Jolie, Finn Little, Jon Bernthal","A young boy finds himself pursued by two assassins in the Montana wilderness, with a survival expert determined to protect him, and a forest fire threatening to consume them all.",en,"CA, US"
Sweet Girl,2021,"Action, Thriller, Drama",6.62,110,Brian Andrew Mendoza,Will Staples,"Jason Momoa, Isabela Merced, Manuel Garcia-Rulfo","A man vows to bring justice to those responsible for his wife's death while protecting the only family he has left, his daughter.",en,US
Infinite,2021,"Science Fiction, Action, Adventure, Thriller",6.605,106,Antoine Fuqua,,"Mark Wahlberg, Chiwetel Ejiofor, Sophie Cookson","Evan McCauley has skills he never learned and memories of places he has never visited. Self-medicated and on the brink of a mental breakdown, a secret group that call themselves “Infinites” come to his rescue, revealing that his memories are real.",en,US
Reminiscence,2021,"Mystery, Science Fiction",6.6,116,Lisa Joy,Lisa Joy,"Hugh Jackman, Rebecca Ferguson, Thandiwe Newton","Nicolas Bannister, a rugged and solitary veteran living in a near-future Miami flooded by rising seas, is an expert in a dangerous occupation: he offers clients the chance to relive any memory they desire. His life changes when he meets a mysterious young woman named Mae. What begins as a simple matter of lost and found becomes a passionate love affair. But when a different client's memories implicate Mae in a series of violent crimes, Bannister must delve through the dark world of the past to uncover the truth about the woman he fell for.",en,US
The Cursed,2021,"Horror, Drama, Thriller",6.6,111,Sean Ellis,Sean Ellis,"Boyd Holbrook, Kelly Reilly, Alistair Petrie","In the late 19th century, a brutal land baron slaughters a Roma clan, unleashing a curse on his family and village. In the days that follow, the townspeople are plagued by nightmares, the baron's son goes missing, and a boy is found murdered. The locals suspect a wild animal, but a visiting pathologist warns of a more sinister presence lurking in the woods.",en,US
House of Gucci,2021,"History, Drama, Crime",6.6,158,Ridley Scott,,"Lady Gaga, Adam Driver, Al Pacino","When Patrizia Reggiani, an outsider from humble beginnings, marries into the Gucci family, her unbridled ambition begins to unravel the family legacy and triggers a reckless spiral of betrayal, decadence, revenge, and ultimately… murder.",en,US
The Green Knight,2021,"Adventure, Drama, Fantasy",6.6,130,David Lowery,David Lowery,"Dev Patel, Alicia Vikander, Joel Edgerton","An epic fantasy adventure based on the timeless Arthurian legend, The Green Knight tells the story of Sir Gawain, King Arthur's reckless and headstrong nephew, who embarks on a daring quest to confront the eponymous Green Knight, a gigantic emerald-skinned stranger and tester of men.",en,US
The Unholy,2021,"Horror, Mystery",6.6,99,Evan Spiliotopoulos,,"Jeffrey Dean Morgan, Cricket Brown, William Sadler","Alice is young hearing-impaired girl who, after a supposed visitation from the Virgin Mary, is inexplicably able to hear, speak and heal the sick. As word spreads and people from near and far flock to witness her miracles, a disgraced journalist hoping to revive his career visits the small New England town to investigate. When terrifying events begin to happen all around, he starts to question if these phenomena are the works of the Virgin Mary or something much more sinister.",en,US
Kate,2021,"Action, Thriller",6.6,106,Cedric Nicolas-Troyan,Umair Aleem,"Mary Elizabeth Winstead, Miku Martineau, Woody Harrelson",A ruthless criminal operative has less than 24 hours to exact revenge on her enemies and in the process forms an unexpected bond with the daughter of one of her past victims.,en,US
The Night House,2021,"Drama, Horror, Mystery, Thriller",6.6,107,David Bruckner,,"Rebecca Hall, Sarah Goldberg, Vondie Curtis-Hall","Reeling from the unexpected death of her husband, Beth is left alone in the lakeside home he built for her. Soon she begins to uncover her recently deceased husband's disturbing secrets.",en,"US, GB"
I Care a Lot,2021,"Crime, Thriller, Drama",6.587,119,J Blakeson,J Blakeson,"Rosamund Pike, Peter Dinklage, Eiza González",A court-appointed legal guardian defrauds her older clients and traps them under her care. But her latest mark comes with some unexpected baggage.,en,US
The Protégé,2021,"Action, Adventure, Thriller",6.55,109,Martin Campbell,Richard Wenk,"Maggie Q, Samuel L. Jackson, Michael Keaton","Rescued as a child by the legendary assassin Moody and trained in the family business, Anna is the world’s most skilled contract killer. When Moody, the man who was like a father to her and taught her everything she needs to know about trust and survival, is brutally killed, Anna vows revenge. As she becomes entangled with an enigmatic killer whose attraction to her goes way beyond cat and mouse, their confrontation turns deadly and the loose ends of a life spent killing will weave themselves ever tighter.",en,"GB, US"
Queenpins,2021,"Comedy, Crime",6.518,110,Aron Gaudet,Gita Pullapilly,"Kristen Bell, Kirby Howell-Baptiste, Vince Vaughn","Bored and frustrated suburban homemaker Connie and her best pal JoJo, a vlogger with dreams, turn a hobby into a multi-million-dollar counterfeit coupon caper. After firing off a letter to the conglomerate behind a box of cereal gone stale, and receiving an apology along with dozens of freebies, the duo hatch an illegal coupon club scheme that scams millions from mega-corporations and delivers deals to legions of fellow coupon clippers. On the trail to total coupon dominance, a hapless Loss Prevention Officer from the local supermarket chain joins forces with a determined U.S. Postal Inspector in hot pursuit of these newly minted “Queenpins” of pink collar crime.",en,US
Snake Eyes: G.I. Joe Origins,2021,"Action, Adventure",6.5,121,Robert Schwentke,,"Henry Golding, Andrew Koji, Haruka Abe","After saving the life of their heir apparent, tenacious loner Snake Eyes is welcomed into an ancient Japanese clan called the Arashikage where he is taught the ways of the ninja warrior. But, when secrets from his past are revealed, Snake Eyes' honor and allegiance will be tested – even if that means losing the trust of those closest to him.",en,"CA, US"
The Eyes of Tammy Faye,2021,"Drama, History",6.5,126,Michael Showalter,Abe Sylvia,"Jessica Chastain, Andrew Garfield, Cherry Jones","From the 1960s to the 1980s, evangelist Jim Baker and his ambitious wife, Tammy Faye, rose from humble beginnings to build an empire based on big-time evangelical Christianity--only for the couple to fall from grace because of some all-too-human sins.",en,US
Escape Room: Tournament of Champions,2021,"Horror, Thriller, Mystery",6.5,88,Adam Robitel,Maria Melnik,"Taylor Russell, Logan Miller, Indya Moore","Six people unwittingly find themselves locked in another series of escape rooms, slowly uncovering what they have in common to survive... and discovering they've all played the games before.",en,US
Jolt,2021,"Action, Thriller",6.5,91,Tanya Wexler,Scott Wascha,"Kate Beckinsale, Stanley Tucci, Bobby Cannavale",A bouncer with an anger management problem goes on a furious and resentful rampage after the murder of a friend.,en,US
He's All That,2021,"Comedy, Romance",6.5,91,Mark Waters,R. Lee Fleming Jr.,"Addison Rae, Tanner Buchanan, Madison Pettis","To get revenge on her ex-boyfriend, an influencer attempts to transform an unpopular classmate into prom king.",en,US
The Simpsons in Plusaversary,2021,"Animation, Comedy, Fantasy",6.493,4,David Silverman,Dan Vebber,"Dan Castellaneta, Nancy Cartwright, Yeardley Smith","The Simpsons host a Disney+ Day party and everyone is on the list… except Homer. With friends from across the service and music fit for a Disney Princess, Plusaversary is Springfield's event of the year.",en,US
Halloween Kills,2021,"Horror, Thriller",6.442,105,David Gordon Green,David Gordon Green,"Jamie Lee Curtis, Judy Greer, Andi Matichak","Michael manages to free himself from Laurie Strode's trap to resume his ritual bloodbath. As she fights for her life from injuries from their last encounter, she inspires her daughter Karen, her granddaughter Allyson, and all of Haddonfield to rise up against the unstoppable monster.",en,US
The Guilty,2021,"Drama, Thriller",6.426,91,Antoine Fuqua,,"Jake Gyllenhaal, Ethan Hawke, Riley Keough",A demoted police officer assigned to a call dispatch desk is conflicted when he receives an emergency phone call from a kidnapped woman.,en,US
Night Teeth,2021,"Horror, Thriller, Action",6.414,107,Adam Randall,,"Jorge Lendeborg Jr., Debby Ryan, Lucy Fry","A college student moonlighting as a chauffeur picks up two mysterious women for a night of party-hopping across LA. But when he uncovers their bloodthirsty intentions—and their dangerous, shadowy underworld—he must fight to stay alive.",en,"GB, US"
Bull,2021,"Crime, Horror, Thriller",6.4,87,Paul Andrew Williams,Paul Andrew Williams,"Neil Maskell, David Hayman, Tamzin Outhwaite","Ten years after he was last seen, a vicious mob enforcer returns home to find his son and methodically track down the gang that double-crossed him. His quest for revenge soon leads to a savage showdown between his wife and her mob boss father.",en,GB
Never Back Down: Revolt,2021,Action,6.4,89,Kellie Madison,Audrey Arkins,"Olivia Popica, Michael Bisping, Brooke Johnston",An amateur fighter is lured by a trafficking syndicate specializing in elite underground fighting where her brutal captor forces her to fight or face certain death.,en,US
